website,category,article_number,image number,alt,article_heading,article_url
https://news.yahoo.co.jp/,Business,1,1,,"German VW, full -year profit margin prospects due to poor performance in the downward revision passenger car category",https://news.yahoo.co.jp/articles/a6d0ac869cf0b31fda5eb31aad0ca3bfad3ca9da
https://news.yahoo.co.jp/,Business,2,1,,"Expectations for increased stock transactions in Asia, lower US interests and Chinese economy stimulation measures",https://news.yahoo.co.jp/articles/8846c0682d4c7079f7dbf34578593c22f2430c6e
https://news.yahoo.co.jp/,Business,3,1,,"Canada July GDP0.2 % increase, expectation for significant interest rate decreases increases",https://news.yahoo.co.jp/articles/c45bf216c097a780f13ffc2c4695fa0f99633f3b
https://news.yahoo.co.jp/,Business,4,1,,Announced that it has attacked the Hizvola headquarters in southern Baleut in Israel,https://news.yahoo.co.jp/articles/483e99d232440329787485d45432a8cb2fcb1e80
https://news.yahoo.co.jp/,Business,5,1,,"A different industry has embarked on ""land cultivation""!“Local salmon” expansion to the whole country ... What is the taste of specialty products?""Every. I'm curious!]",https://news.yahoo.co.jp/articles/86dde892315ef5af2461527a637f2af98d22e04d
https://news.yahoo.co.jp/,Business,6,1,,"The average amount of employee pension is about 140,000 yen.5 measures that can be taken when you want to increase your pension for retirement",https://news.yahoo.co.jp/articles/ee73692ac56aa6761145a2b440224906af11f5f4
https://news.yahoo.co.jp/,Business,7,1,,"Yamatane pottery experience works by Tokoname -yaki, can be received in a minimum of 2 days before returning to Japan before returning to Japan.",https://news.yahoo.co.jp/articles/37727e6ff536e76e71f2f9fe5f76d9be779db441
https://news.yahoo.co.jp/,Business,8,1,,The entire existing store increased in sales from 9 central specialty stores on August sales holidays and intense heat,https://news.yahoo.co.jp/articles/cb494140c71c5f046574f2084350653952e70e52
https://news.yahoo.co.jp/,Business,9,1,,"Reading the financial results Palemo HD, HD 15 stores in February -August FY022 The resignation of the store has been reduced due to the decline in sales declining, and the income decreases in the final profit of the final profit.",https://news.yahoo.co.jp/articles/2e962ba10afab2a7674284c3416588ea6d95f3f1
https://news.yahoo.co.jp/,Business,10,1,,"Family Mart, Pineapple's ""core"" is compatible with commercialized food loss problems",https://news.yahoo.co.jp/articles/f2844ef0cd74d7c95c6e9e4799dbe1f492f60d67
