image number,alt,article_heading,description
image_1_1.jpg,no alt text,Rwanda's Marburg fever deaths rise to 11 as its source is being investigated,"The image depicts a person dressed in a protective suit, commonly worn by individuals working in environments that require a high level of cleanliness or safety, such as laboratories or medical facilities. The suit is predominantly white with blue accents, and it covers the entire body, including the head, which is shielded by a hood. The person is wearing goggles over the hood, which suggests that they are also protecting their eyes from potential hazards.  The individual is holding a small, round object in their right hand, which appears to be a disposable cup or a small container. The cup has a pattern on it, possibly a logo or design, and it is placed on a white plate. The person's left hand is holding the plate, which is being used to support the cup.  The background is not in focus, but it seems to be an outdoor setting with a building that has a blue and white striped pattern, possibly a wall or a fence. The lighting suggests it might be daytime, and the overall scene gives the impression of a professional or industrial environment. The image does not contain any text."
image_2_1.jpg,Yvonne Cobb ambassador for the British Deaf Association speaks to front of house cinema staff about deaf awareness training on Wednesday Oct. 2 2024 in London.(Photo by Scott A Garfitt/Invision/AP),A new initiative will allow UK deaf audiences to see captioned films before general release,"The image depicts an indoor setting where a presentation or lecture is taking place. The room is filled with red seats, arranged in rows, facing towards the front where a speaker is standing. The speaker appears to be a woman with curly hair, wearing a dark top and a patterned skirt. She is standing behind a lectern with a microphone, suggesting she is the main speaker.  On the wall behind the speaker, there is a large screen displaying a presentation. The screen shows a series of images with text overlaid, which seems to be the content of the presentation. The text on the screen reads ""COMMUNICATION TACTICS"" and includes phrases such as ""I can't hear you... too loud you... too fast you... too slow you... too much."" This suggests that the presentation is about effective communication strategies.  The audience members are seated and appear to be engaged in the presentation, with some raising their hands, possibly to ask questions or participate in the discussion. The overall atmosphere seems to be one of active learning and engagement."
image_2_2.jpg,Front of house cinema staff learn British Sign Language at Cineworld Leicester Square on Wednesday Oct. 2 2024 in London. (Photo by Scott A Garfitt/Invision/AP),A new initiative will allow UK deaf audiences to see captioned films before general release,"The image depicts two hands clasped together in a gesture that suggests a moment of connection or affection. The hands are positioned in the center of the frame, with the fingers interlaced, creating a sense of unity. The skin appears smooth and well-groomed, indicating that the individuals are likely in a clean environment or have taken care of their appearance.  The background is blurred, which puts the focus on the hands and their interaction. The colors in the image are warm, with a predominance of reds and browns, which could suggest a cozy or intimate setting. The lighting is soft and seems to be coming from the side, casting gentle shadows and highlighting the contours of the hands.  The image does not contain any text or additional objects that provide context or information about the scene. The style of the image is realistic with a shallow depth of field, which is a common technique used to draw attention to the subject of the photograph. The overall impression is one of warmth, closeness, and a shared moment between two individuals."
image_2_3.jpg,Front of house cinema staff learn British Sign Language at Cineworld Leicester Square on Wednesday Oct. 2 2024 in London. (Photo by Scott A Garfitt/Invision/AP),A new initiative will allow UK deaf audiences to see captioned films before general release,"The image depicts a group of individuals seated in an auditorium or theater, engaged in what appears to be a presentation or event. The audience members are dressed in a variety of casual and semi-formal attire, suggesting a diverse gathering. Some individuals are holding up their smartphones, possibly to take photos or record the event. The lighting in the room is dim, with a focus on the stage or speaker area, which is not visible in the image. The audience members are seated on red seats, which are typical of such venues. The image is slightly blurred, which gives it a sense of motion or activity. There are no visible texts or logos in the image. The overall atmosphere suggests a professional or formal event, with the audience members attentively participating."
image_2_4.jpg,Front of house cinema staff learn British Sign Language at Cineworld Leicester Square on Wednesday Oct. 2 2024 in London. (Photo by Scott A Garfitt/Invision/AP),A new initiative will allow UK deaf audiences to see captioned films before general release,"The image depicts an indoor setting, likely a theater or auditorium, with a focus on two individuals seated in the audience. The person in the foreground is a man with curly hair, wearing a gray hoodie with the word ""CROTON"" printed on the front. He is smiling and appears to be engaged in a conversation or reacting to something happening on stage. His hands are clasped together in front of him, and he is looking towards the right side of the image, possibly at another person or an event.  The second individual is partially visible on the right side of the image, with only their upper body and arm visible. They are wearing a dark top and have blonde hair. The person's hand is raised slightly, suggesting they might be participating in a discussion or reacting to the event.  The background is dimly lit, with red and orange lighting that creates a warm ambiance. The audience seating is visible, with red seats and a pattern of lights along the back wall, which is typical of a theater or auditorium setup. The lighting and the audience's attire suggest that the event might be a live performance or a film screening."
image_2_5.jpg,Front of house cinema staff learn British Sign Language at Cineworld Leicester Square on Wednesday Oct. 2 2024 in London. (Photo by Scott A Garfitt/Invision/AP),A new initiative will allow UK deaf audiences to see captioned films before general release,"The image depicts an indoor setting, likely a theater or auditorium, with a man seated in the foreground and several other individuals in the background. The man in the foreground is wearing a gray hoodie with a logo on the front, dark pants, and appears to be gesturing with his hands, possibly indicating a moment of excitement or engagement with the content being shown. He has a beard and is looking towards the right side of the image, which suggests he is focused on something happening out of frame.  The audience members in the background are seated in red upholstered chairs, which are typical of theater seating. The lighting in the room is dim, with red and orange hues, creating a warm and intimate atmosphere. The audience members are dressed in a variety of casual and semi-formal attire, indicating a diverse group of attendees.  The image captures a moment of shared experience, with the man in the hoodie appearing to be the most engaged with the event, while the others are seated and attentive. The overall tone of the image is one of anticipation and enjoyment, common in settings where people gather to watch a performance or film."
image_2_6.jpg,Yvonne Cobb ambassador for the British Deaf Association speaks to front of house cinema staff about deaf awareness training on Wednesday Oct. 2 2024 in London.(Photo by Scott A Garfitt/Invision/AP),A new initiative will allow UK deaf audiences to see captioned films before general release,"The image depicts an indoor setting, likely a conference room or a seminar hall, where a presentation is taking place. The room is illuminated with a red and black color scheme, creating a dramatic and focused atmosphere. On the left side of the image, there is a large screen displaying a presentation slide with the title ""DO"" in bold letters. The slide outlines a list of instructions or tips, such as ""Get the deal person's attention,"" ""Switch off TV and radio,"" and ""Face the deal person at all times.""  In the foreground, a woman stands at the front of the room, facing the audience. She appears to be the presenter, as she is standing in front of a podium with a microphone. The audience is seated in rows, facing the presenter, and appears to be engaged in the presentation. The audience members are dressed in casual attire, suggesting a relaxed or informal event.  The room has a modern design with a star-shaped logo on the wall, which could be the logo of the organization hosting the event. The lighting is dim, with red and black accents, which adds to the professional and serious ambiance of the setting. The overall impression is that of a corporate or educational seminar or workshop."
image_3_1.jpg,no alt text,Lilly's weight-loss drug removed from FDA's shortage list,"The image shows a person holding a white and green medical device, which appears to be a Zippin device, a type of medical implant. The device is cylindrical with a green band around the middle and has text on it that reads ""Zippin"" and ""implantable injection."" The person is wearing a red top, and only the hands and forearms are visible in the image. The focus is on the device, and the background is blurred, emphasizing the medical device. The style of the image is a close-up photograph with a shallow depth of field, which puts the emphasis on the device and its details."
image_4_1.jpg,Top down image of four salmon darnes on a white long oval serving ceramic plate on a wooden table. It rests on a bed of samphire. Lemon slices garnish the fish.,What's the healthiest fish to eat? Here are 4 types dietitians recommend — and what they say you should avoid.,"The image shows a close-up of a dish that appears to be a grilled salmon fillet served on a white plate. The salmon is cooked and has grill marks, indicating it has been prepared on a grill. Accompanying the salmon are slices of lemon and what looks like a green vegetable, possibly asparagus, which adds a pop of color to the dish. The plate is placed on a wooden surface, which could be a table or countertop, and there is a hint of another plate or dish in the background, suggesting that this might be part of a meal. The overall presentation is simple and appetizing, with a focus on the fresh ingredients and the grilled texture of the salmon."
image_5_1.jpg,no alt text,Taiwan hospital fire leaves at least 9 dead as typhoon batters island's south,"The image depicts a scene of a fire emergency. In the foreground, there is a street clock with a round face and a metal frame, partially obscured by the scene. The clock's hands are visible, indicating the time. Behind the clock, there is a utility pole with various electrical components, including transformers and insulators, which are typical for power distribution systems.  The main focus of the image is a large fire that is engulfing a building. The fire is intense, with bright orange and red flames visible against the dark sky. The fire appears to be consuming the structure, with visible smoke and embers in the air. The building itself is not clearly visible due to the smoke and flames, but it appears to be a multi-story structure with a flat roof.  In the background, there is a building with a visible facade, which seems to be unaffected by the fire. The architecture suggests it could be a commercial or residential building. The sky is overcast, and the lighting suggests it is either dawn or dusk, as the natural light is not strong enough to illuminate the scene.  The image captures the urgency and danger of a fire emergency, with the fire department likely responding to extinguish the blaze and protect lives and property. The scene is a stark reminder of the importance of fire safety and preparedness."
image_6_1.jpg,no alt text,Dozens of captive tigers and lions die in Vietnam bird flu detected,"The image depicts a man standing in front of a large number of chickens. The man appears to be of Asian descent and is wearing a light blue shirt. He is holding a large bird, which seems to be a type of crane or stork, with its wings spread out. The chickens are contained within wire cages and are of various sizes, suggesting a mix of ages. The setting appears to be an outdoor area with a building in the background that has a red and yellow facade. There is a scale visible in the foreground, which might be used for weighing the chickens. The overall scene suggests a market or farm environment where chickens and birds are being sold or raised."
image_7_1.jpg,Port-a-potties outside of Mission Hospital (Minyvonne Burke / NBC News),At Asheville's Mission Hospital workers describe the dire conditions after the storm,"The image depicts a row of public restrooms lined up along a paved path. The restrooms are painted in a variety of bright colors, including yellow, green, blue, and brown. Each restroom has a distinct color and is equipped with a trash can in front of it. The trash cans are also in different colors, complementing the restrooms. The path is marked with a yellow line and has a sign that reads ""ATM"" at the end. In the background, there is a building with large windows, and the sky is partly cloudy. The overall scene suggests a well-maintained public space with accessible facilities."
image_7_2.jpg,An ambulance drives on a dirt road between buildings (Stirling Barlow),At Asheville's Mission Hospital workers describe the dire conditions after the storm,"The image depicts a scene of a construction site. The foreground shows a muddy road with tire tracks, indicating recent vehicle activity. The road is flanked by a mix of buildings, some with visible signs such as ""Wendy's"" and ""Living Store."" There are traffic lights with a ""Do Not Enter"" sign above them, suggesting a controlled access point to the construction site. The background features a lush, green landscape with trees and hills, providing a stark contrast to the industrial scene in the foreground. The sky is overcast, suggesting an overcast or cloudy day. The image is taken from a perspective that allows the viewer to look down the road towards the construction site, giving a sense of depth and perspective."
image_8_1.jpg,A close-up of a stick in a creek shows the rainbow-colored sheen from chemicals,Toxic chemicals from Ohio train derailment lingered in buildings for months – here’s what our investigation found in East Palestine,"The image depicts a close-up view of a natural scene, focusing on a branch with a smooth, curved shape that appears to be a dead or dried-out tree limb. The branch is set against a background that is richly textured and colorful, resembling a rainbow or a spectrum of light. The colors are vibrant and seem to blend into one another, creating a mesmerizing effect that could be interpreted as a visual representation of a rainbow or a spectrum of light. The background also contains hints of what might be tree branches or foliage, suggesting that the branch is part of a larger natural setting. The image has a dreamlike quality due to the surreal and vivid colors."
image_8_2.jpg,A map of several states shows the wreck site on the Ohio-Pennsylvania line with the highest likelihood of chemical concentrations there but chemicals likely still wafting over Pennsylvania New York and other states.,Toxic chemicals from Ohio train derailment lingered in buildings for months – here’s what our investigation found in East Palestine,"The image you've provided appears to be a map with a color-coded overlay, likely representing some form of data or information. The map is centered on a location labeled ""Crash location,"" which is indicated with a red star. This location is situated in the state of Pennsylvania, near the city of Erie.  The color overlay seems to be a frequency map, with different colors representing different levels of frequency. The legend on the right side of the image shows a scale of frequencies ranging from 0% to 100%, with corresponding colors. The legend also includes a key for the frequencies, with percentages corresponding to the colors on the map.  The map itself is a standard topographic map with roads and cities labeled. The cities and towns are marked with their names, and the roads are indicated with lines. The map is detailed enough to show the layout of the roads and the locations of the cities.  The image does not provide any additional context or information about the nature of the data represented by the color overlay or the significance of the crash location. It's a visual representation of geographic information, but without additional context, it's difficult to provide a more detailed description."
image_8_3.jpg,A creek with a device shooting water into the air by injecting air into the water.,Toxic chemicals from Ohio train derailment lingered in buildings for months – here’s what our investigation found in East Palestine,"The image depicts a tranquil scene of a small, shallow river flowing through a wooded area. The river, appearing to be a mix of brown and clear water, is lined with a variety of rocks and debris, suggesting a natural, untamed environment. On the left side of the image, there's a bridge with a railing, indicating a crossing point for a road or path. The bridge is partially obscured by the dense foliage of the trees, which are a mix of deciduous species, their branches bare, suggesting it might be autumn or winter. The sky is visible in the top left corner, showing a clear blue sky with a few clouds, indicating fair weather conditions. The overall atmosphere of the image is serene and untouched, with no visible human activity or structures, giving it a sense of being in a remote or secluded area."
image_8_4.jpg,Several railcars are jumbled together on and off the tracks some askew others overturned some on fire.,Toxic chemicals from Ohio train derailment lingered in buildings for months – here’s what our investigation found in East Palestine,"The image depicts a scene of a train derailment. The train, which appears to be a freight train, has derailed and is in a state of wreckage. The locomotive is visible, and it's clear that the train has been severely damaged. There are multiple cars that have been knocked over, and the train's cargo is spilled out onto the ground. The surrounding area is a mix of grassy fields and wooded areas, indicating that the derailment occurred in a rural or semi-rural setting.  There are visible signs of fire, with thick black smoke rising from the wreckage, suggesting that the train's fuel or cargo may be on fire. The fire is not contained, and it's spreading, indicating that the situation is quite dangerous and potentially hazardous.  There are no visible people in the image, but the presence of emergency vehicles and personnel is implied, as they are likely responding to the incident. The image is taken from an aerial perspective, providing a comprehensive view of the scene and the extent of the damage. The image is a color photograph, and the lighting suggests it was taken during the day. The overall tone of the image is somber and serious, reflecting the gravity of the situation."
image_8_5.jpg,A diagram shows how chemicals in water and the air can get into homes and buildings.,Toxic chemicals from Ohio train derailment lingered in buildings for months – here’s what our investigation found in East Palestine,"The image you've provided appears to be an infographic or educational illustration that depicts various construction and maintenance activities related to a building and its surroundings. Here's a detailed description:  - **Building**: At the center of the image is a building with a visible roof and a chimney. The building is labeled with the word ""Power"" and ""Wash,"" suggesting it might be a place where electricity is generated or a facility for cleaning.  - **People**: There are several people depicted in the image, each engaged in different tasks. One person is standing near the building, possibly observing or working on it. Another person is near the foundation, which is labeled with the word ""Crack,"" indicating a repair or maintenance task.  - **Transport**: There's a truck labeled ""Street Sweeper,"" which is likely used for cleaning the streets or sidewalks.  - **Water**: The image shows a body of water with a label ""Chemical transport to sediment and groundwater,"" indicating the transportation of chemicals that may have an impact on the sediment and groundwater.  - **Atmospheric Transport**: There's a depiction of a cloud labeled ""Atmospheric transport,"" suggesting the movement of substances through the air.  - **Fire**: There's a fire depicted with a label ""Storm water,"" indicating that the fire might be related to stormwater runoff.  - **Sediment**: There's a label ""Sediment washing"" near a person, which suggests that the person is involved in cleaning or managing sediment.  "
image_8_6.jpg,A photo of a document shows the discrepancy between people smelling chemicals and their hand-held detectors which did not detect chemicals.,Toxic chemicals from Ohio train derailment lingered in buildings for months – here’s what our investigation found in East Palestine,"The image you've provided appears to be a screenshot of a form titled ""Residential Air Monitoring."" The form is designed to collect information about a residential property's air quality. Here's a detailed description of the visible elements:  - At the top, there's a logo that reads ""CTEH,"" which likely stands for the organization or company responsible for the form. - The form is divided into sections with headings such as ""Residential Air Monitoring,"" ""Resident Name,"" ""Address,"" ""Date,"" ""Time,"" ""Location Description,"" ""Analyte,"" ""Result,"" ""Comments,"" and ""Sampler."" - The ""Resident Name"" field is blank, suggesting that the form is meant to be filled out by the resident or someone authorized to represent them. - The ""Address"" field is also blank, indicating the specific location of the residence. - The ""Date"" field is blank, which would typically be filled in with the current date. - The ""Time"" field is blank, which would be filled in with the current time. - The ""Location Description"" field is blank, where the resident would provide a brief description of the location. - The ""Analyte"" field is blank, which would specify the type of air quality parameter being measured. - The ""Result"" field is blank, where the measurement of the analyte would be recorded. - The ""Comments"" field is blank, where any additional information or observations can be noted. - The ""Sampler"" field"
image_8_7.jpg,"A black plume of smoke spreads out from burning railcars. <a href=""https://newsroom.ap.org/detail/TrainDerailmentOhio/83dd1e4e0f4f4d4fafb1f11de20eabc0/photo"" rel=""nofollow noopener"" target=""_blank"" data-ylk=""slk:AP Photo/Gene J. Puskar;elm:context_link;itc:0;sec:content-canvas"" class=""link "">AP Photo/Gene J. Puskar</a>",Toxic chemicals from Ohio train derailment lingered in buildings for months – here’s what our investigation found in East Palestine,"The image depicts a dramatic scene of a large, dark, and billowy cloud of smoke or ash, which appears to be a significant wildfire. The cloud is dense and extends high into the sky, with its dark hue contrasting against the lighter blue of the sky. The cloud is situated over a residential area, with houses and trees visible below.  In the foreground, there is a street with a few cars parked along the side. A fire hydrant is also visible on the sidewalk. There is a person standing near the edge of the street, wearing a high-visibility vest, suggesting they might be a firefighter or emergency personnel. The person is looking towards the cloud, possibly assessing the situation or preparing for action.  The houses in the foreground are residential, with visible windows and doors. The trees are bare, indicating that the photo might have been taken during a season when trees typically lose their leaves, such as late fall or winter.  The overall scene is one of urgency and concern, as the wildfire seems to be encroaching on the residential area, and the presence of emergency personnel indicates an active response to the situation. The image captures the stark contrast between the natural disaster and the everyday life of the community."
image_9_1.jpg,no alt text,US school-entry vaccination rates fall as exemptions keep rising," The image shows a small, yellow plastic container with a label that reads ""MMR"" in green letters. The container appears to be a syringe, typically used for administering vaccines or medications. Next to the container is a small, clear glass vial with a blue cap, which is labeled with text that is not fully legible in the image. The text on the vial seems to include information about the contents, such as the name of the medication or vaccine, dosage instructions, and possibly the manufacturer's name. The setting appears to be a clinical or medical environment, as suggested by the sterile appearance of the items and the presence of what looks like a medical tray or counter in the background. The image is taken from a slightly elevated angle, providing a clear view of the items on the surface below."
