image number,alt,article_heading,description
image_1_1.jpg,Alabama city council cancels meeting after questions about Haitian migrants,Alabama resident reacts to 'totalitarian' council president disbanding meeting over migrant questions,"The image you've provided appears to be a collage of three separate photographs, each depicting a different scene within what seems to be a governmental or civic setting. Here's a detailed description of each photo:  1. **Top Left Photo**: This photo shows a man standing at a podium with a microphone. He is wearing a light blue striped shirt and seems to be addressing an audience or participating in a meeting. The setting looks like a formal meeting room with a wooden panel in the background.  2. **Top Right Photo**: In this image, there are two individuals seated at a table. The person on the left is standing and appears to be speaking or gesturing, while the person on the right is seated and seems to be listening or waiting for their turn to speak. Both individuals are facing towards the camera, suggesting they are addressing an audience or participating in a discussion. The room has a formal appearance with a wooden panel and flags in the background, indicating a governmental or official setting.  3. **Bottom Photo**: This photo shows a woman standing at a podium with a microphone, similar to the man in the top left photo. She is wearing a blue shirt and seems to be addressing an audience or participating in a meeting. The setting is consistent with the other photos, featuring a wooden panel and flags in the background, which suggests a formal or governmental environment.  Each photo captures a moment of public speaking or discussion, and the consistent elements of the room design and flags suggest that these events are taking"
image_1_2.jpg,Darryl Phillips AlabamaF,Alabama resident reacts to 'totalitarian' council president disbanding meeting over migrant questions,"The image is a split-screen showing two different scenes. On the left side, there is a man standing at a podium with a microphone, giving a speech or presentation. He appears to be in a formal setting, possibly a conference or seminar, as suggested by the wooden paneling in the background. The man is bald and wearing a light-colored shirt.  On the right side, there is a close-up of another man's face. He has a beard and mustache, and his expression is serious. He is wearing a blue and white checkered shirt. The background is blurred, but it seems to be an indoor setting with a wall that has a metallic finish.  The image does not contain any text or additional context that would provide further information about the events or the individuals depicted. The style of the image is a simple, straightforward comparison of two different moments captured in time."
image_1_3.jpg,Tiffany Nix,Alabama resident reacts to 'totalitarian' council president disbanding meeting over migrant questions,"The image depicts a person standing in front of a wooden gavel, which is resting on a wooden surface. The person appears to be a woman with dark skin, wearing a maroon top. She has a warm smile and is looking directly at the camera. Her hair is styled in a bun. The gavel is brown with a gold band around the middle, and it's positioned diagonally across the image, with the handle pointing towards the bottom right corner and the striking head towards the top left. The background is a plain white, which contrasts with the wooden tones of the gavel and the surface it rests on. There is a watermark in the bottom right corner that reads ""Photo illustration."""
image_1_4.jpg,Alabama Tiffany Nix Haitian migrants,Alabama resident reacts to 'totalitarian' council president disbanding meeting over migrant questions,"The image depicts a group of five individuals seated at a long, rectangular wooden desk. The desk is positioned against a wall with a warm, wooden paneling. On the wall, there are two flags, one of which is the American flag, and the other is a flag with a white background and a red cross. Above the flags, there is a framed document or plaque with text that is not clearly legible.  The individuals at the desk appear to be engaged in a meeting or discussion. They are dressed in business casual attire, with some wearing ties. The person on the far left is holding a laptop, suggesting they might be presenting or working on something. The person on the far right is holding a pen and appears to be taking notes or signing a document.  In the foreground, there is a logo or emblem on the desk, which seems to be related to the organization or institution they are part of. The overall setting suggests a formal or professional environment, possibly a boardroom or a council chamber. The lighting is bright and even, indicating an indoor setting with natural or artificial lighting."
image_2_1.jpg,Suspected cartel gunmen cross illegally into United States,Texas Gov Abbott defies Biden administration amid border battle over island used by cartels,"The image depicts a man in a wooded area, holding a firearm. He is wearing a cap and a short-sleeved shirt. The man appears to be in motion, possibly walking or running, as suggested by the blurred background. The background is a mix of trees and what seems to be a fence or barrier, indicating that the man is in a natural, outdoor setting. The image has a grainy texture, which could suggest it is an older photograph or has been altered to have a vintage or aged appearance. The man's expression is not clearly visible, but his posture and the way he holds the firearm suggest a sense of urgency or readiness."
image_2_2.jpg,Fronton Island from above,Texas Gov Abbott defies Biden administration amid border battle over island used by cartels,"The image appears to be a satellite or aerial map of a rural landscape, possibly used for land management or planning purposes. The map is overlaid with a red boundary line that outlines a specific area of interest. This area is labeled with a text box that reads ""-170 Acres,"" indicating the size of the land parcel in question.  The land parcel is situated near a body of water, which could be a river or a lake, given the presence of a shoreline. The surrounding landscape is a mix of agricultural fields, which are likely used for growing crops, and areas of dense vegetation, possibly indicating a natural habitat or a buffer zone between the agricultural land and the water.  The map also includes a legend in the top left corner, which is a common feature in such maps to provide context and information about the symbols and colors used. However, the specific details of the legend are not visible in the image provided.  The map is centered on the land parcel, with the surrounding area extending outward in all directions. The scale of the map is not visible, but the size of the land parcel and the distance to the water suggest that it is a detailed map, possibly used for land management or real estate purposes."
image_2_3.jpg,Abbott-Border-inset,Texas Gov Abbott defies Biden administration amid border battle over island used by cartels,"The image depicts a scene with a group of individuals, some of whom appear to be military personnel, standing in front of a fence. The fence is covered with barbed wire, suggesting a border or a perimeter. The setting looks like a desert or a similar arid environment, with a clear sky and sparse vegetation.  In the foreground, there is a man with a serious expression, looking directly at the camera. He has short hair and is wearing a dark suit with a blue shirt. His attire and demeanor suggest he might be a politician or a high-ranking official.  Behind him, there are several individuals who seem to be soldiers, identifiable by their uniforms and helmets. They are standing in a line, with some of them looking towards the camera. The soldiers are equipped with military gear, including helmets, and they appear to be in a state of readiness.  The image has a split effect, with the man in the foreground occupying a larger portion of the frame, while the soldiers in the background are smaller and less detailed. This effect draws attention to the man in the foreground, possibly indicating his importance or significance in the context of the image.  The overall tone of the image is somber and serious, with the focus on the man and the soldiers, and the environment around them. The image does not provide any specific details about the location or the identities of the individuals present."
image_2_4.jpg,Map of Fronton Island,Texas Gov Abbott defies Biden administration amid border battle over island used by cartels," The image is an aerial or satellite photograph that provides a top-down view of a geographic region. The image shows a landscape with a river running through the center, dividing the land into two distinct areas. On the left side of the river, there is a large, open area with a mix of greenery and brownish terrain, which appears to be a natural landscape with vegetation and possibly some agricultural fields. On the right side of the river, there is a more densely populated area with a mix of greenery and built-up structures, indicating a more developed region with residential or commercial areas.  The river is labeled ""RIO GRANDE,"" and the surrounding land is labeled ""FRONTOON ISLAND."" The image also includes the names ""TEXAS"" and ""MEXICO,"" indicating the borders of the two states. The text ""PHOTO TAKEN BY TEXAS MILITARY DEPARTMENT"" is visible at the bottom of the image, suggesting that the photograph was taken by the military department of the state of Texas.  The image is a composite of natural and man-made elements, with the river serving as a natural boundary between the two areas. The photograph is taken from an angle that provides a clear view of the river and the surrounding land, allowing for a detailed analysis of the landscape and its features."
image_2_5.jpg,Jocelyn Nungaray's mother reveals timeline of daughter's murder in hearing on open border crime,Texas Gov Abbott defies Biden administration amid border battle over island used by cartels,"The image depicts a formal setting, likely a courtroom or a legislative assembly, with several individuals seated around a table. The central figure is a woman with long dark hair, wearing glasses and a dark blazer over a lighter top. She appears to be listening attentively to a proceeding or discussion. To her right, there is a man in a dark suit with a purple tie, and to her left, a woman in a dark suit with glasses, who seems to be engaged in the same proceeding. There are water bottles on the table in front of each person, indicating a long session. The room has a formal atmosphere, with a focus on the individuals and their attire. There are no visible texts or logos that provide additional context within the image."
image_3_1.jpg,Texas hotel served papers over 'habitual criminal activity' Venezuelan gang presence,Venezuelan gang Tren de Aragua take over Texas hotel county officials work to shut down business,"The image appears to be a screenshot from a security camera, showing a corridor with multiple individuals. The timestamp in the upper left corner indicates that the image was captured at 06:15:24 on a date that is not fully visible. The corridor is narrow, with walls on both sides, and there are doors along the length of the corridor. The lighting is artificial, suggesting an indoor setting.  In the foreground, there is a person who seems to be in motion, possibly running or walking quickly. This individual is not wearing a shirt and has their arms raised above their head. The rest of the individuals in the corridor are not clearly distinguishable due to the image quality and the distance from the camera.  The image has a grainy quality, which is typical for security camera footage, and there are no visible texts or distinctive features that provide additional context about the location or the identities of the individuals. The image is taken from a perspective that is slightly elevated and angled, giving a view of the corridor and the people within it."
image_3_2.jpg,Suspected members of the Tren de Aragua gang drink and party with children present,Venezuelan gang Tren de Aragua take over Texas hotel county officials work to shut down business,"The image depicts a scene from a security camera, likely taken in a hallway or corridor. The image is grainy and has a timestamp in the upper left corner, indicating it was captured at 06:15:2024 at 15:20:55. The timestamp suggests that the image is from a surveillance system.  In the foreground, there are several individuals walking down the hallway. The people appear to be casually dressed, with some wearing t-shirts and jeans. One person is wearing a white shirt and jeans, and another individual is wearing a red top and jeans. There is also a person wearing a white shirt and jeans bending over, possibly picking something up from the floor.  The hallway itself is relatively narrow, with walls on both sides. There are no visible signs or distinctive features that provide context about the location. The lighting in the hallway is artificial, and the overall quality of the image suggests it might be from an older surveillance system or a low-resolution camera."
image_3_3.jpg,Suspected members of the Tren de Aragua gang caught on surveillance footage at the Gateway Hotel in El Paso,Venezuelan gang Tren de Aragua take over Texas hotel county officials work to shut down business,"The image depicts a scene from a security camera, likely taken in a hallway or corridor. The perspective is from the ceiling, providing a bird's eye view of the area. The timestamp in the upper left corner indicates the date and time as ""06-15-2024 19:23:20.""  In the center of the image, there is a person who appears to be in motion, possibly running or walking quickly. This individual is wearing a dark-colored shirt and dark pants, and their face is not visible due to the angle and distance from the camera.  Surrounding this central figure are several other individuals, all of whom are blurred and out of focus, suggesting they are moving in the same direction as the central figure. The people are dressed in a variety of clothing styles, with some wearing shirts and others in what appears to be uniforms.  The hallway itself is relatively narrow, with walls on both sides. There are no visible signs or distinctive features that provide context about the location. The lighting is artificial, and the overall quality of the image suggests it may be from a standard security camera with a wide-angle lens."
image_3_4.jpg,Suspected members of the Tren de Aragua gang caught on surveillance footage at the Gateway Hotel in El Paso,Venezuelan gang Tren de Aragua take over Texas hotel county officials work to shut down business,"The image depicts a hallway scene captured through a security camera. The timestamp in the upper left corner indicates that the photo was taken on June 15, 2024, at 19:25:45. The hallway is narrow and appears to be part of a residential building, with walls that are painted in a light color, possibly white or cream.  There are three individuals visible in the image. Two of them are walking away from the camera, and one is walking towards it. The person walking towards the camera is wearing a red shirt and black shorts, and they appear to be carrying a bag. The other two individuals are wearing white shirts and dark shorts, and they are also carrying bags.  The floor of the hallway is wooden, and there are various items scattered around, including what looks like a piece of furniture and some personal belongings. The lighting in the hallway is dim, with a single light source visible in the distance, creating a somewhat moody atmosphere. The image has a grainy quality, typical of security camera footage, and the angle suggests the camera is mounted on a wall or ceiling."
image_4_1.jpg,Kamala Harris continues to advocate for ‘decriminalizing’ illegal immigration: Virginia Gov. Glenn Youngkin,Harris camp's new policy page criticized for lacking specifics on border security: 'There's no there there',"The image appears to be a screenshot from a television broadcast, featuring a man who seems to be a news anchor or commentator. The man is wearing a dark suit with a pink tie, and he has a serious expression on his face. He is positioned in the center of the frame, with a cityscape visible behind him, suggesting that the broadcast is taking place in an urban environment.  At the bottom of the screen, there is a red banner with white text that reads ""FOX NEWS LIVE"" and ""ELECTION NIGHT 57 DAYS."" This indicates that the broadcast is from the Fox News network and is related to election coverage, with the specific date mentioned being 57 days before an election event. The overall style of the image is typical of news broadcasts, with a focus on the news anchor and the branding of the network."
image_4_2.jpg,Border wall open,Harris camp's new policy page criticized for lacking specifics on border security: 'There's no there there',"The image depicts a section of a border wall, characterized by its rust-colored metal fencing. The wall is constructed with horizontal slats, and there are two visible gates or openings in the wall. The ground is a light brown color, suggesting a sandy or dusty terrain. In the foreground, there is a yellow construction vehicle, possibly a backhoe or excavator, parked on the left side of the image. The sky is clear and blue, indicating fair weather conditions. There are no visible texts or distinctive markings that provide additional context or information about the location or purpose of the wall. The style of the image is a straightforward, unembellished photograph with no filters or artistic effects applied."
image_4_3.jpg,Migrants border caravan,Harris camp's new policy page criticized for lacking specifics on border security: 'There's no there there',"The image depicts a large group of people walking in a single file down a road. The road is lined with lush greenery on both sides, and the sky appears to be clear, suggesting a sunny day. The people are dressed in a variety of casual clothing, with some carrying backpacks and handbags. The group seems to be moving in the same direction, possibly indicating a coordinated event or journey. The image is a photograph with a focus on the human element, capturing the diversity and unity of the group as they traverse the road."
image_4_4.jpg,"The Harris campaign website added an ""Issues"" page to its website that includes a policy platform from the Harris-Walz campaign. The addition comes 50 days after Joe Biden stepped aside in the race for president.",Harris camp's new policy page criticized for lacking specifics on border security: 'There's no there there',"The image appears to be a political campaign advertisement featuring two individuals, a woman and a man, who are likely candidates for political office. The woman is on the left side of the image, and the man is on the right. Both individuals are dressed in professional attire, with the woman wearing a dark blazer and the man in a suit with a tie. They are both smiling and looking directly at the viewer.  The background of the image is a gradient of blue tones, with the text ""Let's Win This"" prominently displayed in large, bold white letters. The text is repeated in a pattern that creates a sense of movement and energy. The top left corner of the image contains the name ""HARRIS WALZ"" in white capital letters, which could be the name of the campaign or the individuals featured.  The overall style of the image is graphic and designed to be eye-catching, with a clear focus on the message of the campaign. The use of bold colors and text suggests a call to action, and the inclusion of the individuals' images is likely intended to personalize the message and create a connection with potential voters."
image_5_1.jpg,CNN host surprised by Harris’ 2019 policy positions like decriminalizing all drugs & funding migrant sex changes,CNN host surprised by Harris’ 2019 policy positions like decriminalizing drugs funding migrant sex changes,"The image is a screenshot from a news broadcast featuring a man who appears to be a news anchor or reporter. The man is wearing a dark suit with a white shirt and a dark tie. He has a beard and mustache, and his hair is dark and styled short. He is looking slightly to the side with a serious expression on his face.  At the top of the image, there is a red banner with white text that reads ""KFILE INVESTIGATION."" Below this, there is a headline in white text that states ""2019 HARRIS QUESTIONNAIRE SHEDS LIGHT ON MORE LIBERAL PAST."" In the bottom right corner, there is a logo for CNN with the time ""11:48 PM PT"" and the word ""OUTFRONT"" below it, indicating the time of the broadcast and the name of the show. The background of the image is blurred, but it appears to be a cityscape, suggesting that the broadcast is taking place in an urban setting."
image_5_2.jpg,CNNs Erin Burnett on air,CNN host surprised by Harris’ 2019 policy positions like decriminalizing drugs funding migrant sex changes,"The image depicts a television news segment featuring two individuals engaged in a discussion. The person on the left appears to be a man dressed in a dark suit and tie, gesturing with his hands as he speaks. The person on the right appears to be a woman wearing a light-colored blazer and holding a pen, attentively listening to the man. Both are seated at a desk with a glass top, which is illuminated by studio lighting.  The background of the image shows a cityscape at night with a bridge and buildings, suggesting an urban setting. There is text overlaying the image, which includes the logo for CNN and a timestamp indicating the date and time of the broadcast. The text also contains a headline that reads ""2019 HARRIS QUESTIONNAIRE SHEDS LIGHT ON MORE LIBERAL PAST,"" which implies that the topic of discussion is related to a political figure named Harris and their past political stance. The style of the image is a screenshot from a television broadcast, capturing a moment during a news program."
image_5_3.jpg,Kamala Harris,CNN host surprised by Harris’ 2019 policy positions like decriminalizing drugs funding migrant sex changes,"The image depicts a woman standing at a podium, speaking into a microphone. She appears to be addressing an audience, possibly at a formal event or press conference. The woman has shoulder-length brown hair and is wearing a white blazer over a light-colored top. She is gesturing with her hands, which suggests she is in the middle of her speech. The background is blurred, but it seems to be an indoor setting with a blue light strip running along the top, which could indicate a stage or a conference room. The lighting is focused on the woman, highlighting her as the central figure in the image."
image_6_1.jpg,Families of victims of illegal immigrant crime call out Biden-Harris border policies,Daughter of Mexican immigrants tells Congress she’s ‘ashamed’ of Biden-Harris admin ‘opening our borders’,"The image depicts a group of individuals seated in what appears to be a legislative assembly or a similar formal setting. The central figure is a woman with dark hair, wearing a dark blazer and a light-colored top. She is seated at a desk with a microphone, suggesting she is addressing the assembly or participating in a discussion. Her expression is serious, and she seems to be engaged in the proceedings.  Around her, there are other individuals, some of whom are also seated at desks with microphones, indicating they are also part of the discussion or debate. The setting includes a formal backdrop with a logo that reads ""FOX NEWS,"" suggesting that this is a news broadcast or a televised event.  The text overlay on the image reads ""VICTIMS' ADVOCATE SLAMS DEMS IN BORDER TESTIMONY,"" which is a headline from the news channel, indicating that the woman in the center is a victims' advocate and is giving testimony related to the border. The text ""BORDER CRISIS"" is also visible, further emphasizing the topic of the testimony.  The style of the image is a screenshot from a news broadcast, with a focus on the central figure and the overlay text providing context to the content being presented."
image_6_2.jpg,April Aguirre,Daughter of Mexican immigrants tells Congress she’s ‘ashamed’ of Biden-Harris admin ‘opening our borders’,"The image depicts a scene from a Congressional hearing. In the foreground, a woman is seated at a table, identified by a name tag that reads ""MS. AGUIRRE."" She appears to be speaking or gesturing, with her mouth open as if she is in the middle of a sentence. She is wearing a dark blazer over a lighter top, and her hair is styled in a bob cut.  Behind her, there are other individuals seated, presumably members of Congress or other officials, as indicated by the name tags on their desks. The name tags read ""MS. LOPEZ"" and ""MS. AGUIRRE,"" suggesting that this is a formal meeting or hearing. The setting includes a table with microphones, indicating that this is a formal proceeding where testimony is being given.  The individuals are dressed in professional attire, with the woman in the foreground wearing a dark blazer and the others in business suits. The environment suggests a formal legislative setting, likely in a Congressional chamber or a similar governmental assembly room."
