image number,alt,article_heading,description
image_6_3.jpg,Maria Gonzalez,Daughter of Mexican immigrants tells Congress she’s ‘ashamed’ of Biden-Harris admin ‘opening our borders’,"The image shows a young girl standing outdoors in a grassy field. She appears to be of Asian descent and is wearing a red sleeveless top. Her hair is dark and pulled back, and she is looking directly at the camera with a slight smile. The background is blurred, but it seems to be a natural, open space with greenery. There are no visible texts or distinctive brands in the image. The style of the image is a standard, color photograph with a focus on the subject."
image_6_4.jpg,Patty Morin makes shocking revelation during House testimony,Daughter of Mexican immigrants tells Congress she’s ‘ashamed’ of Biden-Harris admin ‘opening our borders’,"The image depicts a panel of women seated at a table, appearing to be in a formal setting, possibly a congressional hearing or a press conference. The woman in the foreground is wearing glasses and a dark blazer, and she is holding a microphone, suggesting she is the one speaking at the moment. She is labeled ""MS. MORIN"" on a name tag in front of her. To her right, there is another woman wearing a white blouse, and to her left, there is a woman wearing a dark blazer and glasses, also labeled ""MS. FUNDME."" The woman in the foreground is holding a tissue box, and there are water bottles on the table in front of each woman. The background is blurred, but it appears to be a room with other individuals, indicating that this is a public event with an audience. The style of the image is a photograph, and it captures a moment during a discussion or presentation."
image_7_1.jpg,Jocelyn Nungaray's mother reveals horrific timeline of daughter's murder in hearing on open-border crime,Biden-Harris border crisis: Mother of Jocelyn Nungaray gives emotional testimony during migrant crime hearing,"The image depicts a formal setting, likely a courtroom or a legislative assembly, with several individuals seated around a table. The central figure is a woman with long dark hair, wearing glasses and a dark top. She appears to be listening attentively to a proceeding or discussion. To her right, there is a man in a suit with a purple tie, and to her left, another woman wearing glasses and a dark top. There are water bottles on the table in front of the central figure, and a name tag that reads ""MS. NUNGARAY"" is visible on the table. The setting suggests a professional environment, possibly a legal or governmental proceeding."
image_7_2.jpg,images of Jocelyn Nungaray,Biden-Harris border crisis: Mother of Jocelyn Nungaray gives emotional testimony during migrant crime hearing,"The image is a split-screen of two photos featuring a young girl. On the left side, the girl is seated at a dining table with a birthday cake in front of her. The cake is decorated with lit candles, and the girl is wearing a striped shirt. She is smiling and looking directly at the camera. On the right side, the girl is standing and holding a violin. She is wearing a dark blue shirt and has long, curly hair. She is also smiling and looking at the camera. The background of the right photo is dark, with a hint of a stage or performance area."
image_7_3.jpg,Jocelyn Nungaray murder suspects,Biden-Harris border crisis: Mother of Jocelyn Nungaray gives emotional testimony during migrant crime hearing,"The image you've provided appears to be a composite of two separate photographs of a person, likely intended to show the same individual at different times or under different conditions. The style of the image is straightforward and documentary, with a focus on the person's face and upper shoulders.  On the left side of the image, the person is shown with a neutral expression, looking directly at the camera. The individual has short, dark hair and a light complexion. The background is nondescript, with a pattern that could be a wall or a textured surface.  On the right side, the same person is depicted with a more serious or contemplative expression. The individual's hair is styled differently, with a bit more length and a slightly tousled appearance. The background is similar to the left side, suggesting that the photos were taken in the same location or under similar conditions.  The image does not contain any text or additional context, and the focus is solely on the person's facial features and expressions. The lighting and composition are consistent across both photos, indicating that they were likely taken by the same photographer or under similar conditions."
image_7_4.jpg,Former President Trump met with Alexis Nungaray mother of Jocelyn Nunagaray the 12-year-old girl who was killed by who authorities say are undocumented migrants at the U.S.-Mexico border fence on Aug. 22 south of Sierra Vista Arizona.,Biden-Harris border crisis: Mother of Jocelyn Nungaray gives emotional testimony during migrant crime hearing,"The image depicts an outdoor scene where a political figure, dressed in a dark suit with a red tie, is shaking hands with a woman in a red dress. The man appears to be a politician, possibly a president, given the context and attire. The woman is wearing glasses and has dark hair. There are two men standing behind the woman, one of whom is holding a microphone, suggesting that this might be a public event or press conference. The setting includes a wooden fence and a dirt road, indicating a rural or semi-rural environment. The lighting suggests it is daytime. The image captures a moment of interaction between the politician and the woman, with the men in the background providing context for the event."
image_7_5.jpg,Families of victims of illegal immigrant crime call out Biden-Harris border policies,Biden-Harris border crisis: Mother of Jocelyn Nungaray gives emotional testimony during migrant crime hearing,"The image depicts a group of individuals seated in what appears to be a legislative assembly or a similar formal setting. The central figure is a woman with dark hair, wearing a dark blazer and a light-colored top. She is seated at a desk with a microphone, suggesting she is addressing the assembly or participating in a discussion. Her expression is serious, and she seems to be engaged in the proceedings.  Around her, there are other individuals, some of whom are also seated at desks with microphones, indicating they are also part of the discussion or debate. The setting includes a formal backdrop with a logo that reads ""FOX NEWS,"" suggesting that this is a news broadcast or a televised event.  The text overlay on the image reads ""VICTIMS' ADVOCATE SLAMS DEMS IN BORDER TESTIMONY,"" which is a headline from the news broadcast. This headline indicates that the central figure is a victims' advocate who is expressing her views on the actions of Democrats in relation to border issues. The overall style of the image is a screenshot from a news broadcast, capturing a moment during a live discussion or debate."
image_8_1.jpg,Residents of Springfield Ohio attend city council meeting to share frustration about migrant crisis hitting their community,Ohio residents in small town erupt over havoc caused by massive influx of 20000 of Haitians,"The image depicts a man standing at a podium, appearing to be addressing an audience or participating in a meeting. He is wearing a red hoodie with white lettering on the front, which includes the word ""SPRINGFIELD."" The man is also wearing a red baseball cap with a white logo on the front. He is holding a microphone in his right hand, suggesting he is speaking or about to speak.  The setting appears to be an indoor space with a glass wall in the background, which allows natural light to enter the room. There are other individuals present in the background, but they are not the focus of the image. The text ""SPRINGFIELD CITY COMMISSION MEETING"" is overlaid on the image, indicating the context of the event. The date ""Aug. 27, 2024"" is also visible, suggesting the image was taken at a specific meeting date. The overall style of the image is a standard photograph with a focus on the man at the podium."
image_8_2.jpg,SPRINGFIELD OHIO RESIDENTS,Ohio residents in small town erupt over havoc caused by massive influx of 20000 of Haitians,"The image depicts a man sitting at a table, appearing to be in a meeting or presentation. He is wearing a red hoodie with white lettering on the front, which includes the text ""Springfield City Commission Meeting."" The date ""Aug. 27, 2024"" is also visible in the image. The man is looking to his left, and his posture suggests he might be addressing an audience or waiting for his turn to speak. The setting appears to be an indoor space with a glass wall in the background, which could be a conference room or a similar venue for meetings. There are no other individuals visible in the image, and the focus is on the man and the text overlay."
image_8_3.jpg,Haitian migrants springfield,Ohio residents in small town erupt over havoc caused by massive influx of 20000 of Haitians,"The image depicts a formal meeting taking place in a room with a glass wall, allowing a view of the outside. The room appears to be a professional setting, possibly a government or municipal office, given the context of the meeting.  In the foreground, there is a woman seated at a desk, wearing a light pink blouse with a floral pattern and a beige hat. She is actively engaged in the meeting, gesturing with her hands as she speaks. Her expression suggests she is addressing the attendees with confidence and authority.  Standing behind her is a man dressed in a red polo shirt. He is holding a microphone, indicating that he is the one speaking at the moment. His posture suggests he is comfortable and experienced in public speaking.  The text overlay on the image reads ""Springfield City Commission Meeting - Aug. 27, 2024,"" which indicates the date and nature of the meeting. The text is clear and legible, providing context for the image.  The overall scene is one of a public meeting in progress, with the woman at the desk likely serving as the chair or leader of the commission, and the man with the microphone providing information or discussion points. The setting is professional and the attire of the individuals suggests a formal or official capacity."
image_8_4.jpg,Haitian migrants springfield,Ohio residents in small town erupt over havoc caused by massive influx of 20000 of Haitians,"The image depicts a woman standing at a podium during what appears to be a public meeting or event. She is wearing a white t-shirt with a graphic on the front, and she has blonde hair. The woman is gesturing with her right hand, which is raised slightly above her shoulder, as if she is in the middle of speaking or making a point. She is looking towards the audience or the camera, indicating that she is addressing the attendees.  In the background, there are two individuals who seem to be listening to the woman's speech. One of them is wearing a dark suit and tie, suggesting a formal or professional setting. The other person is partially visible and is wearing a lighter-colored shirt.  The setting appears to be indoors, possibly in a conference room or a similar venue, given the presence of the podium and the formal attire of one of the individuals in the background. The image is a still from a video, as indicated by the text overlay at the bottom that reads ""Springfield City Commission Meeting,"" which suggests that the event is related to city governance or public affairs. The style of the image is candid and seems to capture a moment during a live broadcast or recording of the meeting."
image_9_1.jpg,Trump: Illegal migrants are 'destroying our county',Trump outperforming 2020 support among Hispanics who prefer him on immigration poll shows,"The image depicts two men sitting in what appears to be a formal setting, possibly a political or diplomatic environment. The man on the left is wearing a dark suit with a red tie, and he has a serious expression on his face. The man on the right is wearing a dark suit with a blue tie and has a more contemplative expression. Both men are seated in chairs with ornate designs, suggesting a formal or ceremonial occasion.  The background features a large painting or mural that includes elements of maritime scenes, which could indicate a nautical theme or a location near a coast. The overall color palette of the image is warm, with a focus on the men and the room they are in.  At the top of the image, there is a logo or watermark that reads ""LIFE, LIBERTY & LEVIN,"" which could be the name of the organization or the creator of the image. The style of the image is realistic and appears to be a photograph rather than a digital illustration or painting."
image_9_2.jpg,Trump and Harris split,Trump outperforming 2020 support among Hispanics who prefer him on immigration poll shows,"The image is a split-screen comparison of two individuals, a man and a woman, both appearing to be middle-aged. The man is on the left side of the image, and the woman is on the right. Both are facing the camera with their heads slightly turned to the side.  The man has a fair complexion and is wearing a dark suit with a red tie. He has short, graying hair and is looking slightly to his left with a serious expression.  The woman has a fair complexion and is wearing a light-colored blouse with a pearl necklace. She has long, straight brown hair and is smiling broadly at the camera.  The background is not clearly visible, but it appears to be a stage with a blue curtain, suggesting that this might be a political event or a formal gathering. There are no visible texts or logos in the image. The style of the image is a straightforward, side-by-side comparison, likely intended to show the contrast between the two individuals' expressions or appearances."
image_9_3.jpg,Trump campaigns in Wisconsin,Trump outperforming 2020 support among Hispanics who prefer him on immigration poll shows,"The image depicts a man standing on a stage, waving with his right hand raised. He appears to be addressing an audience, as suggested by the presence of a crowd in the background. The man is wearing a dark blue suit with a red tie, which is a common attire for formal events or political appearances. His expression is serious, and he seems to be in the middle of a speech or presentation. The setting includes a blue curtain, which is often used to create a backdrop for speakers at events. The lighting is focused on the man, highlighting him as the central figure in the scene."
image_9_4.jpg,Kamala Harris,Trump outperforming 2020 support among Hispanics who prefer him on immigration poll shows,"The image depicts a woman standing at a podium with microphones, giving a speech or presentation. She appears to be a politician or public figure, as indicated by the seal on the podium and the formal attire. The woman has shoulder-length brown hair and is wearing a dark blazer over a light-colored shirt. She is gesturing with her right hand, which is raised in a thumbs-up sign, suggesting she is addressing an audience with confidence and positivity.  In the background, there are other individuals who seem to be part of the event, possibly fellow speakers or attendees. The setting appears to be indoors, with a blue wall visible in the background. The lighting is bright, and the focus is on the woman at the podium, indicating that she is the main subject of the image. The style of the image is a standard, candid photograph capturing a moment during a public speaking event."
