article_number,image number,alt,article_heading
1,1,Apple Blossom,"We know what the Apple Blossom must have in its wardrobe. ""We are quite demanding"""
2,1,ABBA at the Royal Palace in Stockholm - May 31 2024,ABBA rakes in millions for avatar appearances. What are the band's plans?
3,1,Justin Bieber and Hailey Bieber,After giving birth she fell silent. Fans were going crazy. Finally a breakthrough
4,1,Halsey,"The star's sad confession. She's had a tough 10 years. ""Mysterious and painful"""
5,1,Bobby McFerrin,Don't Worry Be Happy is a hit from the 80s. Few people know that no band participated in the recordings
6,1,Selena Gomez,Humble Billionaire? The Young Star's Words Surprised Fans
7,1,Ania Rusowicz married herself,"Anna Rusowicz's Shocking Confession: ""I've Been Thinking About It for a Long Time"""
8,1,Ariana Grande is furious with tabloids,Ariana Grande Furious With Media: 'They've Been Trying to Destroy Me Since I Was 19'
9,1,A star in the sincere fire of questions,Ariana Grande Takes Polygraph Exam: 'Sometimes I Don't Like My Fans'
10,1,Frankie Valli is still performing on stage despite his advanced age,Frankie Valli on his health. Fans very concerned
