image number,alt,article_heading,description
image_1_1.jpg,Giacomo Puccini visited Argentina in 1905 invited by the Nardi and Bonetti Company,Music and presidents: the sounds that marked Argentine history,"The image depicts a choir performing in an auditorium. The choir members are dressed in formal attire, with the men wearing suits and the women in elegant dresses. They are holding sheet music and appear to be singing. The choir is seated on a stage, and the audience is seated in the foreground, facing the choir. The setting suggests a formal or professional musical performance."
image_1_2.jpg,The Music and Presidents cycle takes place in the Patio de Manoeuvres of the Casa Rosada Museum,Music and presidents: the sounds that marked Argentine history,"The image depicts a group of individuals engaged in what appears to be a choir practice. The focus is on a woman in the foreground, who is looking down at her sheet music with a serious expression. She has long, straight brown hair and is wearing a dark top. The choir members in the background are also looking at their sheet music, suggesting they are preparing to sing. The lighting is soft and even, highlighting the faces of the choir members. The setting seems to be indoors, possibly a rehearsal room or a church. The overall atmosphere is one of concentration and preparation for a musical performance."
image_1_3.jpg,The National Polyphonic Choir will perform Puccini's Messa a quattro voci on October 3,Music and presidents: the sounds that marked Argentine history,"The image depicts an indoor scene where a choir is performing. The choir members are seated in rows, facing the audience, and appear to be singing or speaking. The choir is diverse in terms of age and gender. In the foreground, there is a conductor standing at the front of the choir, gesturing with a baton, indicating the tempo and dynamics of the performance. The conductor is wearing a dark suit and appears to be leading the choir.  The setting seems to be a formal event, possibly a concert or a ceremony, given the attire of the choir members and the conductor. The choir members are dressed in formal wear, with some wearing ties and others in elegant dresses. The audience is not visible in the image, but the choir's focus and the conductor's stance suggest that they are being addressed or entertained.  The background features a mural or painting depicting a cityscape, which adds an artistic touch to the setting. The lighting is warm and focused on the choir, highlighting their performance and creating a dramatic effect. The overall atmosphere is one of solemnity and professionalism, typical of a choir performance in a formal setting."
image_2_1.jpg,Marta Salicrú author of 'Rosalía from A to Z' (Helena Margarit Cortadellas),“Rosalía doesn’t get on anyone’s car she’s the one who drives it”: the singer’s success explained ‘from A to Z’,"The image shows a woman standing on a street with a backdrop of buildings. She is wearing a dark-colored, patterned top with a distinctive logo on the left side of the chest. Her hair is styled in a bob cut with bangs, and she has a neutral expression on her face. The lighting suggests it might be daytime, and the architecture indicates an urban setting. The woman appears to be posing for the photograph, standing with her body slightly angled towards the camera."
image_2_2.jpg,Marta Salicrú author of 'Rosalía from A to Z' (Helena Margarit Cortadellas),“Rosalía doesn’t get on anyone’s car she’s the one who drives it”: the singer’s success explained ‘from A to Z’,"In the image, there is a woman standing in front of a building with a green plant hanging on the wall. She is holding a book with a white cover and red and black text. The woman is wearing a black shirt with a white logo on the left side. The plant has long green leaves and is hanging in a brown pot. The building has a black and white striped awning. The woman appears to be reading the book, and the overall scene suggests a casual, outdoor setting."
image_2_3.jpg,Marta Salicrú author of 'Rosalía from A to Z' (Helena Margarit Cortadellas),“Rosalía doesn’t get on anyone’s car she’s the one who drives it”: the singer’s success explained ‘from A to Z’,"The image shows a woman with a contemplative expression. She has short, straight brown hair and is wearing a dark top with a textured pattern. Her left hand is raised slightly, with her fingers extended as if she is gesturing or about to make a point. The background is neutral and nondescript, with no distinguishable features that provide context about the setting. The style of the image is a close-up portrait, focusing on the woman's face and upper body."
image_5_1.jpg,Digital creativity and electronic music: the sixth edition of the MUTEK.AR festival is here,Digital creativity and electronic music: the sixth edition of the MUTEK.AR festival is here,"The image depicts a three-dimensional object that resembles a large, irregularly shaped stone or rock. The object is predominantly dark, with a rough, textured surface that suggests it could be a natural mineral. The color palette is primarily black and gray, with a few areas of lighter gray that give the impression of cracks or fissures in the stone.  There are bright, vertical lines of light that run through the object, creating a striking contrast against the dark background. These lines are red and orange, and they seem to emanate from the top of the object, suggesting a source of light or energy coming from above. The lines are not uniform in size or intensity, which adds to the dynamic and somewhat abstract nature of the image.  The background is a solid, dark color that provides a stark contrast to the object, making the object stand out prominently. The overall style of the image is reminiscent of a digital artwork or a 3D rendering, with a focus on the interplay of light and shadow to create a visually compelling scene."
image_5_2.jpg,It will take place from October 2 to 6 in several venues in Buenos Aires: Casa Futuro the Planetarium the Alvear Theater Artlab Deseo and the Immersive Audiovisual Center,Digital creativity and electronic music: the sixth edition of the MUTEK.AR festival is here,"The image you've provided appears to be a close-up photograph of a textured surface with a focus on a series of red lines. The red lines are not straight but rather have a wavy pattern, creating a sense of movement or fluidity. The background is dark, which contrasts with the bright red lines, making them stand out prominently. The texture of the surface is rough and uneven, with some areas appearing more jagged than others. The overall effect is somewhat abstract, as the red lines could be interpreted as a form of graffiti or street art, or they might be part of a design or pattern. The image does not contain any recognizable objects or text, and the style is reminiscent of a low-light or night-time shot due to the stark contrast between the red lines and the dark background."
image_6_1.jpg,The artist Rosalia,Rosalía places one of her albums among the best of the decade according to ‘Pitchfork’: “It is as miraculous as her voice”,"The image appears to be a stylized graphic or illustration of two individuals, likely women, against a solid purple background. The person on the left is depicted with a youthful appearance, featuring a prominent nose, dark hair styled in a bob cut, and a fur-lined garment that suggests a fashion-forward or trendy style. The person on the right has long, dark hair and is wearing a black top with a lace pattern, which adds a touch of elegance to the outfit. Both individuals are facing the viewer with a slight turn of their heads, giving a sense of engagement or interaction. The overall aesthetic of the image is modern and artistic, with a color palette that emphasizes cool tones."
image_6_2.jpg,Rosalía at a concert of the 'Motomami World Tour' in Mexico (AP Photo/Marco Ugarte),Rosalía places one of her albums among the best of the decade according to ‘Pitchfork’: “It is as miraculous as her voice”,"The image depicts a person wearing a unique, illuminated headpiece that resembles a swan's head. The headpiece is predominantly white with black accents, and it features a large, heart-shaped opening that covers the person's face, with the eyes visible through the cutouts. The person is wearing black gloves and has dark hair. The background is dark, which contrasts with the bright, glowing headpiece, creating a dramatic effect. The style of the image suggests it could be a creative or artistic representation, possibly for a costume or a themed event."
image_6_3.jpg,Rosalia at the Dior show during Paris Fashion Week. REUTERS/Johanna Geron,Rosalía places one of her albums among the best of the decade according to ‘Pitchfork’: “It is as miraculous as her voice”,"The image features a woman standing against a backdrop that prominently displays the word ""DIOR"" in large, white capital letters. The woman has long, dark hair that cascades down her shoulders, and she is wearing a black blazer over a black top. She is also wearing a pair of black gloves. Her gaze is directed slightly to the side, and she has a neutral expression on her face. The color of the wall behind her is a solid blue, providing a stark contrast to the white text and her dark attire. The style of the image appears to be a professional portrait, possibly for promotional or branding purposes, given the presence of the DIOR text."
image_8_1.jpg,Image of the Radar Joven poster,Radar Joven is back the concert series of the Community of Madrid that arrives in October,"The image appears to be a vibrant and colorful poster for a music festival called ""Radar Joven."" The text is in Spanish and provides information about the event. The date of the festival is given as ""Del 17 de octubre al 10 de noviembre de 2024,"" which translates to ""From October 17 to November 10, 2024."" The festival is described as a ""Fiesta Carne Joven,"" which translates to ""Young Meat Party.""  The poster lists various bands and artists that will be performing at the festival. These include ""Ghoulijaboy,"" ""D.Dramatico,"" ""Cantefo,"" ""Margarita Quebrada,"" ""Neura,"" ""Lina de Sol,"" ""Ezez,"" ""Destellos,"" ""Corte,"" ""Ortopedia,"" ""Las Nieves del Charli,"" ""Rezelo,"" ""El Faro,"" ""Red Cactus,"" ""L3murr,"" ""Anouck the Band,"" ""Paida Tez,"" ""Xure,"" ""Quinto Cuarta,"" ""Junio,"" ""Sabe,"" ""Airi,"" ""Tatuaje,"" ""Genboo,"" ""Menta,"" ""Los Chivatos,"" ""Lord Malvo,"" ""Tomass,"" and ""Faneke."" These names are likely the names of the bands and artists scheduled to perform at the festival.  The poster also mentions that there will be ""54 conc"
image_8_2.jpg,Margarita Quebrada will be one of the groups that can be seen during Radar Joven,Radar Joven is back the concert series of the Community of Madrid that arrives in October,"The image you've provided appears to be a black and white photograph capturing a moment of three individuals walking together. The photograph has a grainy texture, which is common in older film or digital images with a high ISO setting. The subjects are blurred, suggesting motion or a focus on the overall scene rather than individual details.  The person in the foreground is wearing a long coat, which could indicate cooler weather or a formal occasion. The second individual is partially obscured by the first, but it seems like they are also dressed in a similar style, with a long coat and possibly a hat or head covering. The third person is mostly obscured by the first two, but their presence is suggested by the continuation of the blurred figures.  The background is indistinct due to the focus on the subjects, but it appears to be an urban environment with what could be a building or wall on the right side. The lighting is not clearly visible, but the shadows suggest an overcast day or a time of low light.  The overall composition of the image, with the subjects in the center and the background softly blurred, creates a sense of depth and movement. The monochromatic color scheme adds to the timeless quality of the photograph."
image_9_1.jpg,Ana Mena performing at the Starlite Occident in Marbella (STARLITE OCCIDENT),Ana Mena's life beyond music: her work as an actress and some changes in her look,"The image depicts a vibrant scene of a music performance. At the center of the stage is a female singer, who is the main focus of the image. She is wearing a white, mesh-like bodysuit that has a textured appearance, giving it a unique look. The bodysuit is form-fitting and accentuates her figure.  She is holding a microphone in her right hand, which she is using to sing into. Her left hand is raised in the air, as if she's reaching out to the audience or expressing the emotion of the song she's singing.  Surrounding the singer are several male performers, who appear to be dancers or backup singers. They are dressed in black, athletic-style outfits that include tank tops and shorts. Some of them are wearing fingerless gloves, which adds to the edgy aesthetic of their attire.  The stage is bathed in a pinkish-purple light, creating a dramatic and energetic atmosphere. The lighting is such that it highlights the performers and gives the image a dynamic feel.  The background is not clearly visible, but it seems to be a stage with a white floor, which contrasts with the dark outfits of the performers and the bright lighting. The overall impression is of a high-energy performance, likely a concert or music show."
image_9_2.jpg,Singer Ana Mena posing at the photocall for the 40 Music Awards 2023 (A. Pérez Meca / Europa Press),Ana Mena's life beyond music: her work as an actress and some changes in her look,"The image depicts a woman standing in front of a backdrop that features logos and text. She is wearing a sleeveless, high-waisted dress with a glittery, sequined pattern. The dress has a plunging neckline and a ruched detail at the waist. The woman has long, straight blonde hair and is looking directly at the camera with a neutral expression.  The backdrop includes various logos and text, suggesting that the event is related to music or entertainment. The logos are for sponsors and partners, such as ""Music Awards,"" ""Santander,"" ""YouTube,"" ""Vitaldent,"" ""The Marlin,"" ""Camp Yalma,"" ""General,"" and others. The logos are colorful and include a mix of geometric shapes and text. The style of the image is a standard event photograph, likely taken at a red carpet event or similar occasion."
image_10_1.jpg,AMLO has mentioned and played many musicians during La Mañanera. These are some of the most important ones.,Goodbye to AMLO's Morning Press Conference: These were all the songs he played during his morning conferences,"The image appears to be a composite or collage of various elements, likely intended to represent a theme or a collection of individuals. In the foreground, there is a man wearing a dark suit and a blue tie, who seems to be speaking or presenting. He has gray hair and is smiling. Behind him, there is a large, detailed image of a man's face, which is the central focus of the image. This central figure has a beard and is wearing a cap. Surrounding the central image are smaller, cut-out images of other individuals, each with their own distinct features and attire. The background is a gradient of colors, with a teal and yellow pattern that adds to the overall aesthetic of the image. The style of the image suggests it might be related to a theme of leadership or a group of individuals, possibly in a professional or political context."
image_10_2.jpg,"President López Obrador's morning press conference was once again the scene of music, now to the rhythm of cha-cha-cha (Presidency)",Goodbye to AMLO's Morning Press Conference: These were all the songs he played during his morning conferences,"The image depicts a man standing at a podium with a microphone, seemingly addressing an audience or participating in a formal event. The man appears to be middle-aged, with gray hair and a mustache. He is wearing a dark suit with a tie and a lapel pin. Behind him, there is a large screen displaying a group of people, possibly a band or performers, and a banner with the Mexican flag. The setting suggests that the event might be related to Mexican culture or music. The man's expression is serious, and he seems to be in the middle of a speech or presentation."
image_10_3.jpg,AMLO has played a series of songs as options to stop consuming music that promotes drug use and wealth derived from illicit activities. Photo: Government of Mexico,Goodbye to AMLO's Morning Press Conference: These were all the songs he played during his morning conferences,"The image depicts a man standing at a podium with a microphone, seemingly addressing an audience. The man appears to be middle-aged, wearing a dark suit with a white shirt and a dark tie. He is facing away from the camera, looking towards a large screen displaying a video of a musical performance. The performance includes several musicians playing guitars and a man in a cowboy hat, suggesting a country or western theme.  The podium has a circular emblem on it, which includes an eagle and the text ""UNIÓN MEXICANA,"" indicating that the setting might be related to Mexican union activities or events. Behind the podium, there is a flag with red, white, and green colors, which is the national flag of Mexico, further supporting the idea that the event is taking place in Mexico or is related to Mexican culture.  The background is a dark red wall with a pattern that resembles a traditional Mexican tile design, adding to the cultural context of the setting. The lighting is focused on the screen and the podium, creating a dramatic effect that highlights the speaker and the video presentation. The overall atmosphere suggests a formal or semi-formal event, possibly a political or cultural gathering."
