image number,alt,article_heading,article_url,description
image_1_1.jpg,Vice President Kamala Harris the Democratic presidential nominee speaks with Angelica Wind of Asheville as she meets with volunteers assembling emergency aid packages at a resource donation center in Charlotte on Saturday.,VP Harris visits NC amid Helene response WNC floods; 'We're here for the long haul',https://www.usatoday.com/story/news/local/elections/2024/10/05/harris-visits-nc-after-helene-floods-speaks-with-asheville-mayor/75531169007/,"The image depicts two individuals in what appears to be a professional setting, possibly a health center or a similar environment. The person on the left is a woman with shoulder-length brown hair, wearing a dark blazer over a black top. She is shaking hands with the person on the right, who is a woman with curly brown hair, wearing a light blue t-shirt with a graphic design on it. The design on the t-shirt reads ""EVERYBODY COUNTS!"" and includes a colorful illustration of people. The woman in the blue shirt is also wearing glasses and has a badge pinned to her shirt, suggesting she may be an employee or volunteer in the organization.  In the background, there is a television screen displaying what seems to be a health-related program or news segment. To the right of the screen, there is a stack of boxes or crates, which might contain supplies or materials related to the organization's activities. The overall atmosphere of the image suggests a friendly and professional interaction between the two individuals, possibly during a meeting or a visit."
image_1_2.jpg,North Carolina Gov. Roy Cooper listens as Vice President Kamala Harris the Democratic presidential nominee speaks during a briefing with officials at a North Carolina Air National Guard facility in Charlotte on Saturday.,VP Harris visits NC amid Helene response WNC floods; 'We're here for the long haul',https://www.usatoday.com/story/news/local/elections/2024/10/05/harris-visits-nc-after-helene-floods-speaks-with-asheville-mayor/75531169007/,"The image depicts a professional setting where two individuals are engaged in a conversation. The person on the left appears to be a man, dressed in a white shirt, and he is looking towards the person on the right, who is a woman dressed in a black blazer. The woman is seated at a wooden table, with her hands clasped together, suggesting she is actively participating in the discussion. There are papers and a water bottle on the table, indicating that this might be a formal meeting or a business discussion. The background shows a projector screen, which suggests that this could be a conference room or a meeting room equipped for presentations. The overall atmosphere appears to be serious and focused, typical of a professional environment."
image_1_3.jpg,Vice President Kamala Harris the Democratic presidential nominee helps assemble emergency aid packages while meeting with volunteers at a resource donation center in Charlotte on Saturday.,VP Harris visits NC amid Helene response WNC floods; 'We're here for the long haul',https://www.usatoday.com/story/news/local/elections/2024/10/05/harris-visits-nc-after-helene-floods-speaks-with-asheville-mayor/75531169007/,"The image depicts an indoor scene where three individuals are engaged in what appears to be a charitable event. The person in the center, who is wearing a dark blazer and has short brown hair, is handing out items to the other two individuals. The person on the left is wearing a green T-shirt with colorful text and is holding a clear plastic bag. The person on the right is wearing a pink T-shirt with text and is also holding a clear plastic bag.  In the foreground, there is a table covered with various items, including bottles and boxes, which are likely the items being distributed. The table is set up with a white tablecloth and has a blue and white striped table runner. There are signs on the wall in the background that read ""Welcome to The Dream Center"" and ""The Dream Center,"" suggesting that this event is taking place at The Dream Center. The overall atmosphere of the image is one of community service and goodwill."
image_1_4.jpg,Vice President Kamala Harris the Democratic presidential nominee is welcomed by North Carolina Gov. Roy Cooper and Deanne Criswell administrator of the U.S. Federal Emergency Management Agency at Charlotte Douglas International Airport on Saturday.,VP Harris visits NC amid Helene response WNC floods; 'We're here for the long haul',https://www.usatoday.com/story/news/local/elections/2024/10/05/harris-visits-nc-after-helene-floods-speaks-with-asheville-mayor/75531169007/,"The image depicts three individuals engaged in what appears to be a conversation. The person on the left is wearing a dark blue jacket with the letters ""FEMA"" visible on the left side of the chest, suggesting they may be associated with the Federal Emergency Management Agency. This person has blonde hair and is wearing glasses. The individual in the center is wearing a dark jacket and has brown hair. The person on the right is wearing a white shirt with a logo on the left side of the chest, which includes a triangle and the word ""FEMA."" This person has gray hair and is looking towards the other two individuals. The background is not clearly visible, but it seems to be an outdoor setting with natural light. The overall style of the image is a candid photograph capturing a moment between the three individuals."
image_1_5.jpg,Vice President Kamala Harris the  Democratic presidential nominee flanked by North Carolina Gov. Roy Cooper speaks to the members of the media following a briefing with officials in Charlotte on Saturday.,VP Harris visits NC amid Helene response WNC floods; 'We're here for the long haul',https://www.usatoday.com/story/news/local/elections/2024/10/05/harris-visits-nc-after-helene-floods-speaks-with-asheville-mayor/75531169007/,"The image depicts three individuals standing outdoors in front of a large aircraft. The person in the center appears to be a woman with shoulder-length brown hair, wearing a dark blazer and gesturing with her hands. She seems to be in the middle of a conversation or presentation. To her left is a man in a military uniform, possibly a soldier, and to her right is another man in a white shirt with a logo on the left side of the chest. The aircraft in the background has a sleek design, suggesting it could be a military or advanced technology vehicle. The sky is partly cloudy, indicating fair weather conditions. There are no visible texts or distinctive brands in the image."
image_2_1.jpg,A statue of former President Donald Trump with a raised fist greets supporters before Trump speaks at a campaign rally in Butler Pa. on October 5 2024. On July 13 2024 a gunman fired eight rounds at the former president and Republican presidential nominee during a rally in Butler. Trump was grazed by a bullet in the attack and Pennsylvania firefighter Corey Comperatore was killed as he tried to shield his family from the attack. Two other men were injured.,'I will never yield': Trump delivers defiant speech at site of his attempted assassination,https://www.usatoday.com/story/news/politics/elections/2024/10/05/trump-butler-rally-shooting/75517683007/,"The image depicts a statue of a man standing in front of an American flag. The man appears to be middle-aged, with a mustache and a hairstyle that is characteristic of a certain political figure from the late 20th century. He is dressed in a suit with a tie, and his right arm is raised in a fist, as if he is making a gesture of defiance or strength. The statue is made of a metallic material that gives it a polished, reflective surface. The American flag is displayed prominently in the background, with its stars and stripes clearly visible. The sky is a clear blue, suggesting that the photo was taken on a bright day. The overall style of the image is a realistic photograph with a focus on the statue and the flag."
image_2_2.jpg,A worker tapes the bulletproof glass on stage before former President Donald Trump speaks at a campaign rally in Butler Pa. on October 5 2024.,'I will never yield': Trump delivers defiant speech at site of his attempted assassination,https://www.usatoday.com/story/news/politics/elections/2024/10/05/trump-butler-rally-shooting/75517683007/,"The image depicts a lively scene at a sporting event. In the foreground, a person is kneeling down, seemingly inspecting or adjusting something on the ground. This individual is wearing a dark-colored shirt and jeans, and is holding a tool or device in their hands.  Beyond this person, there is a clear barrier, likely a protective glass wall, separating the field from the spectators. On the other side of the barrier, there is a group of people sitting on bleachers. The spectators are dressed in a variety of colors, with many wearing red hats, suggesting they are fans of a particular team. Some of them are holding up their phones, possibly capturing photos or videos of the event.  The setting appears to be an outdoor stadium, with the spectators seated in rows of bleachers that extend into the background. The atmosphere seems energetic and engaged, with the spectators focused on the event happening on the field. The lighting suggests it is daytime, and the weather appears to be clear and sunny."
image_2_3.jpg,Elon Musk joins former President Donald Trump on stage as Trump speaks at a campaign rally in Butler Pa. on October 5 2024.,'I will never yield': Trump delivers defiant speech at site of his attempted assassination,https://www.usatoday.com/story/news/politics/elections/2024/10/05/trump-butler-rally-shooting/75517683007/,"The image depicts a lively scene at what appears to be a political rally or event. In the foreground, a man stands out prominently, wearing a dark-colored jacket and a cap. He is holding his arms up in the air, possibly in a gesture of excitement or to signal to the crowd. His expression is not clearly visible, but his posture suggests he is engaged with the event.  Behind him, a large crowd of people fills the background. They are a diverse group, with individuals of various ages and appearances. Many of them are holding up signs, which are not clearly legible in the image. The signs are likely related to the event or the cause being supported, but the specific details are not discernible.  The setting appears to be outdoors during the day, as indicated by the natural lighting and shadows visible on the crowd and the man in the foreground. The crowd is dense, suggesting a well-attended event, and their collective presence creates a sense of community and shared purpose.  The image captures a moment of collective enthusiasm and engagement, likely during a political event or a similar gathering where people come together to express their opinions and support for a cause."
image_2_4.jpg,Senator JD Vance speaks before former President Donald Trump at a campaign rally in Butler Pa. on October 5 2024. On July 13 2024 a gunman fired eight rounds at the former president and Republican presidential nominee during a rally in Butler. Trump was grazed by a bullet in the attack and Pennsylvania firefighter Corey Comperatore was killed as he tried to shield his family from the attack. Two other men were injured.,'I will never yield': Trump delivers defiant speech at site of his attempted assassination,https://www.usatoday.com/story/news/politics/elections/2024/10/05/trump-butler-rally-shooting/75517683007/,"The image depicts a political event where a man is addressing a crowd. The man is dressed in a dark suit and tie, suggesting a formal or professional appearance. He is standing on a stage with a microphone, indicating that he is the speaker at this event. The crowd is composed of people of various ages and genders, all focused on the speaker. Some of the individuals in the crowd are holding up signs, which indicates that they are supporters of the speaker or the political party he represents. The setting appears to be outdoors, as there is natural light illuminating the scene. The overall atmosphere suggests a political rally or campaign event."
image_3_1.jpg,Pro-Palestinian protesters gather on the State House lawn Saturday to oppose the Israel-Hamas war and to call for an end to U.S. military aid to Israel.,'It’s appalling what’s happening': Hundreds protest Israel-Hamas war at Providence rally,https://www.usatoday.com/story/news/local/2024/10/05/pro-palestine-rally-providence-hundreds-protest-israel-hamas-war-rhode-island-state-house/75534583007/,"The image depicts a large gathering of people in what appears to be a park or an open public space. The individuals are holding up various signs and banners, some of which are written in English, while others are in Arabic. The signs express political messages, with some calling for action against Lebanon, as indicated by the text ""Hands off Lebanon Now!"" and ""End Gaza Siege Now!"" The protesters are diverse in age and attire, with some carrying backpacks and handbags. The sky is partly cloudy, and the setting suggests a day with good weather. The overall atmosphere is one of peaceful demonstration, with the focus on political activism."
image_3_2.jpg,Pro-Palestinian protesters take to the streets after Saturday's rally on the State House lawn with a sizable police presence keeping the peace and blocking off traffic.,'It’s appalling what’s happening': Hundreds protest Israel-Hamas war at Providence rally,https://www.usatoday.com/story/news/local/2024/10/05/pro-palestine-rally-providence-hundreds-protest-israel-hamas-war-rhode-island-state-house/75534583007/,"The image depicts a large gathering of people on a street, which appears to be a protest or demonstration. The crowd is dense, with individuals of various ages and genders, and many are holding signs with messages that are not clearly legible in the image. Some of the signs are in English, and one is in Arabic, suggesting that the event may be related to Middle Eastern politics or issues.  The setting includes a mix of urban elements, such as buildings with signage, including a restaurant named ""Pei-Chang's."" There are also cars parked along the street, and the architecture suggests a city environment. The weather seems to be clear, with natural light illuminating the scene.  The atmosphere is one of peaceful assembly, with no visible signs of violence or disruption. The participants seem focused on their cause, and the event is taking place in an area that is accessible to the public. The image captures a moment of civic engagement and public protest."
image_3_3.jpg,Counterprotesters identifying themselves as the Rhode Island Coalition for Israel approach demonstrators at the pro-Palestinian rally shouting at the speakers.,'It’s appalling what’s happening': Hundreds protest Israel-Hamas war at Providence rally,https://www.usatoday.com/story/news/local/2024/10/05/pro-palestine-rally-providence-hundreds-protest-israel-hamas-war-rhode-island-state-house/75534583007/,"The image depicts a group of individuals gathered outdoors, engaged in what appears to be a political protest. The setting is a public space with a clear sky and a building in the background that resembles a government or institutional structure, possibly a Capitol or a similar official building.  The people in the image are diverse in appearance, with some wearing high-visibility vests, suggesting they may be law enforcement or security personnel. Others are dressed in casual attire, with some wearing headscarves and others sporting sunglasses. The individuals are holding up signs with messages, including one that reads ""WE STAND WITH ISRAEL,"" indicating their support for the country. The signs are colorful and feature the Israeli flag, along with the word ""STAND.""  The expressions on the faces of the individuals vary, with some looking serious and others appearing more relaxed. The overall atmosphere seems peaceful, with no signs of violence or aggressive behavior. The image captures a moment of political expression and solidarity among the group."
image_4_1.jpg,An American flag is suspended over a crowd of attendees at a Donald Trump campaign rally held Oct. 5 2024 in Butler Pa.,Trump rallies supporters in Butler where he survived an assassination attempt,https://www.usatoday.com/story/news/politics/elections/2024/10/05/trump-rally-butler-pa-assassination-attempt-spot/75395246007/,"The image depicts an outdoor event with a large crowd of people gathered in an open area. The attendees are seated on chairs and standing, with many wearing red hats, suggesting a coordinated event or team spirit. In the background, there is a large American flag hanging from a crane, which is a common symbol of patriotism and national pride. The flag is prominently displayed, indicating a theme of American unity or celebration.  There are also large banners with text on them, one of which reads ""MAKE AMERICA GREAT AGAIN,"" which is a slogan associated with a political campaign. The presence of this slogan, along with the American flag, suggests that the event may be related to a political rally or a gathering of supporters for a political candidate.  The setting appears to be a fairground or an outdoor venue with a stage, as there are speakers or performers visible on the stage. The sky is clear, indicating fair weather, which is typical for outdoor events. The overall atmosphere seems to be one of excitement and community engagement, with attendees participating in the event and showing their support."
image_4_2.jpg,Mark and Jodi Henry of Latrobe are shown next to paintings the couple brought to sell at a Donald Trump campaign rally in Butler Pa. on Oct. 5 2024.,Trump rallies supporters in Butler where he survived an assassination attempt,https://www.usatoday.com/story/news/politics/elections/2024/10/05/trump-rally-butler-pa-assassination-attempt-spot/75395246007/,"The image depicts two individuals standing in front of a large painting. The painting is a vibrant representation of a political figure, with the figure's face and upper body rendered in a realistic style, while the background is more abstract and colorful. The figure is holding an American flag, which is a central element of the artwork.  The two individuals in the foreground are wearing patriotic-themed clothing. The person on the left is wearing a sweatshirt with an eagle design and the phrase ""Bless America"" printed on it. The person on the right is wearing a similar sweatshirt with an eagle design and the phrase ""Bless America"" printed on it, but the eagle is depicted with a more detailed and realistic style. Both individuals are smiling and appear to be enjoying the moment.  The setting suggests that this could be an event or exhibition related to American culture or patriotism. The tent in the background indicates that the event might be outdoors or in a temporary structure. The overall atmosphere is cheerful and celebratory."
image_4_3.jpg,U.S. Rep. Mike Kelly whose 16th District includes Butler and Erie Pa. shakes hands with attendees during a Donald Trump campaign rally Oct. 5 2024 outside Butler Pa.,Trump rallies supporters in Butler where he survived an assassination attempt,https://www.usatoday.com/story/news/politics/elections/2024/10/05/trump-rally-butler-pa-assassination-attempt-spot/75395246007/,"The image depicts an outdoor scene where a man in a white shirt and a red tie is shaking hands with a woman in a blue shirt. The woman is wearing a baseball cap and has long hair. The man is wearing a white cap with a logo on the front. There are several other individuals in the background, some of whom are wearing sunglasses and hats. The setting appears to be a public area with a clear sky and greenery in the background. The man is wearing a lanyard with a badge, suggesting he may be a public figure or an official. The woman is wearing a blue shirt with the text ""Don't tread on me"" printed on it. The overall atmosphere seems to be casual and friendly."
image_5_1.jpg,Vice Mayor Jan-Michele Kearney right speaks with a guest at vice presidential candidate Tim Walz’s campaign fundraiser event Saturday Oct. 5 2024 at the National Underground Railroad Freedom Center in downtown Cincinnati.,Cincinnati Democrats welcome Tim Walz for fundraising event say he's the 'real deal',https://www.usatoday.com/story/news/politics/elections/2024/10/05/tim-walz-cincinnati-fundraising-event/75535470007/,"The image depicts two individuals engaged in what appears to be a conversation. The person on the left is an older adult, likely male, wearing a dark suit with a striped pattern and a light-colored shirt. He has gray hair and is looking slightly to his right with a focused expression. The person on the right is an adult female with dark hair, wearing a light blue jacket with a pin on the left lapel. She is smiling and looking towards the male, suggesting a friendly or positive interaction between them. The background is blurred, but it seems to be an outdoor setting with natural light, possibly during the day. There are no visible texts or distinctive brands in the image."
image_5_2.jpg,Students for Justice in Palestine protest outside of a fundraiser event for vice presidential candidate Tim Walz Saturday Oct. 5 2024 at the National Underground Railroad Freedom Center in downtown Cincinnati.,Cincinnati Democrats welcome Tim Walz for fundraising event say he's the 'real deal',https://www.usatoday.com/story/news/politics/elections/2024/10/05/tim-walz-cincinnati-fundraising-event/75535470007/,"The image depicts a group of individuals participating in what appears to be a protest or demonstration. The people are standing outdoors, with a clear sky and some clouds in the background. They are holding up various signs with messages that include political statements and slogans, such as ""FREE PALESTINE,"" ""STOP THE GENOCIDE IN GAZA,"" and ""END ALL U.S. AID TO APARTHEID ISRAEL."" Some of the signs also include the colors of the Palestinian flag, which are red, white, and green. The individuals are dressed in a variety of casual clothing, and some are wearing hats or headscarves. The setting suggests a public space, possibly a street or a square, and there is a vehicle visible in the background. The overall atmosphere of the image is one of peaceful assembly and political expression."
image_5_3.jpg,Actor and director Mario Van Peebles waits in line at a campaign event for Tim Walz the Democratic nominee for vice president Saturday Oct. 5 2024 at the National Underground Railroad Freedom Center in downtown Cincinnati.,Cincinnati Democrats welcome Tim Walz for fundraising event say he's the 'real deal',https://www.usatoday.com/story/news/politics/elections/2024/10/05/tim-walz-cincinnati-fundraising-event/75535470007/,The image depicts three men in what appears to be a professional setting. The man in the foreground is wearing a dark suit with a striped tie and a black fedora hat. He is smiling and looking directly at the camera. The man in the middle is holding a smartphone and appears to be checking it. He is wearing a dark suit with a blue striped tie and a white shirt. The man in the background is wearing a dark suit with a red tie and a white shirt. He is looking down and away from the camera. All three men are standing and seem to be engaged in a conversation or activity.
image_5_4.jpg,Security escorts Tim Walz the Democratic nominee for vice president through downtown Cincinnati after campaign fundraiser event at the National Underground Railroad Freedom Center Saturday Oct. 5 2024.,Cincinnati Democrats welcome Tim Walz for fundraising event say he's the 'real deal',https://www.usatoday.com/story/news/politics/elections/2024/10/05/tim-walz-cincinnati-fundraising-event/75535470007/,"The image depicts a bustling city street scene with a focus on a black Chevrolet SUV in the foreground. The vehicle is positioned in the center of the frame, facing towards the right side of the image. It has its headlights on, and there are red brake lights visible, indicating that the SUV is stationary or moving very slowly.  The Chevrolet SUV is equipped with a visible license plate that reads ""3918."" The vehicle's design features the Chevrolet emblem on the grille, and the headlights are clear, with the Chevrolet logo visible on the front.  Behind the SUV, there is a line of traffic that extends into the distance. The vehicles vary in color and model, but they all appear to be in motion, as suggested by the blurred effect that indicates speed. The traffic is dense, with vehicles occupying both lanes of the road.  The street is lined with buildings on both sides, which are a mix of commercial and residential structures. The architecture suggests an urban environment, possibly in the United States, given the style of the buildings and the layout of the street.  There are no visible texts or distinctive branding other than the Chevrolet SUV, and the image does not provide any specific details about the time of day or weather conditions. The style of the image is a real-life photograph with a focus on the SUV, capturing the everyday hustle and bustle of city traffic."
