image number,alt,article_heading,article_url,description
image_6_1.jpg,Texas Gov. Greg Abbott speaks during Iowa Gov. Kim Reynolds' Harvest Festival fundraiser at Oman Family Youth Inn at the Iowa State Fairgrounds on Saturday Oct. 5 2024 in Des Moines.,Texas Gov. Greg Abbott thanks Iowa for sending National Guard to border at Reynolds event,https://www.usatoday.com/story/news/politics/elections/2024/10/05/kim-reynolds-harvest-festival-greg-abbott-thanks-iowa-for-sending-national-guard-troops-to-border/75536007007/,"The image depicts an older man seated in a wheelchair, engaged in what appears to be a public speaking event. He is wearing a light blue, long-sleeved shirt and has a microphone in his right hand, which he is holding up as if he is speaking or gesturing. The man has a serious expression on his face, and his left hand is resting on his thigh. The background is blurred, but it suggests an indoor setting with a stage or podium, indicating that this might be a formal event or conference. The lighting is focused on the man, highlighting his features and the microphone, which is the central object in the image."
image_6_2.jpg,Gov. Kim Reynolds speaks during her Harvest Festival fundraiser at Oman Family Youth Inn at the Iowa State Fairgrounds on Saturday Oct. 5 2024 in Des Moines.,Texas Gov. Greg Abbott thanks Iowa for sending National Guard to border at Reynolds event,https://www.usatoday.com/story/news/politics/elections/2024/10/05/kim-reynolds-harvest-festival-greg-abbott-thanks-iowa-for-sending-national-guard-troops-to-border/75536007007/,"The image depicts a woman standing at a podium, speaking into a microphone. She appears to be in the middle of a speech or presentation. The woman has short, brown hair and is wearing a denim shirt. She is gesturing with her right hand, which is raised slightly as if she is emphasizing a point. The podium is white and has a clear, rectangular shape. Behind the woman, there is a large banner with text and a graphic on it. The text on the banner is not fully visible, but it seems to be related to the event or organization associated with the podium. The setting suggests an indoor event, possibly a conference or seminar. The woman's expression and body language indicate that she is engaged and passionate about her topic."
image_6_3.jpg,U.S. Sen. Joni Ernst speaks during Gov. Kim Reynolds' Harvest Festival fundraiser at Oman Family Youth Inn at the Iowa State Fairgrounds on Saturday Oct. 5 2024 in Des Moines.,Texas Gov. Greg Abbott thanks Iowa for sending National Guard to border at Reynolds event,https://www.usatoday.com/story/news/politics/elections/2024/10/05/kim-reynolds-harvest-festival-greg-abbott-thanks-iowa-for-sending-national-guard-troops-to-border/75536007007/,"The image depicts a woman standing on a stage, addressing an audience. She is holding a microphone in her right hand, which she is using to speak. The woman appears to be middle-aged, with short, gray hair. She is wearing a black blouse with a floral pattern. Her left hand is raised, with her index finger extended, possibly for emphasis or to signal a point. The background is not clearly visible, but there appears to be a banner or sign with text on it, suggesting that this might be a formal event or presentation. The lighting is focused on the woman, highlighting her as the central figure in the image."
image_7_1.jpg,Sept. 14 2024 in Springfield Ohio. The city has nearly 60000 residents. Officials acknowledge the headaches posed by the arrival of as many as 15000 Haitian migrants but say there is no evidence to support the claim that they are eating anyone's pets. Springfield Mayor Rob Rue has called on national leaders to temper their words and tell the truth. SAMANTHA MADAR/THE COLUMBUS DISPATCH,What racist attacks against Haitians in Ohio mean for immigrant voters in New Jersey,https://www.usatoday.com/story/news/new-jersey/2024/10/05/qu-significan-los-ataques-racistas-contra-los-haitianos-en-ohio-para-los-electores-inmigrantes/75535624007/,"The image depicts a vibrant street scene with a large, colorful mural on the side of a brick building. The mural is a lively depiction of a cityscape with buildings, trees, and a river, rendered in a variety of bright colors. The word ""Greetings"" is prominently displayed at the top of the mural in white letters, and below it, the word ""from"" in a smaller font. The cityscape is labeled ""Springfield Ohio"" in large, bold letters, with the word ""Ohio"" being particularly prominent. The mural is set against a brick wall, which adds a rustic charm to the scene. In the foreground, there is a sidewalk with a few people walking by, and a street sign is visible in the distance. The overall atmosphere of the image is cheerful and inviting, suggesting a welcoming community."
image_8_1.jpg,People wait in line to enter the National Underground Railroad Freedom Center for a campaign fundraiser event for vice presidential candidate Tim Walz on Saturday.,Cincinnati Democrats welcome Tim Walz for fundraising event say he's the 'real deal',https://www.usatoday.com/story/news/politics/2024/10/05/tim-walz-headlines-cincinnati-fundraising-event-for-campaign/75519458007/,"The image depicts a group of people gathered outside a building with a sign that reads ""National Underground Railroad Freedom Center."" The building has a modern architectural design with large windows and a glass facade. There are two banners hanging from the building; one is blue with white text and the other is green with white text. The blue banner has the text ""Harriet Tubman Commemorative Coin Program"" and ""Available for a limited time."" The green banner features an image of two children and the text ""Green Book July 15, 2024."" The people in the image appear to be tourists or visitors, and they are standing in front of the building, possibly admiring the architecture or waiting to enter the center."
image_8_2.jpg,Former state health director Amy Acton speaks with guests after a campaign fundraiser event for vice presidential candidate Tim Walz.,Cincinnati Democrats welcome Tim Walz for fundraising event say he's the 'real deal',https://www.usatoday.com/story/news/politics/2024/10/05/tim-walz-headlines-cincinnati-fundraising-event-for-campaign/75519458007/,"The image depicts two individuals engaged in what appears to be a conversation. The person on the left is wearing a dark-colored jacket and has short, graying hair. They are wearing large hoop earrings and glasses with a red accent. The person on the right has long, wavy brown hair and is wearing a dark blazer over a red top. Both individuals are looking towards each other, suggesting an exchange of ideas or discussion. The background is blurred, but it seems to be an indoor setting with a window, possibly indicating an office or a public space. The overall atmosphere is professional and the individuals seem to be adults."
image_9_1.jpg,Vice President Kamala Harris and former President Donald Trump.,From borders to 'Handmaid's Tale': What scares Trump Harris voters most in Michigan,https://www.usatoday.com/story/news/politics/elections/2024/10/05/trump-harris-voters-michigan/75533787007/,"The image is a split-screen of two individuals, a woman and a man, both smiling and looking directly at the camera. The woman is on the left side of the image, and the man is on the right. Both individuals appear to be middle-aged adults with fair skin tones.  The woman has long, straight brown hair and is wearing a white blouse with a pearl necklace. She is smiling broadly, showing her teeth, and her eyes are looking directly at the camera.  The man has short, blonde hair and is wearing a blue suit with a red tie. He is also smiling broadly and looking directly at the camera. His skin appears to be fair, and he has a noticeable mustache and goatee.  The background of the image is not clearly visible, but it appears to be an indoor setting with a neutral color palette. There are no visible texts or distinctive features that provide additional context about the individuals or the setting. The style of the image is a straightforward, side-by-side comparison of two individuals, likely intended to show their similarities or differences in appearance."
image_9_2.jpg,Chris Monk,From borders to 'Handmaid's Tale': What scares Trump Harris voters most in Michigan,https://www.usatoday.com/story/news/politics/elections/2024/10/05/trump-harris-voters-michigan/75533787007/,"The image depicts a woman standing in front of a large building with a prominent red and black logo that resembles a bird's head. The woman is wearing a red baseball cap with the words ""Make America Great Again"" embroidered on the front, and she has blonde hair tied back in a braid. She is wearing a bright green t-shirt and glasses. The woman is pointing towards the camera with her right hand, and she is smiling. In the background, there are other people, some of whom are wearing red shirts with similar ""Make America Great Again"" logos. The building appears to be a large structure with a mix of gray and red colors, and there is a blue tent set up to the right of the building. The setting seems to be an outdoor event or gathering."
image_9_3.jpg,Scott Doyen,From borders to 'Handmaid's Tale': What scares Trump Harris voters most in Michigan,https://www.usatoday.com/story/news/politics/elections/2024/10/05/trump-harris-voters-michigan/75533787007/,"The image depicts an outdoor event with a vintage car as the central focus. The car is a classic model, painted in a vibrant shade of blue, and features a prominent logo on the side that reads ""TRUMP MAKE AMERICA GREAT AGAIN!"" The logo is a stylized depiction of a blue eagle with the text ""TRUMP"" and ""MAKE AMERICA GREAT AGAIN!"" written in bold, capital letters. The car is parked on a paved surface, and there are several people milling about in the background, some of whom are under umbrellas, suggesting it might be a sunny day.  The setting appears to be a fair or festival, as indicated by the presence of food trucks and vendor tents in the background. The atmosphere is casual and lively, with attendees dressed in a variety of casual clothing. The sky is clear, and the lighting suggests it's daytime. The image captures a moment of everyday life with a political undertone due to the car's branding."
image_9_4.jpg,Shonda Edgerly 51 of Lapeer at a Kamala Harris rally in Flint Mich. Oct. 4 2024.,From borders to 'Handmaid's Tale': What scares Trump Harris voters most in Michigan,https://www.usatoday.com/story/news/politics/elections/2024/10/05/trump-harris-voters-michigan/75533787007/,"The image shows a woman with long, straight blonde hair and a fair complexion. She is wearing a denim jacket over a black t-shirt with a graphic design on the front. The design includes a red star and text that is not fully legible. The woman is looking directly at the camera with a slight smile.  In the background, there is a large indoor arena filled with spectators. The audience appears to be engaged in watching an event, possibly a concert or a sports game, given the presence of multiple people and the lighting that suggests an evening or indoor setting. The lighting is bright, illuminating the woman and the audience in the background. The image is a photograph with a focus on the woman, capturing her in the foreground with a blurred background to emphasize her presence."
image_9_5.jpg,LaShawn Lenton 53 of Flint Township at the Kamala Harris rally in Flint Mich. Oct. 4 2024.,From borders to 'Handmaid's Tale': What scares Trump Harris voters most in Michigan,https://www.usatoday.com/story/news/politics/elections/2024/10/05/trump-harris-voters-michigan/75533787007/,"The image shows a person standing indoors, likely in a room with a tiled floor. The individual is wearing a blue T-shirt with a graphic design on the front. The design features an American flag motif with the name ""CANDACE CAMALA"" printed across it. Below the name, there is a photograph of a woman with a smile, and the text ""PRESIDENT"" is visible, suggesting a political theme. The person is also wearing glasses with a reflective surface, possibly mirrored or metallic, and has braided hair. They are holding a brown purse with a strap over their shoulder. The background is nondescript, with a hint of a mirror and a person partially visible in the reflection, indicating the presence of another individual in the room. The style of the image is a candid photograph, likely taken in a casual setting."
image_9_6.jpg,Eugene Behme 66 of Flint at a Kamala Harris rally in Flint Oct. 4 2024.,From borders to 'Handmaid's Tale': What scares Trump Harris voters most in Michigan,https://www.usatoday.com/story/news/politics/elections/2024/10/05/trump-harris-voters-michigan/75533787007/,"The image shows a man standing in an indoor arena, likely at a sporting event. He is wearing a white t-shirt with the Jeep logo on the left side and a yellow circular sticker with the name ""Harris"" on the right side. The man appears to be middle-aged, with gray hair and glasses. He is looking directly at the camera with a slight smile. The background is dimly lit, with the main focus on the man in the foreground. The arena is filled with spectators, suggesting that the event is well-attended. The lighting and the crowd indicate that the event is likely taking place in the evening or at night."
image_10_1.jpg,,US Senate candidate Kari Lake unveils plan to cut costs when buying a home,https://www.usatoday.com/story/noticias/2024/10/05/kari-lake-propone-plan-de-vivienda-asequible-en-arizona/75512396007/,"The image depicts a political event where a woman is standing at a podium, addressing an audience. She appears to be the main speaker, as she is positioned in the center of the frame and is the only individual actively speaking. The podium has a microphone, suggesting that she is addressing the crowd.  Behind the podium, there are several individuals who seem to be supporters or attendees of the event. They are holding up signs with political messages, indicating their support for a particular cause or candidate. The signs are colorful and feature text that is not fully legible in the image.  The woman at the podium is wearing a white blazer and a dark top, which suggests a formal or semi-formal attire. She is holding a microphone, indicating that she is the one speaking at the moment.  The setting appears to be indoors, possibly in a conference room or a similar venue, given the presence of the podium and the audience. The lighting is even, and there are no visible windows or natural light sources, which suggests that the event is taking place in the evening or in a room with artificial lighting.  The image captures a moment of political discourse, with the woman at the podium appearing to be delivering a speech or making a statement, while the audience members are actively engaged in the event by holding up their signs. The overall atmosphere seems to be one of seriousness and focus, typical of political events."
image_10_2.jpg,Rep. Ruben Gallego answers questions during a town hall at the Pebble Creek Tuscany Clubhouse in Goodyear on April 3 2024.,US Senate candidate Kari Lake unveils plan to cut costs when buying a home,https://www.usatoday.com/story/noticias/2024/10/05/kari-lake-propone-plan-de-vivienda-asequible-en-arizona/75512396007/,"The image depicts a man standing in front of a microphone, appearing to be in the middle of a speech or presentation. He is wearing a white, button-up shirt and has a beard. The man is holding the microphone with his right hand, which is extended towards his mouth as if he is speaking. His left hand is slightly raised, and his fingers are spread apart, suggesting he is gesturing while speaking. The background is softly lit, with a warm glow that suggests an indoor setting, possibly a conference room or a similar venue. There is a red exit sign visible in the upper right corner of the image, indicating the presence of an emergency exit. The man's expression is focused, and his posture suggests he is engaged in delivering his speech or presentation."
