image number,alt,article_heading,article_url,description
image_1_1.jpg,Full halls: 215000 visitors came to Frankfurt for the 2023 Book Fair,Frankfurt Book Fair 2024: These celebrities are coming!,https://www.bild.de/regional/frankfurt/frankfurter-buchmesse-2024-diese-promis-kommen-2024-66f66fc049723c1ff7d14a65,"The image depicts a bustling scene inside a large convention center or exhibition hall. The space is filled with numerous people, all of whom appear to be attendees of the event. The individuals are scattered throughout the image, some closer to the camera and others further away, creating a sense of depth and activity.  The interior of the building is characterized by high ceilings and a spacious layout, with multiple aisles and walkways visible. The lighting is bright, illuminating the scene and highlighting the various elements within the space.  There are several stands or booths set up throughout the hall, each with its own unique design and color scheme. Some stands are adorned with colorful banners and signs, while others have more subdued color schemes. The stands are likely used for various purposes, such as product demonstrations, information dissemination, or sales.  The overall atmosphere of the image is one of organized chaos, with the crowd of people moving about and interacting with each other and the various stands. The image captures a moment in time at a busy event, conveying the energy and excitement of the attendees and the vibrant environment of the convention center."
image_1_2.jpg,Around 4000 publishers present their new releases,Frankfurt Book Fair 2024: These celebrities are coming!,https://www.bild.de/regional/frankfurt/frankfurter-buchmesse-2024-diese-promis-kommen-2024-66f66fc049723c1ff7d14a65,"The image depicts an indoor scene that appears to be a bookstore or a similar retail environment. The central figure is a woman walking towards the camera, dressed in a white blouse and gray pants. She carries a blue bag over her shoulder. Her posture suggests she is in motion, possibly browsing or shopping.  In the background, there are several other individuals, some of whom are carrying bags and appear to be engaged in various activities typical of a bookstore or similar retail setting. There are shelves filled with books and other items, indicating a wide selection of products for sale.  The lighting is bright, with a mix of overhead and task lighting, which is common in retail environments to create a welcoming atmosphere. The flooring is a red carpet, which is often used in retail spaces to draw attention and create a sense of luxury or importance.  The architecture includes a curved wooden structure that serves as a display or partition, and there are signs with text that are not fully legible in the image. The overall impression is of a bustling, well-stocked retail space where customers are browsing and shopping."
image_1_3.jpg,Thomas Gottschalk (right) comes to the book fair. At the Munich Oktoberfest he recently toasted with Arnold Schwarzenegger,Frankfurt Book Fair 2024: These celebrities are coming!,https://www.bild.de/regional/frankfurt/frankfurter-buchmesse-2024-diese-promis-kommen-2024-66f66fc049723c1ff7d14a65,"The image depicts two men in a social setting, possibly at a party or event. The man on the left is holding a mug with a cartoon character on it, and the man on the right is holding a mug with a similar design. Both men are smiling and appear to be enjoying themselves. They are surrounded by other individuals who are also smiling and seem to be in a jovial mood. The background is dimly lit, suggesting an indoor setting with warm lighting, and there are blurred figures that indicate a crowd or a group of people. The overall atmosphere of the image is cheerful and convivial."
image_2_1.jpg,Barbra Streisand bought a fake Van Gogh painting,Barbra Streisand unknowingly buys Van Gogh fake,https://www.bild.de/leben-wissen/barbra-streisand-ersteigert-unwissentlich-van-gogh-faelschung-67010122cbb3aa0a8a37a377,"The image presents a striking contrast between a portrait of a woman and a photograph of a woman. The portrait is a classic oil painting, rendered in the impressionist style, characterized by its loose brushstrokes and vibrant colors. The subject of the portrait is a woman, depicted with a contemplative expression, her gaze directed off to the side. She is adorned with a green hat, adding a pop of color to the composition.  Beside the portrait, there is a photograph of a woman. She is captured in a moment of joy, her face lit up with a warm smile. Her hair, styled in loose waves, frames her face beautifully. She is wearing a dark dress, which contrasts with the lighter tones of the portrait.  The two images are placed side by side, creating a visual dialogue between the traditional art form of the portrait and the modern medium of photography. The juxtaposition of the two images highlights the enduring power of art to capture the human experience, regardless of the medium used."
image_2_2.jpg,Woman with a green cap: On the left the original hangs in the Van Gogh Museum in Amsterdam; on the right the fake,Barbra Streisand unknowingly buys Van Gogh fake,https://www.bild.de/leben-wissen/barbra-streisand-ersteigert-unwissentlich-van-gogh-faelschung-67010122cbb3aa0a8a37a377,"The image you've provided appears to be a diptych, a type of artwork that consists of two panels or sections, often depicting a single theme or narrative. The style of the artwork is reminiscent of the Impressionist genre, characterized by its loose brushstrokes and emphasis on capturing the fleeting effects of light and color.  The left panel of the diptych shows a profile view of a woman's face, rendered with a palette dominated by earth tones and greens. The woman's features are subtly highlighted, with the artist using a range of colors to suggest depth and texture. The background is dark, which brings the focus to the subject's face.  The right panel mirrors the left in composition but presents a different color scheme. The woman's face is depicted with a palette of warm, golden hues, creating a contrast with the cooler tones of the left panel. The background is also dark, but the use of warm colors in the subject's face and clothing adds a sense of warmth and comfort to the scene.  The overall impression is one of a thoughtful and contemplative subject, captured in a moment of quiet introspection. The diptych format allows for a narrative to unfold across the two panels, inviting the viewer to consider the story behind the woman's gaze."
image_2_3.jpg,The fake flowers exposed this fake: In the original autumn begonias and not summer flowers are in the vases,Barbra Streisand unknowingly buys Van Gogh fake,https://www.bild.de/leben-wissen/barbra-streisand-ersteigert-unwissentlich-van-gogh-faelschung-67010122cbb3aa0a8a37a377,"The image depicts an impressionist painting of a bustling café scene. The color palette is dominated by earth tones, with a prevalence of browns, grays, and greens, which gives the scene a warm and cozy atmosphere. The brushstrokes are loose and visible, a characteristic of the impressionist style, which adds a sense of movement and life to the scene.  The café is filled with people, some of whom are seated at tables, engaged in conversation or enjoying their meals. The tables are adorned with various items, including bottles, cups, and vases, which are rendered with a high level of detail, suggesting a focus on the everyday objects that make up the café's ambiance.  The background features a large window, through which the interior of the café is visible, and a painting on the wall, which adds depth to the scene and hints at the café's artistic clientele. The overall composition and subject matter of the painting suggest it could be a work by an artist such as Vincent van Gogh, who was known for his café scenes."
image_2_4.jpg,A supposed self-portrait of van Gogh,Barbra Streisand unknowingly buys Van Gogh fake,https://www.bild.de/leben-wissen/barbra-streisand-ersteigert-unwissentlich-van-gogh-faelschung-67010122cbb3aa0a8a37a377,"The image depicts a portrait of a man, rendered in an impressionistic style. The man is bald, with a full beard and mustache, and is wearing a green jacket with a red emblem on the left side. The background is a warm yellow, and the painting is signed ""H. de Toulouse-Lautrec"" in the lower right corner. The portrait is characterized by loose brushstrokes and a vibrant color palette, which are typical of the impressionist genre. The man's expression is serious, and the overall composition is balanced and harmonious."
image_3_1.jpg,The cinema is not always so empty. And then the fight for the armrest begins,Who owns the armrest in the cinema?,https://www.bild.de/lifestyle/kultur/ratgeber/wem-gehoert-die-armlehne-im-kino-64f85a9921b67127f15e50ce,"The image depicts an auditorium with rows of red seats. The seats are arranged in a semi-circular pattern, typical of a theater or concert hall, with the front row facing the stage or performance area. The seats are upholstered in a rich, red fabric that gives the impression of luxury and comfort. The armrests of the seats are black, providing a contrast to the red upholstery. The floor of the auditorium is not visible, but the lighting suggests an indoor setting. The style of the image is a photograph with a focus on the seating arrangement, likely taken from the perspective of someone seated in the audience. There are no visible texts or distinctive branding in the image."
image_4_1.jpg,Salvator mundi – the 450 million euro painting will soon hang in a Louvre branch in Saudi Arabia,406 million euros: World's most expensive painting by d aVinci discovered,https://www.bild.de/leben-wissen/versteckt-in-geheimnisvollem-lager-teuerstes-gemaelde-der-welt-entdeckt-66c44c4e8e840b14905e3e38,"The image you've provided appears to be a painting of the Mona Lisa, a famous artwork by Leonardo da Vinci. The painting is known for its enigmatic subject and the artist's innovative use of sfumato, a technique that creates a soft transition between colors and tones. The subject is depicted with a subtle, knowing smile and a gaze that seems to follow the viewer around the room. The background is dark, which makes the subject stand out, and the painting is framed with ornate gold detailing. The subject is dressed in a blue robe with a golden chain, and she holds a small globe in her left hand. The painting is encased in a gold frame with intricate designs, which adds to the overall elegance and historical significance of the artwork."
image_4_2.jpg,Camel market in Saudi Arabia: In the desert country the sheikh is planning an art museum that will outshine the Louvre in Paris,406 million euros: World's most expensive painting by d aVinci discovered,https://www.bild.de/leben-wissen/versteckt-in-geheimnisvollem-lager-teuerstes-gemaelde-der-welt-entdeckt-66c44c4e8e840b14905e3e38,"The image depicts a vast, arid landscape with a group of camels standing in the foreground. The camels are of various sizes, suggesting a mix of adults and younger ones. They are positioned in a line, facing the same direction, and appear to be standing still. The terrain is flat and sandy, with a few scattered rocks and shrubs. In the background, there is a large, imposing sand dune with a reddish-brown hue, which is characteristic of desert environments. The sky is clear with a gradient of colors, suggesting either sunrise or sunset. There are no visible texts or distinctive markings that provide additional context within the image. The style of the image is a realistic photograph with a focus on the natural environment and the animals within it."
image_5_1.jpg,High cheekbones Jesus Christ according to AI,Jesus Christ: AI shows the face of the Son of God,https://www.bild.de/leben-wissen/jesus-christus-ki-zeigt-das-gesicht-des-sohn-gottes-66c8208f7ecdec7a16ef3d00,"The image you've provided appears to be a stylized or artistic representation of a man's face and upper body. The style is reminiscent of a vintage or aged photograph, with a sepia or brownish tone that gives it a historical or nostalgic feel. The man's facial features are prominent, with a full beard and mustache, and his hair is long and appears to be wet, suggesting he might have been in water or sweating. His expression is serious and contemplative, with his gaze directed slightly to the side. The texture of the image is rough and uneven, with visible lines and cracks that enhance the aged look of the photograph. There are no texts or additional elements visible in the image."
image_5_2.jpg,The Shroud of Turin in the Church of San Lorenzo,Jesus Christ: AI shows the face of the Son of God,https://www.bild.de/leben-wissen/jesus-christus-ki-zeigt-das-gesicht-des-sohn-gottes-66c8208f7ecdec7a16ef3d00,"The image depicts an indoor religious ceremony, likely a Catholic Mass, given the presence of clergy and the style of the altar. The setting appears to be a church or cathedral, characterized by a large, ornate crucifix on the right side of the frame, which is a common feature in Christian places of worship. The altar is draped with a red cloth, which is also typical for Catholic ceremonies.  In the foreground, there are several individuals dressed in religious robes, suggesting they are priests or bishops. One of them is standing at the altar, possibly the celebrant of the Mass, while the others are seated or standing around the altar, participating in the ceremony. The robes are white, which is a common color for Catholic clergy, and they are adorned with crosses and other religious symbols.  The background features a large painting or tapestry, which is a common element in churches to depict religious scenes or stories. The painting is framed by a dark border, and it is positioned above the altar, which is a common placement for such artworks in religious settings.  The audience is not visible in the image, but the presence of the clergy and the altar suggests that there is a congregation present, although they are not the focus of the image. The lighting is soft and ambient, typical of indoor religious ceremonies, and the overall atmosphere is solemn and reverent."
image_6_1.jpg,On Tuesday (13 August) the latest Banksy work was discovered at the zoo. A gorilla releasing animals suddenly appeared on a roller shutter,Banksy continues mysterious animal series in London,https://www.bild.de/news/ausland/banksy-setzt-geheimnisvolle-tier-reihe-in-london-fort-66baf6571b32861f6ad546b0,"The image depicts a large, white garage door with a striking black and white mural painted on it. The mural features a dynamic scene of a gorilla interacting with a bird. The gorilla, which is the central figure in the image, is depicted in a dynamic pose, with its arms extended towards the bird. The bird, on the other hand, is captured mid-flight, with its wings spread wide as it seems to be either landing or taking off from the gorilla's head.  The background of the mural is a simple, unadorned white, which serves to highlight the contrast between the black and white elements of the painting. The gorilla and the bird are the only two figures in the mural, and their interaction forms the focal point of the composition.  The garage door itself is a standard, industrial-style door with a corrugated metal surface. It's a large, rectangular door that takes up most of the image. The door is closed, and there are no visible handles or locks, suggesting that it is not currently in use.  The mural is painted in a realistic style, with careful attention to detail that brings the scene to life. The use of black and white gives the mural a timeless quality, and the contrast between the two colors adds depth and dimension to the scene.  Overall, the image presents a unique blend of urban and artistic elements, with the gorilla and bird mural adding a touch of whimsy and intrigue to an otherwise ordinary garage door."
image_6_2.jpg,The swarm of piranhas that the artist had immortalised on a police box attracted many onlookers. The police even had to regulate traffic,Banksy continues mysterious animal series in London,https://www.bild.de/news/ausland/banksy-setzt-geheimnisvolle-tier-reihe-in-london-fort-66baf6571b32861f6ad546b0,"The image depicts an urban scene with a focus on a man standing in front of a blue police booth. The booth is adorned with a graphic of fish, suggesting it might be related to a fishing or marine patrol unit. The text ""City of London Police"" is visible on the booth, indicating the affiliation of the police unit.  The man appears to be in the middle of a conversation or taking a photograph, as he is holding a smartphone in his hand. He is wearing a light blue shirt and glasses, and his posture suggests he is engaged in an activity.  In the background, there are vehicles, including a truck and a car, indicating that this scene takes place on a city street. The architecture and the presence of a traffic cone suggest that this is a busy urban area with ongoing construction or roadwork.  The overall atmosphere of the image is that of a typical day in a bustling city, with the police booth serving as a point of interest or interaction for passersby."
image_6_3.jpg,The old billboard on which Banksy had sprayed a cat has now been removed by the owner – to boos from disappointed Banksy fans,Banksy continues mysterious animal series in London,https://www.bild.de/news/ausland/banksy-setzt-geheimnisvolle-tier-reihe-in-london-fort-66baf6571b32861f6ad546b0,"The image depicts a large, weathered wooden wall with a prominent black silhouette of a cat in the center. The cat is depicted in a dynamic pose, with its tail extended and its body arched, as if it is either jumping or running. The silhouette is detailed, with the cat's features such as its ears, eyes, and whiskers clearly visible.  The wall itself appears to be old and has a rough texture, with visible cracks and missing panels. There are areas where the wood is peeling away, revealing the layers underneath. The wall is partially covered with greenery, with vines and small plants growing up the sides, suggesting that the wall has been exposed to the elements for some time.  At the top of the wall, there is a red strip with white text that reads ""HIBBARD MEDIA."" The text is in capital letters and is centered on the strip. The style of the image is a straightforward, unembellished photograph with no filters or artistic effects applied. The focus is on the cat silhouette and the condition of the wall, with the text serving as a label or title."
image_6_4.jpg,Coldly dismantled - will the thieves sell Banksy's wolf bowl?,Banksy continues mysterious animal series in London,https://www.bild.de/news/ausland/banksy-setzt-geheimnisvolle-tier-reihe-in-london-fort-66baf6571b32861f6ad546b0,"The image depicts a satellite dish with a unique design. The dish is circular and appears to be made of a metallic material, possibly aluminum or copper. On the dish, there is a black silhouette of a wolf's head and body, facing to the left. The wolf is depicted in a stylized manner, with a simple, bold outline that gives it a striking appearance against the white background of the dish.  The dish is mounted on a rooftop, which is visible in the foreground. The rooftop is made of red brick, and there is a chimney on the right side of the image. The chimney is made of the same red brick as the rooftop and has a simple design with a flat top.  In the background, there is a red brick building with a white door. The building has a flat facade with no visible windows or architectural details. The sky is overcast, suggesting an overcast or cloudy day.  The image is a photograph with natural lighting, and the focus is on the satellite dish and its unique design. There are no visible texts or branding in the image. The style of the image is straightforward and documentary, capturing the subject without any artistic embellishments."
image_6_5.jpg,Two Banksy pelicans now decorate “Bonner’s Fish Bar” in Walthamstow in East London. This work is theft-proof,Banksy continues mysterious animal series in London,https://www.bild.de/news/ausland/banksy-setzt-geheimnisvolle-tier-reihe-in-london-fort-66baf6571b32861f6ad546b0,"The image depicts a vibrant street scene with a focus on a fish bar named ""Bonners Fish Bar."" The building facade is painted in a light color, and the fish bar's sign is prominently displayed with a yellow background and black text. Above the sign, there is a mural of a bird, possibly a crane or a stork, which adds a touch of whimsy to the scene.  In front of the fish bar, there are two individuals. On the left, a child is standing, looking at the fish bar with curiosity. On the right, a woman is pushing a stroller, possibly with a child inside, and she is looking towards the fish bar as well. Both individuals appear to be engaged with the fish bar, perhaps considering a visit.  The street is lined with parked cars, indicating that this is a residential or commercial area with some traffic. There is a street sign visible in the background, but the specific details are not clear. The overall atmosphere of the image suggests a casual, everyday moment in a community where local businesses like the fish bar are part of the neighborhood's fabric."
image_6_6.jpg,Three monkeys dangle from this bridge,Banksy continues mysterious animal series in London,https://www.bild.de/news/ausland/banksy-setzt-geheimnisvolle-tier-reihe-in-london-fort-66baf6571b32861f6ad546b0,"The image depicts a concrete bridge with a mural painted on its underside. The mural features three figures that appear to be monkeys or apes, each in a different pose of movement. The figures are drawn in black and white, with the use of shading to give them a three-dimensional appearance. The bridge itself is a modern structure with a metal railing along its edge. The surrounding environment includes trees and buildings, suggesting an urban setting. The mural adds a touch of artistic expression to the otherwise functional infrastructure."
image_7_1.jpg,CDU SPD and Co. associate 16 to 24 year olds with the term incompetence – and are looking for alternatives,New study shows: Generation Z votes for the AfD out of frustration,https://www.bild.de/leben-wissen/neue-studie-zeigt-generation-z-waehlt-die-afd-aus-frust-66a0eed8964fb2199b75affd,"The image depicts a group of five young adults standing against a white brick wall. They appear to be teenagers or young adults, possibly friends or classmates. The group consists of three males and two females. The males are on the left and right sides of the group, with the females in the center.   The individuals are dressed in casual attire, with the males wearing button-up shirts and the females in tops and jackets. They are all looking directly at the camera, suggesting they are posing for the photo. The brick wall behind them provides a textured backdrop that contrasts with their clothing. The overall style of the image is candid and informal, capturing a moment of youth and camaraderie."
image_8_1.jpg,No longer part of a Disney attraction after more than 50 years: “Liver Lips McGrowl” has been retired,Disneyland: Disney sorts out bears after more than 50 years,https://www.bild.de/leben-wissen/kultur/disneyland-disney-sortiert-baeren-nach-mehr-als-50-jahren-aus-669a04d527fe34048f5fd8d4,"The image depicts a character that appears to be a bear, anthropomorphized with human-like features. The bear is standing upright on its hind legs, wearing a blue shirt and a red bandana around its neck. It holds a small, colorful ukulele in its paws, suggesting that it is playing the instrument. The bear's face is detailed with human-like eyes and a mouth, and it has a fur texture that gives it a soft and cuddly appearance. The background is a stage with red curtains, which indicates that the bear might be performing in a theatrical setting. The lighting is focused on the bear, highlighting its features and creating a dramatic effect."
image_9_1.jpg,She uncovered the secrets of nuclear fission: the brilliant physicist Lise Meitner at the age of 84,SHE made Oppenheimer’s work possible,https://www.bild.de/lifestyle/kultur/futtern/oppenheimer-film-ohne-sie-lise-meitner-war-die-mutter-der-kernkraft-87443382.bild.html,The image is a black and white photograph of an older woman. She is wearing a dark suit with a tie and a hat. The woman is smiling and appears to be in a good mood. She is holding a small object in her hands. The background is plain and does not provide any additional context.
image_10_1.jpg,The auction house Ketterer in Munich auctioned the painting “Dance in the Variety Show” from 1911 by Ernst Ludwig Kirchner on Friday,Auction in Munich: Paintings believed lost sold for 15 million euros,https://www.bild.de/regional/muenchen/auktion-in-muenchen-verschollen-geglaubte-gemaelde-fuer-15-mio-euro-versteigert-6663464ff2bbf90e361d13ed,"The image depicts an indoor scene where a woman is standing in front of a framed artwork. The artwork is a vibrant impressionist painting featuring a group of people in a lively dance. The figures are rendered with loose brushstrokes, a characteristic of the impressionist style, and are colored in a palette of warm hues, predominantly reds, pinks, and yellows. The background of the painting is a lighter shade, possibly a pale blue or green, which contrasts with the warm tones of the figures.  The woman standing in front of the painting is wearing a maroon coat with a high collar and a dark belt. Her hair is long and blonde, and she appears to be looking at the painting with interest. The lighting in the room is soft, and the wall behind the painting is a neutral color, which allows the artwork to stand out prominently. The overall atmosphere of the image suggests a quiet moment of contemplation or appreciation of art."
