article_number,image number,alt,article_heading
1,1,Illustras: murder death suicide lines police police line,Pilu Bochad 7 Year Old Tewas in Ritual Garbage of India
2,1,The rubble of destroyed buildings lies at the site of Israeli strikes in Saksakiyeh southern Lebanon September 26 2024. Reuters/Ali Hankir,Israel-Hizbullah Members Japan Serukan Warganya Tinggalkan Lebanon!
3,1,The greatest fear an intruder in the house.,Woman WNI Luka Parah Ditikam Kekasihnya di Malaysia
4,1,One of candidates Shigeru Ishiba casts his ballot at the Liberal Democratic Party's (LDP) leadership election Friday Sept. 27 2024 in Tokyo. Hiro Komae/Pool via Reuters Purchase Licensing Rights,Mantan Menhan Shigeru Ishiba Now PM of Japan
5,1,,Conflict in Myanmar Menghlangi Project Ambitious China
5,2,Peta Parbatsan China-Myanmar,Conflict in Myanmar Menghlangi Project Ambitious China
5,3,Map of China-Myanmar economic corridor,Conflict in Myanmar Menghlangi Project Ambitious China
6,1,A supporter of Republican presidential candidate Donald Trump holds an American flag as Trump speaks at a campaign rally in Milford New Hampshire February 2 2016. Reuters/Mike Segar,Keuskupan New York Bangkrut Pay Rp 48 T ke Korban Pelecehan Sex
7,1,French President Emmanuel Macron reacts during a press conference about the priorities of his Renaissance party and its allies ahead of the early legislative elections in Paris France June 12 2024. Reuters/Stephane Mahe/ File Photo Purchase Licensing Rights opens new tab,Macron calls Netanyahu Salah if he weighs Gencatan in Lebanon
8,1,Saudi Arabia's Foreign Minister Prince Faisal bin Farhan Al Saud arrives at a side event during an event commemorating the 75th Anniversary of the Universal Declaration of Human Rights amid the ongoing conflict between Israel and the Palestinian Islamist group Hamas at the United Nations in Geneva Switzerland December 12 2023. Reuters/Denis Balibouse/File Photo Acquire Licensing Rights,Arab Saudi General Coalition Global to destroy Palestine
9,1,Israel's Iron Dome anti-missile system operates for interceptions as rockets are launched from Lebanon towards Israel amid cross-border hostilities between Hezbollah and Israel as seen from Haifa Israel September 23 2024. Reuters/Ronen Zvulun,Israel refuses to send shipments to Iran's Hizbullah
10,1,Victorville CA / USA â March 27 2017: The Boeing Companyâs logo on wall of a building at the Southern California Logistics Airport in Victorville California.,AS Command Inspection System Kemudi Boeing 737 Ada Apa?
