image number,alt,article_heading,description
image_1_1.jpg,Close up shot of yellow police tape against police lights,BCSO arrests posts photo of teen accused of posting 'I'm shootin this school up',"The image shows a close-up of a yellow police line tape, which is a common method used to cordon off an area for security or safety reasons. The tape is marked with the words ""POLICE LINE DO NOT CROSS"" in bold, capitalized letters, indicating that it is a boundary set by law enforcement. The background is blurred, but it appears to be a nighttime scene with artificial lighting, possibly from police lights or other sources of illumination. The focus is on the tape, which is the central subject of the image. The style of the image is a real-life photograph with a shallow depth of field, emphasizing the tape in the foreground while the background is out of focus."
image_2_1.jpg,no alt text,Woman was found shot multiple times on I-195 in Miami Beach. Cops have made an arrest,"The image shows a pair of handcuffs against a dark wooden background. The handcuffs are metallic with a silver finish, and they are designed with a keyhole in the center of the right cuff. The cuffs are open and resting on the surface, with the left cuff facing the viewer and the right cuff facing away. The keyhole is visible and appears to be a standard design with a small key slot. The handcuffs are the central focus of the image, and the background is out of focus, emphasizing the handcuffs' design and the texture of the wooden surface. There are no texts or additional elements in the image."
image_3_1.jpg,The Dane County Regional Airport's recent expansion its largest ever includes three new gates.,Madison airport has one of USA TODAY's 10Best shopping experiences,"The image depicts an interior view of a spacious, well-lit airport terminal. The ceiling is high with a series of rectangular windows that allow natural light to flood the space. The floor is covered with large, polished tiles that reflect the light, enhancing the brightness of the area. The walls are painted in a light color, complementing the overall airy and clean aesthetic of the space.  The terminal is equipped with various amenities, including seating areas with chairs and tables, and several potted plants placed strategically throughout the space, adding a touch of greenery. The lighting is a mix of natural and artificial, with recessed ceiling lights providing additional illumination.  The perspective of the image is from the center of the terminal, looking towards the far end where the terminal opens up into a larger space, suggesting a sense of depth and continuity. The overall impression is one of a modern, efficient, and comfortable transportation hub."
image_4_1.jpg,no alt text,Republican Ashlee Adams candidate for NC Senate District 18 answers our questions,"The image shows a woman seated in a room that appears to be a living area. She is wearing a gray sweater and a white shirt, and she has her elbows resting on a surface that could be a table or a low piece of furniture. The woman has shoulder-length brown hair and is looking directly at the camera with a slight smile. She is wearing a pair of hoop earrings.  The room has a cozy feel with a mix of furniture and decor. There is a white sofa in the background, and a bookshelf filled with various items can be seen to the right. The lighting in the room is soft and warm, suggesting an indoor setting with ambient lighting. The overall style of the image is casual and appears to be a candid moment rather than a posed portrait."
image_5_1.jpg,no alt text,Arizona's 10 most famous caves and caverns: Here's how to explore them,"The image depicts a group of five individuals standing on a rocky outcrop, silhouetted against a backdrop of a vast, arid landscape. The sky is a clear blue, suggesting it might be late afternoon or early evening. The terrain is rugged and appears to be part of a larger mountainous region, with a mix of rocky formations and sparse vegetation. The people are standing in a line, facing the same direction, which gives the impression that they are looking out over the landscape or possibly observing something in the distance. The lighting is such that the shadows of the individuals are cast on the rock, creating a dramatic effect. The overall scene conveys a sense of adventure and exploration in a natural, outdoor setting."
image_6_1.jpg,no alt text,Who is Shelli Boggs Maricopa County school superintendent candidate?,"The image depicts a woman standing at a podium, speaking to an audience. She appears to be in the middle of a speech or presentation. The woman has long, straight blonde hair and is wearing a red top. She is holding a microphone, suggesting she is addressing the crowd.  Behind the podium, there is a large banner with text on it. The text reads ""TEXT ARIZONA TO 88022 TRUMP VANCE."" This suggests that the event is related to a political campaign or event, possibly in support of a candidate named Trump Vance.  The audience in the background is not in focus, but it appears to be a diverse group of people, some of whom are wearing red, which could indicate support for the candidate mentioned in the banner. The setting seems to be indoors, possibly at a political event or rally."
image_7_1.jpg,<span>‘This is about setting the stage to claim an election was stolen.’</span><span>Composite: Rita Liu/The Guardian/Getty Images</span>,‘I was stunned’: the eligible voters targeted by non-citizen voting myth,"The image depicts a scene of a voting area where a group of people are standing in line, waiting to cast their ballots. The setting appears to be an indoor space, possibly a polling station, with a large window or glass partition visible in the background, allowing natural light to enter the room.  The people in the image are shown in various poses, some standing still, others possibly moving or interacting with each other. They are dressed in a variety of casual and semi-formal attire, suggesting a diverse group of individuals. The lighting in the room is soft and even, with no harsh shadows, indicating that the photo was taken during the day.  In the foreground, there is a prominent voting booth with the words ""VOTE HERE"" printed on it in bold, capitalized letters. The booth is marked with an American flag, symbolizing the democratic process and the civic duty of voting. The flag's presence reinforces the context of an election in the United States.  The image is in black and white, which gives it a timeless and classic feel. The absence of color draws attention to the shapes, textures, and patterns within the scene, emphasizing the human element of the voting process. The monochromatic palette also adds a layer of depth and contrast to the image, highlighting the subjects and their actions.  Overall, the image captures a moment of civic engagement and democratic participation, with a focus on the human experience of voting."
image_8_1.jpg,The newly opened Foothills Trail bridge connects King and Pierce County over the White River on Tuesday Oct. 1 2024 in Enumclaw Wash.,New $16 million bridge extends popular Pierce County trail to 22 miles into King County,"The image presents an aerial view of a winding road that cuts through a lush, forested landscape. The road, appearing as a thin ribbon of gray, meanders through the dense greenery, with its path curving gently to the right. The forest is a vibrant mix of green and brown, indicating a variety of tree species and possibly seasonal changes. The road is bordered by a mix of trees and shrubs, with some areas appearing more densely wooded than others. The sky above is a clear blue, suggesting a sunny day. The overall scene is one of tranquility and natural beauty, with the road serving as a pathway through the heart of the forest."
image_8_2.jpg,The newly opened Foothills Trail bridge connects King and Pierce County over the White River on Tuesday Oct. 1 2024 in Enumclaw Wash.,New $16 million bridge extends popular Pierce County trail to 22 miles into King County,"The image depicts a serene landscape featuring a bridge crossing over a river. The bridge, constructed from a reddish-orange metal, has a distinctive curved design that allows it to span the width of the river. It is supported by sturdy concrete pillars that are partially submerged in the water, indicating the river's depth.  The river itself is a light blue-green color, suggesting it's a clear, calm day. It's surrounded by a lush green forest, with various shades of green foliage and trees that provide a natural backdrop to the scene. The forest appears dense and well-preserved, indicating a healthy ecosystem.  The sky above is a clear blue with no visible clouds, suggesting a sunny day. The overall scene is tranquil and picturesque, with the bridge serving as a focal point that connects the two sides of the river. The image does not contain any visible text or human activity, giving it a peaceful and untouched quality."
image_8_3.jpg,The newly opened Foothills Trail bridge connects King and Pierce County over the White River on Tuesday Oct. 1 2024 in Enumclaw Wash.,New $16 million bridge extends popular Pierce County trail to 22 miles into King County,"The image depicts a picturesque scene of a suspension bridge crossing over a lush, green forest. The bridge, constructed from a reddish-brown metal, features a distinctive arch design with multiple suspension cables that connect the two towers. The towers themselves are tall and slender, with a series of diagonal braces that add to their structural integrity.  The bridge is set against a backdrop of a clear blue sky, which contrasts beautifully with the verdant trees below. The forest is dense and appears to be teeming with life, with a variety of tree species visible. The bridge's position in the center of the image draws the viewer's eye, creating a sense of depth and perspective.  The image is taken from a perspective that allows the bridge to dominate the scene, with the forest extending into the distance on either side. The overall composition of the image suggests a tranquil and serene environment, perhaps a popular spot for nature lovers and photographers."
image_9_1.jpg,John Drake is running for San Luis Obispo City Council.,From housing to downtown here’s how candidates for SLO City Council and mayor compare,"The image shows a man with a friendly and approachable demeanor. He has a mustache and is smiling broadly, which suggests he is in a good mood or enjoying the moment. The man has short, light-colored hair and is wearing a green shirt. His posture is relaxed, with his arms crossed in front of him, which can indicate confidence or a casual attitude. The background is blurred, but it appears to be an outdoor setting with natural light, possibly a park or garden. The focus is on the man, and the image is cropped to show him from the chest up."
image_9_2.jpg,Felicia Lewis is running for San Luis Obispo City Council.,From housing to downtown here’s how candidates for SLO City Council and mayor compare,"The image depicts a woman standing outdoors during what appears to be either early morning or late afternoon, given the soft lighting and the presence of shadows. The woman is wearing a dark-colored blazer over a black top, which could be a blouse or a dress. She has long, dark hair that cascades down her shoulders, and she is smiling at the camera, suggesting a friendly or approachable demeanor.  The woman is positioned in front of a building with a visible sign that is not legible in the image. To her right, there is a street lamp with a cylindrical base and a vertical pole, which is typical of urban street lighting. The background is slightly blurred, drawing focus to the woman, but it seems to be an urban environment with buildings and possibly trees or greenery, indicating that she might be in a city or town center.  The style of the image is reminiscent of a portrait or a headshot, with a focus on the subject and a shallow depth of field to emphasize her face and upper body. The lighting is soft and natural, enhancing the subject's features without harsh shadows or highlights."
image_9_3.jpg,San Luis Obispo Mayor Erica Stewart speaks at the opening of Broad Street Place a People’s Self-Help Housing affordable housing development Jan. 20 2024.,From housing to downtown here’s how candidates for SLO City Council and mayor compare,"The image depicts a woman standing in front of a microphone, addressing an audience. She appears to be the main speaker at an event. The woman has curly hair and is wearing a dark blazer over a blue top. She is gesturing with her right hand, which suggests she is in the middle of her speech.  The background features a large banner with the text ""People's Self-Help Housing"" repeated multiple times. The banner is predominantly white with the text in a bold, red font. The repetition of the text indicates that the event is likely related to this organization, which is known for its community-driven housing initiatives.  The setting appears to be indoors, possibly in a conference room or a similar venue, given the presence of the microphone and the banner. The lighting is even, suggesting an indoor environment with artificial lighting. The overall atmosphere seems professional and focused on the speaker's message."
image_9_4.jpg,Jan Howell Marx is running for San Luis Obispo City Council.,From housing to downtown here’s how candidates for SLO City Council and mayor compare,"The image shows a woman with a warm and friendly demeanor. She has curly brown hair and is wearing glasses with a pink frame. Her attire consists of a white blazer over a black top, and she is accessorized with a necklace featuring a round pendant. The background is plain and white, which puts the focus entirely on her. The woman appears to be middle-aged and is smiling, suggesting a positive and approachable personality."
image_9_5.jpg,Mike Boswell is running for San Luis Obispo City Council.,From housing to downtown here’s how candidates for SLO City Council and mayor compare,"The image shows a man standing against a plain, light-colored background. He appears to be middle-aged, with a fair complexion and short, graying hair. The man is wearing a collared shirt with a pattern of small, dark squares that give it a checkered appearance. The shirt is buttoned up and has a collar that is slightly turned down. He is also wearing glasses with a dark frame, which are perched on the bridge of his nose. The man is smiling and looking directly at the camera, suggesting that the photo is meant to be a portrait or a professional headshot. There are no visible texts or distinguishing marks that provide additional context about the man or the setting. The style of the image is straightforward and appears to be a standard portrait photograph."
image_10_1.jpg,Clint Weirick is running unopposed for the District 2 City Council seat in Grover Beach.,Where do Grover Beach candidates for mayor City Council stand on housing infrastructure?,"The image depicts a man standing at a podium, appearing to be in the middle of a speech or presentation. He is wearing a dark blue polo shirt and has a watch on his left wrist. The man has short, dark hair and is looking slightly to his right with a focused expression. He is holding what appears to be a microphone, suggesting he is addressing an audience. The background is blurred, but it seems to be an indoor setting with a blue curtain, which could indicate that the event is taking place in a conference room or a similar venue. The lighting is even, and the man is the central figure in the image."
image_10_2.jpg,Nan’s in Grover Beach is expanding its offerings to include crystals under the ownership Kassi Dee granddaughter of founder Nan Fowler. She’s seen here with Scout Finch one of the store cats.,Where do Grover Beach candidates for mayor City Council stand on housing infrastructure?,"In the image, there is a woman standing in a room filled with bookshelves. She is wearing a floral shirt and glasses. The woman is holding a cat that is sitting on her shoulder. The cat appears to be a tabby with a mix of brown and white fur. The room has a warm and cozy atmosphere, with wooden bookshelves filled with books and various items. There are also some jewelry pieces hanging on the wall. The woman and the cat seem to be enjoying their time in this comfortable setting."
image_10_3.jpg,Marsha Bolyanatz is running for City Council in Grover Beach.,Where do Grover Beach candidates for mayor City Council stand on housing infrastructure?,"The image shows a woman with a warm and friendly demeanor. She has long, straight blonde hair that falls over her shoulders. Her skin appears to be fair, and she has a few wrinkles around her eyes and forehead, suggesting she might be middle-aged or older. She is wearing a blue t-shirt that has a ribbed texture, which is a common style for casual wear. The background is a plain, light-colored wall, which puts the focus on her. The lighting in the photo is soft and even, enhancing the natural tones of her skin and hair. There are no visible texts or distinctive marks that provide additional context about the image. The style of the image is a straightforward portrait with a focus on the subject's face and upper body."
image_10_4.jpg,Grover Beach mayoral candidate Robert Robert speaks at a forum hosted by the League of Women Voters Tuesday Sept. 17 2024.,Where do Grover Beach candidates for mayor City Council stand on housing infrastructure?,"The image depicts a man sitting at a table, appearing to be in a formal setting, possibly a conference or a panel discussion. He is wearing glasses and a dark suit with a green tie that has a pattern of blue and yellow squares. The man has a goatee and is looking slightly to his right with a thoughtful expression. In front of him on the table is a name tag that reads ""Kathy McCorry,"" and to his right, there is another name tag that reads ""Robert Robert."" The background is blurred, but it suggests an indoor setting with a blue curtain, which could indicate that this is taking place in a conference room or a similar venue. The lighting is even, and the overall atmosphere seems professional and serious."
image_10_5.jpg,Council woman Debbie Peterson is running for Grover Beach mayor.,Where do Grover Beach candidates for mayor City Council stand on housing infrastructure?,"The image shows a woman with a warm and friendly demeanor. She has short, blonde hair and is wearing a gray blazer over a white top. The blazer has a pattern that suggests it might be a tweed or herringbone design. She is smiling and looking directly at the camera, which gives the impression that she is posing for the photograph. The background is plain and white, which puts the focus entirely on her. The lighting is soft and even, enhancing the gentle contours of her face."
