image number,alt,article_heading,article_url,description
image_1_1.jpg,,"Emperor and Empress hold talks with athletes participating in the National Sports Festival, and also express their hopes for recovery for athletes from Ishikawa Prefecture, which was hit by heavy rains.",https://article.auone.jp/detail/1/2/2/333_2_r_20241005_1728140016258052,"The image depicts two individuals standing side by side, both wearing surgical masks. The person on the left appears to be a woman with dark hair, wearing a light green jacket with a patterned design. She is looking directly at the camera with a neutral expression. The person on the right appears to be a man with gray hair, wearing a dark suit with a white shirt and a tie. He is also looking directly at the camera with a neutral expression. Both individuals are standing in front of a backdrop that includes a geometric pattern and what seems to be a building with a glass facade. The style of the image is a candid photograph, likely taken during an event or gathering."
image_2_1.jpg,"The Emperor and Empress wave as they leave the venue for the National Sports Festival Opening Ceremony in Saga City, Japan, on Oct. 5, 2024. (Mainichi/Minoru Kanazawa)",Emperor and Empress attend opening ceremony of National Sports Festival in Saga and hold talks with athletes,https://article.auone.jp/detail/1/2/2/101_2_r_20241005_1728139331398772,"The image depicts two individuals, a man and a woman, standing side by side and waving at the camera. The man is on the left and the woman is on the right. Both are dressed in formal attire, with the man wearing a dark suit and the woman in a light green outfit with a hat. They appear to be in a room with a white wall in the background. The woman is holding what looks like a book or a folder in her hand. The overall impression is that of a formal or official event."
image_3_1.jpg,,"＜Lifted＞ [Landslide Warning Information] Southern Hamamatsu City, Shizuoka Prefecture",https://article.auone.jp/detail/1/2/2/333_2_r_20241005_1728140016267432,"The image appears to be a map with a color-coded overlay, possibly representing some form of data or information. The map is centered on a body of water, which could be an ocean or a large lake. The landmasses are depicted in shades of gray, and there are areas highlighted in blue, which might indicate specific regions or zones of interest.  There is Japanese text overlaid on the image, which suggests that the map is related to Japan or Japanese data. The text is in a sans-serif font and is likely providing context or information about the map's content. The date ""2024.10.06"" and the time ""23:45"" are also visible, which could indicate the date and time the map was created or the date and time the data it represents was collected.  The style of the image is informational and seems to be designed for analytical or educational purposes, possibly for a report or presentation. The map does not provide specific geographic details, but it does convey a sense of spatial distribution and categorization."
image_4_1.jpg,,"Emperor and Empress attend opening ceremony of National Sports Festival... ""We hope it will be a fruitful event that will remain in our hearts for a long time""",https://article.auone.jp/detail/1/2/2/407_2_r_20241005_1728133901982719,"The image depicts two individuals, a man and a woman, standing side by side and waving at the camera. The man is on the left and the woman is on the right. Both are dressed in formal attire. The man is wearing a dark suit with a white shirt and a tie, while the woman is wearing a light green outfit with a matching hat. They appear to be in a room with a white wall in the background and a chair to the right. The woman is smiling and the man is looking directly at the camera. The overall impression is that of a formal or ceremonial occasion."
image_5_1.jpg,Yukio Hattori,"Yukio Hattori, food critic, dies at age 78",https://article.auone.jp/detail/1/2/2/216_2_r_20241005_1728133492077539,"The image shows a man with a calm and composed demeanor. He appears to be middle-aged or older, with a fair complexion and a balding head. His hair is graying, and he has a pair of glasses with a thin frame, which are perched on his nose. He is wearing a dark-colored shirt with a collar, suggesting a formal or semi-formal attire. The background is blurred, but it seems to be an indoor setting with natural light coming in, possibly from a window. The man's expression is neutral, and he is looking directly at the camera, giving the impression of a professional or formal portrait."
image_6_1.jpg,Yukio Hattori,"Yukio Hattori, food critic, dies at age 78",https://article.auone.jp/detail/1/2/2/216_2_r_20241005_1728133491896845,"The image shows a man with a calm and composed demeanor. He appears to be middle-aged or older, with a fair complexion and a balding head. His hair is graying, and he has a pair of glasses with a thin frame, which are perched on his nose. He is wearing a dark-colored shirt with a collar, suggesting a formal or semi-formal attire. The background is blurred, but it seems to be an indoor setting with natural light coming in, possibly from a window. The man's expression is neutral, and he is looking directly at the camera, giving the impression of a professional or formal portrait."
image_7_1.jpg,Yukio Hattori passes away,Yukio Hattori passes away,https://article.auone.jp/detail/1/2/2/216_2_r_20241005_1728134822237323,"The image shows a man with a bald head and glasses. He appears to be middle-aged or older, with a fair complexion. The man is wearing a dark-colored shirt with a collar, suggesting a formal or semi-formal attire. His expression is neutral, and he is looking directly at the camera. The background is blurred, but it seems to be an indoor setting with natural light coming through a window. There are no visible texts or distinctive features that provide additional context about the man or the setting. The style of the image is a standard portrait photograph with a focus on the subject."
image_8_1.jpg,,"He was actually an expert on castle construction! The excellent castle-building skills of Akechi Mitsuhide, who built a castle on a mountain where construction was difficult / Military commanders build castles ②",https://article.auone.jp/detail/1/2/4/346_4_r_20241005_1728133513693677,"The image appears to be a colorful illustration or graphic design, likely related to a cultural or historical theme. It features a traditional Japanese castle with multiple tiers and green roofs, set against a yellow sky. The castle is depicted with intricate architectural details, suggesting it could be a significant historical structure.  In the foreground, there is a figure that resembles a traditional Japanese warrior or samurai, standing on a rocky outcrop. The warrior is wearing a helmet with a crest, a black and yellow armor, and a sword, which are typical elements of samurai attire.  The image also contains Japanese text, which is likely to provide context or information about the scene depicted. The text is in a stylized font, which is common in Japanese graphic design and signage.  The overall style of the image is vibrant and appears to be designed to attract attention, possibly for a promotional or educational purpose. The image could be related to a cultural event, a historical site, or a product related to Japanese culture or history."
image_9_1.jpg,TBS NEWS DIG Powered by JNN,"[Flood warning] Issued for Toyohashi City, Aichi Prefecture",https://article.auone.jp/detail/1/2/2/333_2_r_20241005_1728133111548142,"The image appears to be a map with a color-coded overlay, likely representing some form of data or information. The map is centered on a region that is predominantly yellow, with a smaller red area to the south. This yellow area is bordered by a black outline, and there are various colors and symbols scattered across the map, suggesting different categories or values.  At the top of the image, there is text in a language that uses Chinese characters, which indicates that the map is related to a Chinese-speaking region or context. The text is too small to read clearly, but it seems to provide information about the map, possibly including a title, a date, or a legend explaining the color coding.  The map itself shows geographical features such as coastlines, borders, and possibly some topographical details. The style of the map is informational, with a focus on the color-coded data rather than topographical details. The colors and symbols suggest that the map is used to represent some form of statistical data, possibly related to demographics, economics, or environmental information.  Without more context or a clearer view of the text, it's difficult to provide a more detailed description. However, the image is clearly informational and is likely used for analytical or decision-making purposes."
image_9_2.jpg,,"[Flood warning] Issued for Toyohashi City, Aichi Prefecture",https://article.auone.jp/detail/1/2/2/333_2_r_20241005_1728133111548142,"The image you've provided appears to be a digital representation of a document or a folder icon. The icon is designed to resemble a traditional paper document with a red tab on the right side, suggesting it might be a folder or a document that can be opened or closed. The text on the icon is in Japanese, and it reads ""ファイル 3"" which translates to ""File 3"" in English. Below the main text, there is additional Japanese text that says ""ファイル名を入力してください"" which means ""Please enter the file name."" This suggests that the icon is meant to represent a file or folder that requires a name to be entered, possibly for organization or identification purposes. The overall design is simple and uses a limited color palette, with the red tab providing a pop of color against the white background."
image_10_1.jpg,,"Mitsunari Okamoto becomes new head of Komeito Tokyo headquarters, succeeding Yosuke Takagi, who will not run in the next House of Representatives election",https://article.auone.jp/detail/1/2/3/16_3_r_20241005_1728131791530159,"The image depicts two men in a professional setting, likely a conference room or a meeting room. The man standing is gesturing with his right hand, possibly explaining a point or making a presentation. He is wearing a dark suit with a white shirt and a dark tie. The man sitting is wearing a similar dark suit and is attentively looking at the standing man, suggesting they are engaged in a discussion or meeting.  The room has a simple, clean design with a white wall and a window covered with curtains. There is a wooden desk in the foreground with a laptop and some papers on it, indicating that this might be a working environment. The overall atmosphere appears to be serious and focused, typical of a business or academic setting."
