image number,alt,article_heading,description
image_1_1.jpg,German Chancellor Olaf Scholz at an Opel factory,German Car Skids: Here's Why Berlin Rejects Duties on Chinese Electric Cars,"The image shows a man standing in front of a large assembly of mechanical components. The man appears to be middle-aged, with a bald head and is dressed in a dark suit with a white shirt. He is looking directly at the camera with a neutral expression.  The assembly behind him consists of numerous metal parts, predominantly cylindrical in shape, with various protrusions and holes. These parts are arranged in a grid-like pattern, suggesting they are part of a larger assembly or machine. The background is a factory setting with industrial machinery and yellow safety barriers, indicating that this is a manufacturing or production environment. The lighting is bright, highlighting the details of the machinery and the man's attire."
image_2_1.jpg,The five days of the Mille Miglia 2025: dates and route revealed (in “eights” like in the pre-war editions),The five days of the Mille Miglia 2025: dates and route revealed (in “eights” like in the pre-war editions),"The image depicts a vibrant scene on a cobblestone street. At the center of the frame is a striking red vintage car, possibly a Model T, with a white number 49 on its side. The car is parked and appears to be stationary, with its front facing the camera.  The car is surrounded by a lively atmosphere. There are several people in the background, some of whom are on motorcycles, suggesting a casual, leisurely setting. The architecture in the background features a large, ornate building with a castle-like appearance, indicating that this scene might be taking place in a historic or tourist area.  The lighting suggests it might be late afternoon or early evening, with the warm glow of the setting sun casting long shadows and highlighting the textures of the cobblestone street and the vintage car. The overall mood of the image is one of nostalgia and leisure, capturing a moment of time in a picturesque setting."
image_3_1.jpg,MG Smart Byd & Co. The new strategies for Europe of Chinese brands in the era of tariffs,MG Smart Byd & Co. The new strategies for Europe of Chinese brands in the era of tariffs,"The image shows a close-up view of the rear end of a blue car. The car's design features a prominent red taillight on the right side, which is illuminated, casting a warm glow on the surrounding area. The taillight has a sleek, angular design with multiple red LED lights that create a dynamic pattern. The car's bodywork is smooth and curves gently towards the rear, with a slight contour that suggests a sporty or performance-oriented vehicle.  The car's model is indicated by the ""MG3 HYBRID+"" text, which is visible on the rear of the car. This suggests that the vehicle is a hybrid model from the MG3 series. The text is in a metallic finish that matches the car's color scheme, blending seamlessly with the blue paint job.  The overall impression is of a modern, high-performance vehicle with a focus on style and efficiency, as indicated by the hybrid powertrain. The image is a professional photograph with a shallow depth of field, which blurs the background and draws attention to the car's design and the illuminated taillight."
image_4_1.jpg,Yamaha R1 Race and Gytr born for the track: Grand Prix solutions for the latest version of the Iwata sports bike,Yamaha R1 Race and Gytr born for the track: Grand Prix solutions for the latest version of the Iwata sports bike,"The image depicts a dynamic scene of a motorcycle ride. The motorcycle, which is the central focus of the image, is a sleek, black sports bike with a prominent front fairing and a single rider. The rider is wearing a full-face helmet, suggesting a focus on safety while enjoying the ride.  The motorcycle is captured in motion, with the front wheel slightly turned to the left, indicating that the rider is navigating a curve on the road. The road itself is a smooth, tarmac surface with a clear demarcation of lanes, suggesting a well-maintained racing circuit or a highway designed for high-speed travel.  The background of the image provides context to the location. There are lush green trees and rolling hills, which suggest that the ride is taking place in a rural or semi-rural area with a natural landscape. The sky is clear and blue, indicating good weather conditions for a ride.  The image is taken from a perspective that is slightly ahead of the motorcycle, giving a sense of speed and movement. The composition of the image, with the motorcycle in the center and the natural scenery in the background, creates a sense of depth and perspective.  Overall, the image conveys a sense of freedom and adventure associated with motorcycle riding, set against a backdrop of natural beauty."
image_5_1.jpg,Electric car to combat charging anxiety comes the battery that “fills up” in 10 minutes,Electric car to combat charging anxiety comes the battery that “fills up” in 10 minutes,"The image depicts a futuristic-looking vehicle with a sleek, aerodynamic design. It has a white and black color scheme, with the white dominating the majority of the vehicle's exterior. The vehicle features a prominent front grille with a central emblem, flanked by two large, round headlights. The wheels are large and have a multi-spoke design, with a silver finish that contrasts with the black tires.  The vehicle is parked indoors, and the setting appears to be a workshop or factory, as indicated by the presence of various machinery and equipment in the background. There are workstations with computer monitors, and a staircase leading to an upper level. The floor is marked with yellow and black caution tape, suggesting a designated area for the vehicle.  The overall impression is that of a high-tech, advanced vehicle, possibly a concept car or a prototype for a new model. The design elements and the setting suggest that this vehicle is being developed or manufactured in a professional environment."
image_6_1.jpg,Volkswagen and Xpeng team up for EV platform,Agreements between European giants and Chinese brands: Morgan Stanley's recipe for relaunching the electric car,"The image depicts a futuristic, high-tech vehicle with a sleek, aerodynamic design. The vehicle is predominantly black with a glossy finish, and it features a complex network of circuitry and electronic components that are visible on its surface. These components are rendered in shades of blue and white, creating a striking contrast against the black background. The vehicle's wheels are large and appear to be made of a metallic material, possibly with a rubber or synthetic tread. The vehicle's body is adorned with various panels and vents, suggesting advanced aerodynamics and cooling systems. The overall aesthetic of the vehicle is one of advanced technology and cutting-edge design, evoking a sense of speed and innovation."
image_7_1.jpg,The 007 Effect: Behind the Wheel of the New 665 HP Aston Martin Vantage the Fastest Ever,The 007 Effect: Behind the Wheel of the New 665 HP Aston Martin Vantage the Fastest Ever,"The image depicts a vibrant red sports car in motion on a winding road. The car is a two-door coupe with a distinctive front grille and large, round headlights. The vehicle's design suggests it is a modern sports car, possibly a Porsche or a similar brand, known for its performance and sleek aesthetics.  The car is captured from a three-quarter front perspective, emphasizing its dynamic movement and the curvature of the road. The road itself is marked with white lane markings and appears to be a rural or country road, with a clear, well-maintained surface.  The surrounding environment is lush and green, indicating a rural or semi-rural setting. There are trees and grassy areas on both sides of the road, suggesting a peaceful, natural landscape. The sky is clear and blue, suggesting good weather conditions, which is ideal for driving.  The license plate of the car is visible and reads ""F AM 7040,"" which is a common format for vehicle registration plates in many countries. The plate's design and characters are not specific to any particular country, but it does indicate that the car is registered and legally operated.  Overall, the image conveys a sense of speed and freedom, as the car is captured in motion, navigating the winding road with ease and grace. The vibrant red color of the car stands out against the greenery, drawing attention to its sleek design and the driver's skill in maneuvering it through the curves of the road."
image_8_1.jpg,Shock costs a lot: here's how much money car manufacturers lose on every electric car sold,Shock costs a lot: here's how much money car manufacturers lose on every electric car sold,"The image depicts a futuristic cityscape with a focus on electric vehicles. In the foreground, there is a modern electric car with a sleek design, parked at a charging station. The charging station is a tall, vertical structure with a digital display showing the car's charging status. The car is positioned on the right side of the image, and the charging station is on the left.  The city in the background is composed of tall, slender skyscrapers with a mix of glass and metallic exteriors. Some buildings have greenery on their rooftops, suggesting an emphasis on sustainability and eco-friendly practices. The architecture is contemporary, with clean lines and a minimalist aesthetic.  The lighting in the image is soft and natural, with a warm glow suggesting either sunrise or sunset. The sky is clear, and the overall atmosphere is one of modern urban development with a focus on clean energy and green technology. The image conveys a sense of progress and innovation in the field of electric vehicles and sustainable urban design."
image_9_1.jpg,Hyundai Celebrates 100 Million Vehicles Production Milestone,Hyundai Celebrates 100 Million Vehicles Production Milestone,"The image depicts a group of individuals, presumably workers, standing in front of a car assembly line. The car is a modern, black vehicle with a prominent Hyundai logo on the grille. The workers are dressed in a mix of casual and uniform attire, suggesting a professional environment. The assembly line is marked with a digital display showing the number ""1000001,"" indicating that this is the first car produced in this series. The setting appears to be a factory or manufacturing facility, with a clean and organized appearance. The workers are posing for the photograph, some with smiles and others with more serious expressions. The overall atmosphere suggests a moment of pride and accomplishment for the workers involved in the production of this milestone vehicle."
image_10_1.jpg,Gino Paoli in the car with Stefania Sandrelli in the Sixties,Gino Paoli the great passion of a legend: “Me and cars a long love story”,"The image depicts a black and white scene of a man and a woman inside a car. The man is seated on the driver's side, and the woman is on the passenger side. Both individuals are wearing sunglasses, which adds a sense of mystery to their identities. The car appears to be an older model, possibly from the mid-20th century, given its design and the style of the interior. The car's interior is visible, showing a dashboard with a steering wheel and a gear shift. The lighting inside the car suggests that the interior lights are on, illuminating the occupants and the interior. The background is dark, which puts the focus on the car and its occupants. There are no visible texts or distinctive markings that provide additional context about the scene. The image has a vintage feel to it, possibly due to the style of the car and the monochrome color scheme."
