image number,alt,article_heading,article_url,description
image_1_1.jpg,Deputy Gilvan da Federal in a session of the Chamber on May 8 2024,PGR reports to the STF the deputy who called Lula a 'thief' and 'corrupt',https://noticias.uol.com.br/ultimas-noticias/agencia-estado/2024/10/05/pgr-denuncia-ao-stf-deputado-que-chamou-lula-de-ladrao-e-corrupto.htm,"The image shows a man standing in front of a glass wall, which appears to be a part of a building. The man is wearing a dark suit with a white shirt and a black tie. He has a name tag pinned on his lapel, indicating that he may be attending a formal event or conference. The man is holding a microphone, suggesting that he is either speaking or about to speak at the event. He is wearing a blue and yellow scarf draped over his shoulder, which could be a part of his attire or a symbol of the event he is attending. The background is blurred, but it seems to be an indoor setting with a modern design. The man's expression is serious, and he appears to be focused on his task."
image_2_1.jpg,Fausto Vera scored his first goal wearing the Galo shirt,The ex-law works Galo draws with Vitória and 'helps' Corinthians in the Z4,https://www.uol.com.br/esporte/futebol/ultimas-noticias/2024/10/05/brasileirao-atletico-mg-x-vitoria.htm,"The image depicts a moment from a soccer match. In the foreground, a soccer player is celebrating a goal by raising his right arm in the air. He is wearing a black and white striped jersey with the word ""BETANO"" printed across the front. The player has short hair and appears to be in motion, possibly running or jumping.  Behind him, two other players are visible. They are also wearing similar black and white striped jerseys with the ""BETANO"" logo. The player in the center is looking towards the goal, while the player on the right is looking towards the camera with a smile.  The background shows a large crowd of spectators in the stands, suggesting that this is a significant match or event. The spectators are blurred, indicating that the focus is on the players on the field. The lighting suggests that the match is taking place during the day."
image_3_1.jpg,"alt=Vinicius Jr. celebrates Real Madrid's goal against Villarreal in the Spanish Championship""",Vini Jr puts on a show as Real beats Villarreal and puts pressure on Barça at the top of La Liga,https://www.uol.com.br/esporte/futebol/ultimas-noticias/2024/10/05/real-madrid-villarreal-campeonato-espanhol.htm,"The image depicts a dynamic scene from a soccer match. In the foreground, a soccer player is captured mid-stride, running across the lush green field. He is wearing a white soccer kit with black stripes and the word ""Emirates"" prominently displayed on the front. His right hand is raised, pointing towards the goal, indicating a strategic move or a call to his teammates.  In the background, other players are visible, some closer to the goal and others further away, suggesting a game in progress. The stands are filled with spectators, their presence adding to the atmosphere of the event. The stadium appears to be well-lit, likely by artificial lighting, as the natural light suggests it might be late afternoon or early evening.  The image captures the intensity and excitement of the sport, with the player's focused expression and the positioning of his body conveying a sense of urgency and determination. The colors are vibrant, with the green of the field contrasting with the white of the player's kit and the spectators in the stands. The overall composition of the image suggests a moment of high stakes in the game."
image_4_1.jpg,Nicholas Chavez and Cooper Koch are Lyle and Erik Menendez in 'Monsters: The Menendez Brothers: Parent Killers',Are you going to binge-watch? Check out some tips for true crime series coming to streaming,https://www.uol.com.br/splash/noticias/2024/10/05/vai-maratonar-veja-dicas-de-series-de-true-crime-que-chegam-ao-streaming.htm,"The image depicts two young men in a relaxed indoor setting, likely a bedroom or a cozy living space. The man in the foreground is lying on his back on a bed, with his head resting on his hands. He appears to be in a state of rest or contemplation. The man in the background is seated on the edge of the bed, facing the first man, and seems to be engaged in a conversation or observing the other. Both men are casually dressed, with the seated man wearing a short-sleeved shirt and the lying man in a t-shirt. The room has a warm ambiance, with soft lighting and a bookshelf in the background filled with various items, suggesting a lived-in and comfortable environment. The overall mood of the image is calm and intimate."
image_5_1.jpg,Israeli Prime Minister Benjamin Netanyahu,Netanyahu says Israel will retaliate against Iran attack: 'Duty and right',https://noticias.uol.com.br/internacional/ultimas-noticias/2024/10/05/netanyahu-declaracao-guerra-outubro-2024.htm,"The image shows a man standing in front of a blue background with white text. The man appears to be middle-aged, with short, graying hair and is wearing a dark suit with a blue tie. He is looking slightly to his right with a serious expression on his face. Behind him, there is a flag with blue and white stripes and a Star of David, which suggests a connection to a Jewish organization or country. The text on the background is not fully legible, but it seems to be in Hebrew, indicating that the setting might be in Israel or related to an Israeli organization. The man's attire and the flag suggest that he could be a politician or a representative of a Jewish organization."
image_6_1.jpg,Oct 5 2024 - Donald Trump accompanied by X owner Elon Musk during a speech in Pennsylvania,Trump holds rally with bulletproof visor at site of attack in US,https://noticias.uol.com.br/ultimas-noticias/deutschewelle/2024/10/05/trump-faz-novo-comicio-em-local-onde-sofreu-atentado.htm,"The image depicts a political event where two men are standing behind a podium with microphones. The man on the left is wearing a dark suit with a red tie, and the man on the right is wearing a dark jacket with a white shirt and a black cap. Both men appear to be speaking to an audience, with the man on the right gesturing with his hands.  The podium has a sign on it that reads ""TEXT PENNSYLVANIA TO 88022 TRUMP VANCE 2024 MAKE AMERICA GREAT AGAIN."" This suggests that the event is related to a political campaign, possibly for a presidential election in the year 2024.  The audience in the background is a mix of people, some of whom are wearing hats and shirts with political slogans, indicating a supportive or enthusiastic crowd. The setting appears to be outdoors, as there is a clear sky visible in the background. The overall atmosphere suggests a political rally or campaign event."
image_7_1.jpg,Oct 6 2024 - Fire and smoke rise from an area targeted by an Israeli airstrike in a southern suburb of Beirut Lebanon,Bombings hit southern Beirut after Israel calls for evacuation of areas,https://noticias.uol.com.br/internacional/ultimas-noticias/2024/10/05/explosoes-beirute-libano-outubro-israel.htm,"The image depicts a nighttime scene of a cityscape with a large explosion occurring in the distance. The explosion is characterized by a bright, fiery orange and red glow, with numerous smaller sparks and embers visible in the air. The explosion is situated in the center of the image, with the city buildings surrounding it. The city buildings are illuminated by various streetlights and building lights, creating a contrast between the illuminated areas and the darker sky. The sky is dark, suggesting it is nighttime, and the explosion is the main focus of the image. There are no visible texts or distinctive landmarks that provide additional context about the location or the event. The style of the image is a photograph with a focus on the dramatic and intense nature of the explosion."
image_8_1.jpg,Image,PE bet hits Mega-Sena and takes R$52 million; see the numbers drawn,https://noticias.uol.com.br/ultimas-noticias/2024/10/05/mega-sena-concurso-2783-sorteio-05-de-outubro.htm,"The image depicts a close-up of a person's hand holding a pen, writing on a lottery ticket. The ticket is predominantly white with black text and numbers, and it features a colorful design with a green background and a pattern of gold coins. The text on the ticket includes the word ""MEGA-SEN,"" which is likely a reference to the Mega-Sena lottery game. The person's hand is visible, with the fingers curled around the pen, indicating that they are in the process of writing or marking the ticket. The focus of the image is on the interaction between the person and the lottery ticket, capturing a moment of participation in a lottery game."
image_9_1.jpg,Municipality of Edison Lobão (MA),City that honors Edison Lobão will also decide at the polls whether to change its name,https://noticias.uol.com.br/colunas/carlos-madeiro/2024/10/05/mudanca-nome-cidade-edison-lobao.htm,"The image depicts an aerial view of a residential area. The architecture of the buildings is predominantly orange, with some structures featuring white or blue accents. The layout of the neighborhood includes a mix of single-story and multi-story homes, with some buildings having visible roofs and others with flat roofs. There are several streets with vehicles, including cars and a bus, indicating active traffic. The surrounding landscape is lush with greenery, including trees and grassy areas, suggesting a suburban or semi-rural setting. The sky is clear, indicating fair weather conditions. There are no visible texts or distinctive landmarks that provide specific location information. The style of the image is a standard aerial photograph with a focus on the urban landscape."
image_10_1.jpg,illustration,Electoral match elections 2024,https://matcheleitoral.folha.uol.com.br/,"The image presents a stylized representation of a person's face, with a series of portraits arranged in a circular pattern around the face. Each portrait depicts a different individual, each with their own unique hairstyle and attire. The portraits are arranged in a way that suggests a connection or relationship between the central face and the individuals in the portraits. The central face is shown from the side, with the portraits positioned around it like a halo. The overall style of the image is reminiscent of a comic or graphic novel, with the use of bright colors and simple lines to define the characters."
