image number,alt,article_heading,description
image_1_1.jpg,Hospital,More Than 500000 Americans Set to Lose Their Medicare Advantage Plans,"The image depicts two individuals, a man and a woman, standing in front of a glass door with a sign that reads ""KAISER PERMANENTE."" The man is wearing a dark blue t-shirt and gray shorts, while the woman is dressed in a white sweatshirt and black leggings. Both individuals appear to be adults. The man is wearing glasses and has a beard, and the woman has long dark hair. They seem to be engaged in a conversation or waiting for something. The setting appears to be an indoor space, possibly a healthcare facility, given the signage. There is a security camera mounted on the wall above the door, and a notice sign is visible on the glass, which includes a warning about security cameras and a message in Spanish. The overall atmosphere suggests a professional or clinical environment."
image_2_1.jpg,Pharmacy U.S.,900000 Americans on Medicare Warned of Data Breach,"The image depicts an indoor setting, likely a pharmacy or medical dispensary, as indicated by the text on the wall that reads ""Medication Dispensary."" There are two individuals present in the scene. On the left, a person is standing with their back to the camera, wearing a dark jacket and blue jeans. This individual appears to be waiting or interacting with the dispensary staff. On the right, another person is facing the camera, holding a smartphone in their hand. This person is wearing a light-colored jacket and has long hair. They seem to be engaged in a conversation or checking something on their phone.  In the foreground, there are two blue chairs, one on each side of the frame, suggesting a waiting area. The dispensary has a window with blinds partially drawn, through which the interior can be seen. There are shelves stocked with various items, possibly medications or medical supplies. The overall atmosphere is calm and professional, typical of a healthcare facility."
image_3_1.jpg,Lauren Boebert,Lauren Boebert 'Melted Down' On Debate Stage Opponent Says,"The image depicts a woman in a professional setting, possibly a legislative assembly or a similar formal environment. She is seated at a desk with a laptop in front of her, suggesting she is engaged in work or a discussion. The woman is wearing a dark blazer over a lighter-colored top, and she has long, dark hair that falls over her shoulders. She is wearing glasses and appears to be speaking or gesturing with her right hand, which is raised slightly as if she is in the middle of a conversation or presentation. The background is blurred, but it seems to be an interior space with other individuals, indicating that she is in a room with others, likely a committee or assembly room. The lighting is even, and the overall tone of the image is serious and professional."
image_4_1.jpg,Biden,Working Seniors See Changes to Medicare,"The image shows a man standing in front of a microphone, suggesting he is giving a speech or presentation. The man appears to be middle-aged, with white hair and a mustache. He is wearing a dark suit with a blue tie, which is a common attire for formal occasions or professional settings. The background is blurred, but it seems to be an indoor setting with a blue hue, possibly due to stage lighting. The man's expression is serious, and he is looking slightly to the side, not directly at the camera. There is no visible text in the image."
image_5_1.jpg,Brian Kemp,Georgia Medicare Recipients Will See Major Change in November,"The image shows a man who appears to be a news reporter or an anchor. He is wearing a dark blue suit with a red tie, which is a common attire for news professionals. The man has short, graying hair and is wearing headphones, suggesting he is either listening to a live broadcast or preparing for one. His expression is serious, and he is looking slightly to the side, which might indicate he is addressing an audience or waiting for a cue to speak. The background is blurred, but it seems to be an outdoor setting with greenery, possibly a park or a garden. There are no visible texts or logos in the image that provide additional context."
image_6_1.jpg,President Joe Biden,Joe Biden Has a New Nickname for Donald Trump,"The image shows a man who appears to be in a formal setting, possibly a political event or press conference, given the context of the attire and the environment. The man is wearing a dark blue suit with a white shirt and a light blue tie. His facial expression is serious, and he seems to be gesturing with his right hand, which is raised slightly as if he is in the middle of speaking or explaining something. The background is blurred, but it suggests an indoor setting with artificial lighting, which could be a stage or a conference room. The man's hair is white, and he has a prominent nose and a stern expression."
image_7_1.jpg,Kamala Harris ,Kamala Harris and Joe Biden Share Stage for First Time Since President's Exit,"The image depicts a political event where a woman is standing at a podium, addressing an audience. She is wearing a dark blazer over a light-colored top, and she appears to be speaking with confidence and authority. Behind her, there is a man standing slightly to the side, wearing a dark suit and tie, and he seems to be listening attentively to her speech.  The audience consists of various individuals, some of whom are holding up signs with the text ""LOWERING DRUG COSTS"" and ""LOWERING DRUG COSTS."" The signs suggest that the event is related to healthcare policy, specifically addressing the costs of prescription drugs.  The setting appears to be indoors, possibly in a conference hall or similar venue, and there is a banner in the background with the text ""Prince George's County, MD"" and ""LOWERING DRUG COSTS,"" indicating the location and the topic of the event.  The overall atmosphere of the image is one of a formal political event, with a focus on healthcare policy and the speaker's address."
image_7_2.jpg,Judy Aiken ,Kamala Harris and Joe Biden Share Stage for First Time Since President's Exit,"The image depicts a political event where a group of people are gathered around a podium. The podium is marked with the text ""Lowering Prescription Drugs Costs"" and ""Prince George's County, MD,"" indicating the topic of the event. There are several individuals in the scene, including a man and a woman who appear to be the main speakers, as they are standing close to the podium and facing the audience. The audience members are seated and standing, with some taking photos or recording the event. The setting suggests an indoor venue, possibly a conference hall or a similar public space. The overall atmosphere appears to be formal and serious, typical of political events."
image_8_1.jpg,Biden,Medicare Drug Prices Are Changing: What to Know,"The image depicts a man standing at a podium, appearing to be in the middle of a speech or presentation. He is wearing a dark suit with a tie, suggesting a formal or professional setting. The man has white hair and is smiling, which conveys a sense of friendliness and approachability. The background is blurred, but it seems to be an indoor setting with a door and some decorative elements, possibly a room with a classic or traditional design. The lighting is bright, highlighting the man and the podium, and creating a focus on him as the central figure in the image."
image_9_1.jpg,Biden,Republicans Warn Joe Biden's Medicare Plan May Break the Law,"The image shows a man standing in front of a white building with a gray stripe running along the top. The man appears to be middle-aged, with white hair and a mustache. He is wearing a dark suit with a white shirt and a striped tie. On his lapel, there is a small American flag pin. He is also wearing large, dark sunglasses with a reflective surface, which could be interpreted as a pair of aviator sunglasses. The man's expression is neutral, and he is looking directly at the camera. The style of the image is a standard, color photograph with no filters or artistic effects applied."
image_10_1.jpg,Hospital,Medicare Beneficiaries Facing 'Perfect Storm' for Enrollment Insurance CEO Warns,"The image depicts a scene outside an emergency medical services (EMS) facility. The building is a large, rectangular structure with a flat roof and a white exterior. The word ""EMERGENCY"" is prominently displayed in large, red capital letters across the top of the building, indicating the purpose of the facility. Below this, the word ""AMBULANCE"" is written in smaller red capital letters, further emphasizing the nature of the services provided here.  In front of the building, there is a blue SUV parked, suggesting the presence of personnel or a patient being transported. To the left of the building, there is a large, cylindrical white tank with the word ""MATHESON"" printed on it, which could indicate a gas supply or a company associated with the facility.  The sky is clear and blue, suggesting a sunny day. The overall setting appears to be an urban or suburban area, with the building and vehicle being the main focus of the image. The image is a photograph with natural lighting, and there are no visible texts or logos other than those mentioned."
