article_number,image number,alt,article_heading
1,1,no alt text,Iran’s missile attack on Israel raises questions about limits of arsenal
2,1,no alt text,Hezbollah's Safieddine 'unreachable' since Friday source says
3,1,no alt text,US warships and planes strike Houthi targets in Yemen
4,1,no alt text,The week that pushed the Middle East closer to all-out war
5,1,no alt text,UAE flight delays: How is the unfolding Middle East conflict affecting international flights?
6,1,no alt text,Indian troops kill 31 suspected Maoist rebels in forest battle
7,1,no alt text,Middle East crisis live: Israel launches fresh strikes on Beirut amid clashes with Hezbollah near Lebanese border
8,1,no alt text,Beirut strikes target potential new Hezbollah chief Israeli official says
9,1,no alt text,Israeli strike kills Hamas commander in occupied West Bank
10,1,no alt text,Russia decides ‘at highest level’ to remove Afghan Taliban from terrorist list
