image number,alt,article_heading,description
image_1_1.jpg,Bitcoin the most popular cryptocurrency on the market has been promoted by entrepreneurs such as Elon Musk and governments such as El Salvador where its use is legal. (Illustrative Image Infobae),The price of the bitcoin cryptocurrency on October 2,"The image depicts a collection of cryptocurrency coins, specifically Bitcoin, with a focus on the coin's design and the reflective surfaces. The coins are arranged in a way that suggests they are being held or displayed, with one coin in the foreground and several others in the background. The coins have a metallic sheen, with colors ranging from gold to red and blue, reflecting light and creating a visually striking effect. The background is blurred, emphasizing the coins in the foreground, and the overall lighting gives the image a vibrant, almost psychedelic appearance. The style of the image is artistic and could be used for promotional or illustrative purposes related to cryptocurrency."
image_1_2.jpg,A bitcoin ATM is presented in San Salvador El Salvador June 24 2021. (REUTERS/Jose Cabezas),The price of the bitcoin cryptocurrency on October 2,"The image depicts a person interacting with a modern, digital payment terminal. The individual is holding a smartphone with a QR code displayed on the screen, which is being scanned by the terminal. The terminal is displaying a message in Spanish, indicating that it is processing the payment. The person is wearing a checkered shirt, and the setting appears to be an indoor environment with a blurred background, suggesting a public or commercial space. The overall scene conveys a contemporary, contactless payment experience."
image_2_1.jpg,Cryptocurrencies are characterized by using blockchain networks not physically existing and lacking regulation. (Getty Images),The rise and fall of cryptocurrencies: this is how their value has moved,"The image depicts a close-up view of a person's hand holding a small, round, metallic object with a symbol on it. The object appears to be a coin or a medallion, with a golden hue and intricate designs. The symbol on the object is a stylized letter 'E' inside a hexagon, which is the logo of Ethereum, a popular cryptocurrency. The background is blurred, but it seems to be a table or a similar surface with a reflective quality, possibly due to the lighting or the material it's made of. The focus is on the interaction between the hand and the Ethereum logo, suggesting a theme of cryptocurrency or digital currency."
image_2_2.jpg,A representation of cryptocurrencies. (REUTERS/Dado Ruvic/Illustration/File Photo),The rise and fall of cryptocurrencies: this is how their value has moved,"The image you've provided is a collection of various cryptocurrencies' coins. These coins are round and metallic, with intricate designs and inscriptions on their surfaces. The colors of the coins vary, with some appearing gold, silver, and red. Each coin has a unique symbol or logo, representing the specific cryptocurrency it belongs to. The coins are stacked on top of each other, creating a pile that showcases the diversity of the cryptocurrencies. The background is dark, which makes the coins stand out prominently."
image_3_1.jpg,The price of the Tether cryptocurrency today. (Infobae),This is the price of the Tether cryptocurrency on October 1,"The image features a stylized representation of a cryptocurrency coin, specifically a Tether (USDT) token, which is a stablecoin pegged to the US Dollar. The coin is depicted in a three-dimensional, metallic gold color, with intricate circuit board patterns and lines that suggest a connection to digital technology and blockchain. The coin is centered in the image, with a blurred background that includes a circuit board design and what appears to be a stock market chart, indicating themes of finance and technology. The word ""Tether"" is written in white text at the bottom of the image, confirming the identity of the cryptocurrency token. The overall style of the image is modern and sleek, with a focus on the coin as the central subject."
image_3_2.jpg,Physical representations of various cryptocurrencies on a computer motherboard (EFE/Sedat Suna),This is the price of the Tether cryptocurrency on October 1,"The image shows a collection of six coins, each with a unique design and color, arranged in a circular pattern on a dark background. The coins appear to be made of a metallic material, possibly gold or silver, and have intricate patterns and symbols embossed on their surfaces. The designs include what seems to be a combination of geometric shapes, letters, and possibly a symbol that resembles a shield or crest. The colors of the coins vary, with some appearing golden and others silver or copper. The lighting in the image highlights the textures and details of the coins, giving them a shiny, reflective appearance. The overall style of the image is a close-up photograph with a focus on the coins, emphasizing their design and craftsmanship."
image_3_3.jpg,An ATM for buying cryptocurrencies. (EFE/EPA/JUSTIN LANE/File),This is the price of the Tether cryptocurrency on October 1,"The image depicts a scene from a financial setting, likely a bank or a cryptocurrency exchange. In the foreground, there is a digital display screen with the text ""Bitcoin Trading Machine"" prominently displayed. Below this, there are two options: ""Buy Bitcoin"" and ""Sell Bitcoin,"" each accompanied by a price tag of $5.00. The screen also includes a phone number for customer support, ""For Help: 1-877-825-321.""  In the background, there is a person wearing a face mask, suggesting a concern for health and safety, possibly due to the COVID-19 pandemic. The person appears to be looking at the screen, possibly considering the options presented. The setting seems to be indoors, with a window visible in the background, allowing natural light to enter the room. The overall atmosphere suggests a modern, technology-driven financial environment."
image_4_1.jpg,Cryptocurrencies are characterized by using blockchain networks not physically existing and lacking regulation. (Getty Images),BNB and other cryptocurrencies: this is how they are trading today,"The image shows two metallic coins with a lock and key in the center. The coin on the left is golden in color and features the capital letter ""B"" prominently in the center, which is the symbol for Bitcoin. The coin on the right is silver in color and also displays the capital letter ""B"" in the center, which is the symbol for Bitcoin. The lock and key are positioned between the two coins, with the key inserted into the lock, suggesting a theme of security or protection for Bitcoin. The background is a dark, textured surface that provides a contrast to the shiny metallic coins and the reflective surface of the lock and key. The image is a close-up, focusing on the coins and the lock and key, with the background being out of focus."
image_4_2.jpg,Citizens protest against the use of Bitcoin as a form of payment in San Salvador (El Salvador). (EFE/Rodrigo Sura),BNB and other cryptocurrencies: this is how they are trading today,"The image depicts a group of individuals participating in a protest. They are holding up signs with various messages written in Spanish. The signs are colorful and feature the Bitcoin logo prominently. The messages on the signs are political in nature, expressing opinions on economic policies and the role of Bitcoin in the economy. The protesters are dressed in casual attire and appear to be outdoors during the day. The background is not clearly visible, but the sky is visible, suggesting it is daytime. The image captures a moment of political activism, with the focus on the messages conveyed through the signs."
image_5_1.jpg,Ether is the token of Ethereum a network based on blockchain technology that serves as the basis for the famous smart contracts. (Infobae),Cryptocurrencies: What is the value of ethereum on September 30?,"The image appears to be a digital graphic or advertisement related to Ethereum, a popular cryptocurrency. The central focus is a circular emblem with the Ethereum logo at its core, which consists of a stylized letter 'E' inside a diamond shape. The emblem is set against a dark background with a subtle gradient, transitioning from black at the top to a dark green at the bottom.  Surrounding the emblem are various elements that suggest a theme of technology and finance. There are green bars and lines that resemble a stock market chart, indicating the volatility and performance of Ethereum's value. The word ""Ethereum"" is prominently displayed in white text, with a stylized 'E' that matches the emblem, reinforcing the brand identity.  The overall design is sleek and modern, with a color scheme that emphasizes the contrast between the dark background and the lighter elements, such as the emblem and text. The use of a coin-like shape for the emblem could imply a connection to the value and exchange of Ethereum, which is a digital or virtual currency. The design is likely intended to be eye-catching and informative, conveying the brand's identity and the concept of cryptocurrency trading."
image_5_2.jpg,Representation of the cryptocurrency Ether. (REUTERS),Cryptocurrencies: What is the value of ethereum on September 30?,"The image shows a close-up of a coin with a distinctive design. The coin features a black background with a gold-colored emblem in the center. The emblem consists of a triangle with a line through it, and the word ""ethereum"" is inscribed below the triangle. The coin appears to be made of a metallic material, possibly gold or a gold-colored alloy, given its luster and the way it reflects light.  In the background, there is a blurred image of a person's face, which seems to be a portrait or a photograph. The person's face is not in focus, making it difficult to discern specific details. Behind the portrait, there is a graphic element that resembles a stylized mountain range or a series of peaks, rendered in a pinkish hue. The overall style of the image suggests a focus on the coin, with the background elements serving to highlight the coin's design and the word ""ethereum"" prominently displayed."
image_6_1.jpg,Bitcoin the most popular cryptocurrency on the market has been promoted by entrepreneurs such as Elon Musk and governments such as El Salvador where its use is legal. (Illustrative Image Infobae),Bitcoin: How it has moved in the market on September 30,"The image shows a close-up of a Bitcoin coin, which is a physical representation of the cryptocurrency. The coin is circular with a metallic finish, and it prominently features the Bitcoin symbol ""BTC"" in the center. The symbol consists of two vertical lines with a horizontal line connecting them at the bottom, forming a stylized ""B."" The coin's surface is intricately designed with a pattern that resembles a circuit board, which is a nod to the digital nature of Bitcoin. The background is blurred, but it appears to be a warm, textured surface, possibly a wooden table or a similar material, which contrasts with the shiny, metallic appearance of the coin. The image is a photograph with a focus on the coin, capturing the details of its design and the reflective quality of its surface."
image_6_2.jpg,Physical representations of various cryptocurrencies. (REUTERS/Edgar Su),Bitcoin: How it has moved in the market on September 30,"The image displays a collection of nine gold-colored coins, each with a unique symbol or design. The coins are arranged in a grid pattern, with three rows and three columns. Each coin features a different symbol, including what appears to be a stylized letter 'B' on one coin, a pair of interlocking rings on another, and a geometric design on a third. The coins have a metallic sheen and are set against a dark background, which accentuates their golden hue. The image is a close-up, focusing on the coins' designs and textures, and does not include any text or additional context. The style of the image is realistic with a focus on the coins' details and craftsmanship."
image_6_3.jpg,"A worker helps a man with the use of bitcoin in front of an ATM of ""Chivo"" the digital wallet backed by the Salvadoran government in San Salvador El Salvador September 8 2021. (REUTERS/Jose Cabezas)",Bitcoin: How it has moved in the market on September 30,"In the image, there are two men standing in front of a white ATM machine. The man on the left is wearing a navy blue baseball cap and a navy blue t-shirt with the word ""Chivo"" printed on it. He is holding a blue lanyard around his neck, which has a white badge attached to it. The man on the right is wearing a navy blue cap and a navy blue shirt. He is holding a smartphone in his hands and appears to be looking at the screen.  The ATM machine is white with a blue screen displaying the word ""Chivo"" in white letters. The machine has a keypad and a screen for entering transactions. The background is a white wall with a blue door on the right side. The overall scene suggests a casual, everyday moment in a public setting."
image_7_1.jpg,Cryptocurrencies are characterized by using blockchain networks not physically existing and lacking regulation. (Getty Images),The cryptocurrency roller coaster: this is how they are trading today,"The image shows four digital currency coins, each representing a different cryptocurrency, placed on the keys of a laptop keyboard. The coins are arranged in a row, with the first coin on the left and the last coin on the right. Each coin has a unique design and color, symbolizing the diversity of cryptocurrencies.  Starting from the left, the first coin is silver with a design that includes a lightning bolt and the word ""Litecoin"" inscribed on it. The second coin is gold with a design that features a triangle and the word ""Ethereum"" inscribed on it. The third coin is also gold but with a different design that includes a letter ""B"" and the word ""Bitcoin"" inscribed on it. The fourth coin is gold with a design that features a letter ""E"" and the word ""Ethereum"" inscribed on it.  The laptop keyboard has black keys with white lettering, and the keys are visible beneath the coins. The laptop itself is not fully visible, but it appears to be a modern design with a white exterior. The image is a close-up shot, focusing on the coins and the keys, with a shallow depth of field that blurs the background. The overall style of the image is clean and professional, likely intended for use in a financial or technology-related context."
image_7_2.jpg,Bitcoin cryptocurrency logo. (REUTERS/Eric Gaillard),The cryptocurrency roller coaster: this is how they are trading today,"The image features a collection of circular objects with a metallic sheen, arranged in a pattern that creates a mosaic-like effect. The circles are of various sizes and colors, including shades of gold, copper, and silver, which give the impression of a sunburst or a starburst. The largest circle in the center is a solid white color, resembling a stylized letter ""B"" or a simplified representation of a Bitcoin symbol. The background is black, which contrasts with the metallic colors of the circles and makes the central white circle stand out prominently. The overall style of the image is modern and artistic, with a touch of digital or technological theme suggested by the central ""B"" symbol."
image_7_3.jpg,Eric Gravengaard CEO and founder of the company Anthena Bitcoin during a test operation at an ATM for bitcoin transactions in San Salvador (El Salvador). (EFE/Rodrigo Sura/Archive),The cryptocurrency roller coaster: this is how they are trading today,"The image depicts a man standing in front of a large, illuminated sign that reads ""Bitcoin."" The man is wearing a dark suit with a yellow tie and appears to be interacting with the sign, possibly using a smartphone to take a photo or scan a QR code. The sign is prominently displayed, with the word ""Bitcoin"" in large, white letters against a blue background. The setting suggests an event or promotional activity related to Bitcoin, a popular cryptocurrency. The man's attire and the context of the image suggest a professional or business environment."
image_8_1.jpg,Ether is the token of Ethereum a network based on blockchain technology that serves as the basis for the famous smart contracts. (Infobae),Ethereum: what is its price today,"The image features a stylized representation of a cryptocurrency coin, specifically the Ethereum (ETH) logo. The coin is depicted with a golden hue, set against a blurred background that suggests a digital or technological theme. The Ethereum logo is a white triangle with a line through it, which is a common symbol for the cryptocurrency. The coin is surrounded by intricate patterns and circuit-like designs, enhancing the digital and futuristic aesthetic of the image. The overall impression is one of a cutting-edge, high-tech cryptocurrency, emphasizing its connection to the digital world and the concept of blockchain technology."
image_8_2.jpg,Representation of the cryptocurrency Ether. (REUTERS),Ethereum: what is its price today,"The image shows a collection of coins with a focus on one particular coin in the center. This central coin features a black background with a prominent yellow logo that resembles a stylized letter ""E"" or a triangle, which is associated with the Ethereum cryptocurrency. Below the logo, the word ""ethereum"" is written in lowercase letters. The coin appears to be a round, metallic piece with a slightly raised edge, and it has a shiny, reflective surface. The surrounding coins are partially visible, with some showing similar designs and metallic finishes, suggesting they are part of a set or collection. The overall style of the image is a close-up photograph with a shallow depth of field, focusing on the Ethereum coin while the rest of the coins are out of focus."
image_9_1.jpg,Bitcoin the most popular cryptocurrency on the market has been promoted by entrepreneurs such as Elon Musk and governments such as El Salvador where its use is legal. (Illustrative Image Infobae),Cryptocurrencies: What is the price of Bitcoin on September 29?,"The image shows a close-up of a Bitcoin coin, which is a physical representation of the cryptocurrency. The coin is circular with a metallic finish, and it prominently features the Bitcoin symbol ""BTC"" in the center. The symbol consists of two vertical lines with a horizontal line connecting them at the bottom, forming a stylized ""B."" The coin's surface is intricately designed with a pattern that resembles a circuit board, which is a nod to the digital nature of Bitcoin. The background is blurred, but it appears to be a warm, textured surface, possibly a wooden table or a similar material, which contrasts with the shiny, metallic appearance of the coin. The image is a photograph with a focus on the coin, capturing the details of its design and the reflective quality of its surface."
image_9_2.jpg,"A worker helps a man with the use of bitcoin in front of an ATM of ""Chivo"" the digital wallet backed by the Salvadoran government in San Salvador El Salvador September 8 2021. (REUTERS/Jose Cabezas)",Cryptocurrencies: What is the price of Bitcoin on September 29?,"In the image, there are two men standing in front of a white ATM machine. The man on the left is wearing a navy blue baseball cap and a navy blue t-shirt with the word ""Chivo"" printed on it. He is holding a blue lanyard around his neck, which has a white badge attached to it. The man on the right is wearing a navy blue cap and a navy blue shirt. He is holding a smartphone in his hands and appears to be looking at the screen.  The ATM machine is white with a blue screen displaying the word ""Chivo"" in white letters. The machine has a keypad and a screen for entering transactions. The background is a white wall with a blue door on the right side. The overall scene suggests a casual, everyday moment in a public setting."
image_10_1.jpg,The price of the Tether cryptocurrency today. (Infobae),How the value of the Tether cryptocurrency has changed in the last 24 hours,"The image features a stylized representation of a cryptocurrency coin, specifically a Tether (USDT) token, which is a stablecoin pegged to the US Dollar. The coin is depicted in a three-dimensional, metallic gold color, with intricate circuit board patterns and lines that suggest a connection to digital technology and blockchain. The coin is centered in the image, with a blurred background that includes a circuit board design and what appears to be a stock market chart, indicating themes of finance and technology. The word ""Tether"" is written in white text at the bottom of the image, confirming the identity of the cryptocurrency token. The overall style of the image is modern and sleek, with a focus on the coin as the central subject."
image_10_2.jpg,Physical representations of various cryptocurrencies on a computer motherboard (EFE/Sedat Suna),How the value of the Tether cryptocurrency has changed in the last 24 hours,"The image shows a collection of six coins, each with a unique design and color, arranged in a circular pattern on a dark background. The coins appear to be made of a metallic material, possibly gold or silver, and have intricate patterns and symbols embossed on their surfaces. The designs include what seems to be a combination of geometric shapes, letters, and possibly a symbol that resembles a shield or crest. The colors of the coins vary, with some appearing golden and others silver or copper. The lighting in the image highlights the textures and details of the coins, giving them a shiny, reflective appearance. The overall style of the image is a close-up photograph with a focus on the coins, emphasizing their design and craftsmanship."
image_10_3.jpg,A screen at an ATM for buying cryptocurrency. (REUTERS/Arnd Wiegmann),How the value of the Tether cryptocurrency has changed in the last 24 hours,"The image appears to be a digital graphic or advertisement related to Bitcoin and its various denominations. At the top, there is a logo that reads ""BITY"" with a stylized ""Y"" that resembles a Bitcoin symbol. Below this, there is a large text that says ""Willkommen beim Bitcoin-Automat"" which translates to ""Welcome to the Bitcoin Machine"" in English.  The central part of the image features three circular icons representing different denominations of Bitcoin. The first icon is a yellow circle with a white ""B"" inside, representing 1 Bitcoin (BTC). The second icon is a white circle with a gray triangle inside, representing 1 Ethereum (ETH). The third icon is a gray circle with a white ""L"" inside, representing 1 Litecoin (LTC).  Below the icons, there is a text that reads ""Berühren Sie das Währungssymbol um fortzusetzen"" which translates to ""Touch the currency symbol to continue"" in English. This suggests that the image is likely from a Bitcoin machine where users can exchange their currency for Bitcoin.  At the bottom of the image, there is a smaller text that says ""Wechselkurs zum Kauf"" which translates to ""Exchange rate for purchase"" in English. This indicates that the image is likely from a Bitcoin exchange or a place where users can buy Bitcoin.  The overall style of the image is modern and digital, with a dark blue background that makes the yellow, white, and"
