image number,alt,article_heading,article_url,description
image_1_1.jpg,Tomer Zvulun sits and rests his chin in his hand.,"Bucking Trends, an Opera Company in Atlanta Is Growing",https://www.nytimes.com/2024/10/04/arts/music/atlanta-opera-tomer-zvulun.html,"The image depicts a man sitting in what appears to be a theater or auditorium. He is dressed in a formal suit with a tie, suggesting a professional or formal occasion. The man is holding his chin thoughtfully, indicating he might be deep in thought or contemplation. His posture is relaxed yet attentive, with his body leaning slightly forward towards the camera. The lighting in the room is dim, with the focus on the man, creating a dramatic effect. The background is blurred, but it seems to be a row of chairs, which are typical in a theater setting. The overall tone of the image is serious and introspective."
image_1_2.jpg,A group of actors onstage.,"Bucking Trends, an Opera Company in Atlanta Is Growing",https://www.nytimes.com/2024/10/04/arts/music/atlanta-opera-tomer-zvulun.html,"The image depicts a lively scene of a theatrical performance. The stage is bathed in a vibrant blue light, creating a dramatic backdrop for the performers. The performers themselves are a diverse group of individuals, each engaged in their roles with enthusiasm.  In the foreground, a woman with curly hair is kneeling on the stage, her arms raised in a triumphant gesture. She is wearing a leopard print top, which stands out against the blue of the stage. Her expression is one of joy and accomplishment.  Behind her, a man in a white shirt is standing, his arms raised in a similar triumphant pose. His stance suggests he is celebrating a victory or achievement.  Further back, a woman in a colorful dress is standing on a chair, her arms raised in the air. Her attire is bright and eye-catching, adding to the overall vibrancy of the scene.  In the background, there are more performers, each contributing to the overall energy and excitement of the performance. The stage is set with various props, including chairs and a table, which add to the realism of the scene.  Overall, the image captures a moment of triumph and celebration, with each performer contributing to the narrative of the performance."
image_1_3.jpg,A person cradles another onstage.,"Bucking Trends, an Opera Company in Atlanta Is Growing",https://www.nytimes.com/2024/10/04/arts/music/atlanta-opera-tomer-zvulun.html,"The image depicts a dramatic scene with two individuals on a stage. The person on the left appears to be a man with a beard, wearing a colorful, patterned jacket over a blue shirt and jeans. He is crouched down and seems to be in a state of concern or urgency. The person on the right appears to be a woman, lying on the ground with her head resting on the man's shoulder. She is wearing a purple knitted garment and a patterned skirt. Her eyes are closed, and she has a serene expression on her face. The setting suggests a theatrical performance, with a dark background and a hint of a red curtain, indicating that this is likely a stage performance. The lighting is focused on the two characters, highlighting their expressions and the intimate moment between them."
image_2_1.jpg,"Garth Brooks wears a black, wide-brimmed hat. ",Garth Brooks Is Accused of Rape and Assault in Lawsuit,https://www.nytimes.com/2024/10/03/arts/music/garth-brooks-rape-assault-lawsuit.html,"The image shows a man from the chest up, wearing a black cowboy hat and a dark suit with a tie. He appears to be in a formal or semi-formal setting, possibly an event or gathering, as suggested by the blurred background that hints at other attendees. The man has a beard and mustache, and his expression is serious or contemplative. The lighting in the room is warm, and the focus is on the man, with the background being out of focus to emphasize him."
image_3_1.jpg,A colorful animated illustration of a cassette tape with shooting stars and rainbows emitting from it.,"As Cassettes Come Back, the Dilemma Is Finding a Tape Deck",https://www.nytimes.com/2024/10/03/arts/music/cassette-revival-tape-decks.html,"The image presents a vibrant and playful scene centered around a cassette tape. The cassette tape, which is the main subject, is depicted in a dynamic pose as if it's flying or being launched into the air. It's colored in a combination of pink and black, with a white label in the center.  The background is a light blue sky dotted with white clouds, creating a sense of openness and freedom. The sky is not just a backdrop but also serves as a canvas for various colorful lines and shapes that radiate outward from the cassette tape. These lines and shapes are in a variety of colors, including pink, yellow, orange, and green, adding to the overall energetic and lively atmosphere of the image.  The cassette tape is not alone in the sky; it's accompanied by a few other objects that add to the whimsical nature of the scene. There are small stars and circles scattered throughout the sky, and a pink and white striped banner floats nearby. These elements contribute to the overall theme of the image, which seems to celebrate the joy and nostalgia associated with music and the cassette tape format."
image_4_1.jpg,Kris Kristofferson at a microphone holding an acoustic guitar.,10 Unforgettable Kris Kristofferson Covers,https://www.nytimes.com/2024/10/04/arts/music/amplifier-newsletter-kris-kristofferson-covers.html,"The image depicts an older man on stage, performing music. He is holding a guitar and appears to be singing into a microphone. The man has gray hair and is wearing a dark-colored shirt. The stage is illuminated with purple lighting, creating a dramatic backdrop. The man's posture suggests he is in the middle of a performance, possibly playing a song. The guitar he is holding is a prominent feature in the image, indicating that it is an essential part of his performance. The microphone, which he is holding to his mouth, is also a key element, suggesting that he is singing or speaking to the audience. The overall scene conveys a sense of musical performance, likely in a concert or live music event."
image_5_1.jpg,A brunette woman in a gold dress soaks in a soapy bathtub and looks at the camera while leaning on the edge of the tub.,"Lauren Mayberry’s Lush Pop Ecstasy, and 13 More New Songs",https://www.nytimes.com/2024/10/04/arts/music/playlist-lauren-mayberry-bartees-strange-the-smile.html,"The image depicts a woman sitting in a bathtub. She has long, dark hair and is wearing makeup, including dark eyeliner and lipstick. Her skin appears smooth and she has a tattoo on her upper arm. She is wearing a sheer, golden garment that drapes over her shoulders and down her torso. The bathtub has a white interior and is surrounded by a tiled wall with a decorative border. The lighting in the image is soft and warm, creating a relaxed and intimate atmosphere."
image_6_1.jpg,"A store with mannequins and tables covered in denim. On a large television screen, Beyoncé is wearing a blue cowboy hat.",Beyoncé Released a Song and Levi’s Saw Its Moment,https://www.nytimes.com/2024/10/02/style/beyonce-levis-women.html,"The image depicts an interior view of a clothing store, specifically focusing on a section dedicated to women's denim jeans. The store has a modern and clean design, with a color scheme that includes shades of blue, white, and brown. The floor is a light wood, and the walls are painted in a dark blue hue.  In the foreground, there is a display of jeans laid out on wooden racks, with various styles and colors visible. The jeans are neatly folded and stacked, showcasing the different washes and cuts available. There are also mannequins dressed in denim outfits, positioned to give customers an idea of how the jeans might look when worn. The mannequins are dressed in casual, trendy outfits, with one wearing a denim jacket and jeans, another in a denim skirt, and a third in a denim top and jeans.  Above the mannequins, there is a large television screen displaying a woman modeling a denim outfit. The screen is turned off, but the image suggests that it is used to showcase the clothing items in a real-life context. The television is mounted on the wall, which is painted in a dark blue color that matches the overall color scheme of the store.  The lighting in the store is bright and even, with recessed lighting in the ceiling providing a clean and professional look. The overall impression is of a well-organized and inviting retail environment designed to appeal to customers looking for denim clothing."
image_6_2.jpg,A series of vintage-style advertisements showing illustrations of women wearing Levi’s jeans in various settings.,Beyoncé Released a Song and Levi’s Saw Its Moment,https://www.nytimes.com/2024/10/02/style/beyonce-levis-women.html,"The image shows three vintage advertisements for Levi's jeans, laid out on a dark blue surface. Each advertisement features a woman in a different setting, showcasing the versatility of the jeans.  1. The first advertisement on the left depicts a woman standing in front of a brick wall, holding a pair of jeans. She is wearing a blue denim shirt and jeans, and there's a red and white sign with the text ""Come and get 'em"" and ""Levi's"" on it. The woman is smiling and appears to be in a casual, urban environment.  2. The middle advertisement shows a woman standing in a field, holding a basket of flowers. She is wearing a blue denim shirt and jeans, and there's a red and white sign with the text ""Levi's"" on it. The woman is smiling and appears to be in a natural, outdoor setting.  3. The third advertisement on the right depicts a woman standing in a field, holding a bucket of water. She is wearing a blue denim shirt and jeans, and there's a red and white sign with the text ""Levi's"" on it. The woman is smiling and appears to be in a rural, outdoor setting.  Each advertisement has a similar color scheme, with the red and white sign providing a consistent branding element across all three. The text ""Levi's"" is prominently displayed on the signs, indicating the brand of the jeans. The women are dressed in casual attire, suggesting the jeans are suitable"
image_7_1.jpg,"The members of the Fugees performing onstage, with Lauryn Hill at center in a red outfit and large hat.","Pras Sues Lauryn Hill Over Canceled Fugees Tour, Alleging Fraud",https://www.nytimes.com/2024/10/01/arts/music/pras-lauryn-hill-fugees-lawsuit.html,"The image depicts a lively scene of a musical performance. There are three individuals on stage, each engaged in the act of singing. The person on the left is holding a microphone and appears to be singing into it. The individual in the center is wearing a vibrant red outfit with a large, decorative hat, and is also singing into a microphone. The person on the right is holding a microphone to their mouth, seemingly in the middle of a performance. The stage is illuminated with bright lights, creating a dramatic backdrop for the performers. The overall atmosphere suggests a high-energy concert or live music event."
image_8_1.jpg,"Sean Combs, wearing dark sunglasses and a leather jacket.",Partying With Sean Combs: Old Stories Gain New Life,https://www.nytimes.com/2024/09/29/arts/music/sean-combs-diddy-parties-quotes.html,"The image shows a man wearing a black leather jacket and dark sunglasses. He has a short haircut and a beard, and he appears to be looking directly at the camera with a serious expression. The man is wearing a necklace with a large pendant. The background is blurred, but it seems to be an indoor setting with a circular emblem or logo visible in the upper right corner. The lighting in the image is soft, and the overall tone is moody."
image_9_1.jpg,"Sean Combs, dressed all in white with a white hat, holds papers and grips a microphone before a party crowd.","Sean Combs’s White Parties Were Edgy, A-List Affairs. Were They More?",https://www.nytimes.com/2024/09/29/arts/music/sean-combs-diddy-white-parties.html,"The image depicts a lively scene at what appears to be a political event or rally. At the center of the image is a man dressed in a white suit and hat, holding a microphone and a piece of paper. He seems to be addressing the crowd or perhaps reading from the paper. His attire and the microphone suggest he might be a speaker or a candidate at the event.  The crowd is composed of numerous individuals, all dressed in white, which could indicate a coordinated theme or a specific dress code for the event. Some of them are holding cameras, capturing the moment, while others are simply watching the speaker.  The setting appears to be an indoor venue, possibly a tent or a large hall, given the presence of stage lights and the structure of the stage. The lighting is focused on the speaker, highlighting him against the crowd.  The image captures a moment of anticipation and engagement, with the speaker and the audience sharing a moment of political discourse. The image does not contain any text or logos that provide additional context about the event or the identities of the individuals present."
image_10_1.jpg,"Sean Combs wears black, aviator sunglasses and looks slightly downward.","With Sean Combs in Jail, Civil Suits Continue to Pile Up",https://www.nytimes.com/2024/09/27/arts/music/sean-combs-diddy-lawsuit-drugs.html,"The image shows a man from the side, facing away from the camera. He appears to be wearing a black outfit with a high collar, possibly a shirt or a jacket. The man has a beard and mustache, and he is wearing large, dark sunglasses that cover his eyes. His hair is short and neatly styled. The background is dark and out of focus, with some indistinct shapes and colors that suggest an indoor setting with ambient lighting. There are no visible texts or distinctive features that provide additional context about the location or the identity of the man. The style of the image is a candid photograph, likely taken in a social or nightlife setting."
