article_number,image number,alt,article_heading,article_url
1,1,Tomer Zvulun sits and rests his chin in his hand.,"Bucking Trends, an Opera Company in Atlanta Is Growing",https://www.nytimes.com/2024/10/04/arts/music/atlanta-opera-tomer-zvulun.html
1,2,A group of actors onstage.,"Bucking Trends, an Opera Company in Atlanta Is Growing",https://www.nytimes.com/2024/10/04/arts/music/atlanta-opera-tomer-zvulun.html
1,3,A person cradles another onstage.,"Bucking Trends, an Opera Company in Atlanta Is Growing",https://www.nytimes.com/2024/10/04/arts/music/atlanta-opera-tomer-zvulun.html
2,1,"Garth Brooks wears a black, wide-brimmed hat. ",Garth Brooks Is Accused of Rape and Assault in Lawsuit,https://www.nytimes.com/2024/10/03/arts/music/garth-brooks-rape-assault-lawsuit.html
3,1,A colorful animated illustration of a cassette tape with shooting stars and rainbows emitting from it.,"As Cassettes Come Back, the Dilemma Is Finding a Tape Deck",https://www.nytimes.com/2024/10/03/arts/music/cassette-revival-tape-decks.html
4,1,A pink line broken into short slash marks.,10 Unforgettable Kris Kristofferson Covers,https://www.nytimes.com/2024/10/04/arts/music/amplifier-newsletter-kris-kristofferson-covers.html
4,2,Kris Kristofferson at a microphone holding an acoustic guitar.,10 Unforgettable Kris Kristofferson Covers,https://www.nytimes.com/2024/10/04/arts/music/amplifier-newsletter-kris-kristofferson-covers.html
4,3,"A play button, with a triangle in a black circle surrounded by yellow and green marks.",10 Unforgettable Kris Kristofferson Covers,https://www.nytimes.com/2024/10/04/arts/music/amplifier-newsletter-kris-kristofferson-covers.html
5,1,A brunette woman in a gold dress soaks in a soapy bathtub and looks at the camera while leaning on the edge of the tub.,"Lauren Mayberry’s Lush Pop Ecstasy, and 13 More New Songs",https://www.nytimes.com/2024/10/04/arts/music/playlist-lauren-mayberry-bartees-strange-the-smile.html
6,1,"A store with mannequins and tables covered in denim. On a large television screen, Beyoncé is wearing a blue cowboy hat.",Beyoncé Released a Song and Levi’s Saw Its Moment,https://www.nytimes.com/2024/10/02/style/beyonce-levis-women.html
6,2,A series of vintage-style advertisements showing illustrations of women wearing Levi’s jeans in various settings.,Beyoncé Released a Song and Levi’s Saw Its Moment,https://www.nytimes.com/2024/10/02/style/beyonce-levis-women.html
7,1,"The members of the Fugees performing onstage, with Lauryn Hill at center in a red outfit and large hat.","Pras Sues Lauryn Hill Over Canceled Fugees Tour, Alleging Fraud",https://www.nytimes.com/2024/10/01/arts/music/pras-lauryn-hill-fugees-lawsuit.html
8,1,"Sean Combs, wearing dark sunglasses and a leather jacket.",Partying With Sean Combs: Old Stories Gain New Life,https://www.nytimes.com/2024/09/29/arts/music/sean-combs-diddy-parties-quotes.html
9,1,"Sean Combs, dressed all in white with a white hat, holds papers and grips a microphone before a party crowd.","Sean Combs’s White Parties Were Edgy, A-List Affairs. Were They More?",https://www.nytimes.com/2024/09/29/arts/music/sean-combs-diddy-white-parties.html
10,1,"Sean Combs wears black, aviator sunglasses and looks slightly downward.","With Sean Combs in Jail, Civil Suits Continue to Pile Up",https://www.nytimes.com/2024/09/27/arts/music/sean-combs-diddy-lawsuit-drugs.html
