image number,alt,article_heading,article_url,description
image_1_1.jpg,,Heat will weigh on the electricity bill which will become even more expensive from tomorrow; understand,,"The image shows a close-up of a person's hand holding a piece of paper. The paper appears to be a receipt or a ticket, with various pieces of information printed on it. The text on the paper is too small to read clearly, but it seems to include details such as a date, time, and possibly a transaction or event reference number. The paper has a yellow and orange color scheme, with the yellow portion being larger and more prominent. The person's thumb is visible, and they have a nail polish on their nails, which is painted in a dark blue color. The background of the image is not visible, focusing the attention on the hand and the paper it holds."
image_2_1.jpg,,Unimed to suspend emergency of Barra da Tijuca hospital on 18th,,"The image depicts a modern, multi-story building with a large, flat facade. The building is predominantly white with a green signboard at the top that reads ""HOSPITAL ULMED."" The architecture is contemporary, with large windows that allow natural light to illuminate the interior. The ground floor features a glass enclosure, possibly a lobby or waiting area, with a few people visible inside. There are street signs and a traffic light in the foreground, indicating that the building is situated in an urban environment. The sky is overcast, suggesting an overcast or cloudy day. The style of the image is a standard, color photograph with no filters or artistic effects applied."
image_3_1.jpg,,Is it the end of inconvenient random number calls? Anatel toughens rules against fraud and scams,,"The image depicts two individuals engrossed in their smartphones. The person on the left is holding a gold-colored smartphone with a white bezel, possibly an iPhone, given the distinctive color and design. The person on the right is holding a blue smartphone with a black bezel, which could be a Samsung or another Android device. Both individuals are focused on their screens, suggesting they are either texting, browsing the internet, or using an app. The background is blurred, emphasizing the subjects and their actions. The overall scene suggests a common modern-day scenario of people interacting with their mobile devices."
image_4_1.jpg,,Government asks for clarification on contracts between mobile phone manufacturers and betting companies,,"The image depicts two individuals engrossed in their smartphones. The person on the left is holding a gold-colored smartphone with a white bezel, possibly an iPhone, given the distinctive color and design. The person on the right is holding a blue smartphone with a black bezel, which could be a Samsung or another Android device. Both individuals are focused on their screens, suggesting they are either texting, browsing the internet, or using an app. The background is blurred, emphasizing the subjects and their actions. The overall scene suggests a common modern-day scenario of people interacting with their mobile devices."
image_5_1.jpg,,Dynamic price at shows and even clothing stores surprises consumers,,"The image depicts a woman with a focus on her profile. She has long, dark hair styled in braids that extend down her back. The woman is wearing a green top with a high neckline and appears to be indoors, as suggested by the presence of a potted plant in the background. She is holding a smartphone in her hands, and her attention seems to be directed towards the screen. The lighting in the image is soft, and the overall atmosphere is casual."
image_6_1.jpg,,See the 10 most common scams applied against seniors and how to avoid them,,"The image is a collage of four distinct photographs, each capturing a different scene, arranged in a grid format. The top left photo shows a close-up of a person's hand holding a camera, with the focus on the camera's lens and the fingers wrapped around it. The top right photo features a pair of hands holding a red corded telephone receiver, with the focus on the receiver and the cord. The bottom left photo captures a close-up of a vintage camera, with the focus on the camera's lens and the body of the camera. The bottom right photo shows a person's hand holding a smartphone, with the focus on the phone's screen and the hand's fingers. The collage has a monochromatic color scheme, with the exception of the red cord in the top right photo."
image_7_1.jpg,,After being questioned by Procon-SP NFL releases water and food 'case by case' in play in Brazil,,"The image depicts a large, modern building with a glass facade, possibly a sports stadium or a sports-themed venue. The building is adorned with three large banners hanging from the upper level. Each banner features a football player in action poses, suggesting a connection to American football. The central banner is white with a gold emblem at the top, and it prominently displays the number ""1"" and the word ""CHAMPIONSHIP"" in bold letters. The other two banners are black with green and gold accents, and they feature the same football player in different action poses. The text ""BEAM-VINDOS"" is visible on the lower banner, which could be a sponsor or a part of the venue's branding. The overall style of the image is a photograph taken from a high angle, capturing the architectural design and the banners in a clear and detailed manner."
image_8_1.jpg,,Unimed Ferj: six months after migration users are unable to issue ticket and access website and application,,"The image depicts a group of people entering a building with a green and white sign that reads ""UNICA"" and ""PROTO ATENDE."" The building appears to be a commercial or retail establishment, possibly a clothing store or a boutique, given the style of the sign and the presence of a mannequin in the window. The people are casually dressed, with one woman wearing a red top and shorts, another in a floral dress, and a man in a yellow shirt. The individuals are in motion, suggesting they are walking into the building. The sky is clear, indicating fair weather, and the architecture suggests an urban setting."
image_9_1.jpg,,Higher electricity bills and record heat: see tips on how to save energy,,"The image depicts a person standing in a room with a white brick wall in the background. The individual is holding a white remote control with a screen, which appears to be a thermostat or a device used to control an air conditioning unit. The remote control is held up towards the ceiling, suggesting that the person is either adjusting settings or monitoring the status of the air conditioning unit. The room has a modern aesthetic, and the lighting is soft, creating a warm and inviting atmosphere. The person is wearing a denim jacket, and their hair is styled in a bob cut. The image does not contain any text."
image_10_1.jpg,,Tired of cell phone telemarketing? Anatel to launch anti-scam and 'anti-disturbance' tool,,"The image shows a person holding a smartphone in their right hand. The person appears to be outdoors, as suggested by the blurred greenery in the background. The smartphone is held up to the face, indicating that the person might be engaged in a conversation or listening to something. The person's attire includes a striped shirt, and their hair is long and dark. The focus of the image is on the person's hand and the smartphone, with the background being out of focus, emphasizing the subject."
