image number,alt,article_heading,article_url,description
image_1_1.jpg,"Kamala Harris, in a dark suit and white shirt, raises her right hand while speaking at a lectern outdoors.",Jobs Report Adds to Economic Momentum for Harris,https://www.nytimes.com/2024/10/04/business/jobs-report-harris-economy.html,"The image depicts a woman standing at a podium, speaking into a microphone. She appears to be addressing an audience, possibly at a political event or press conference. The woman is wearing a dark blazer over a light-colored blouse, and she has long, straight hair. She is gesturing with her right hand, which is raised slightly above her shoulder. The podium has a blue background with text on it, although the text is not fully visible in the image. The setting suggests an outdoor event, as there are trees and a building visible in the background. The lighting is bright, indicating that the event is taking place during the day."
image_2_1.jpg,"A woman walking past a now hiring"" sign.""","The Job Market Is Chugging Along, Completing a Solid Economic Picture",https://www.nytimes.com/2024/10/04/business/economy/job-market-hiring-wage.html,"The image depicts a woman walking past a storefront window. She is dressed in a dark blue dress and carries a beige shopping bag in her left hand. The woman appears to be in mid-stride, with her right hand raised to her mouth as if she is about to take a bite from something. Her hair is styled in loose curls, and she is wearing a dark-colored top.  The storefront window features a sign that reads ""Now Hiring"" in bold, capitalized letters. Below the main text, there is additional information that says ""To apply, text FXO to 33011 or visit careers.fedex.com/office."" The window also displays a logo for FedEx, indicating that the store is likely a FedEx office location. The overall style of the image suggests it is a candid photograph, possibly taken during the day due to the natural lighting."
image_3_1.jpg,No alt attribute,Labor Market Shows Unexpected Strength,https://www.nytimes.com/2024/10/04/business/economy/jobs-report-september.html,"The image you've provided appears to be a bar chart with a title and annotations. Here's a detailed description:  - The chart is a bar graph with a white background and black borders. - The title at the top reads ""Monthly change in jobs"" in bold black text. - Below the title, there is a vertical axis labeled ""Period of revision"" with numerical values ranging from 0 to 24, indicating different periods of job revisions. - The horizontal axis is labeled ""Period of revision"" with numerical values ranging from 0 to 24, indicating different periods of job revisions. - The bars are color-coded, with the majority in gray and one in orange. - The gray bars represent the monthly change in jobs, with numerical values ranging from 0 to 800,000. - The orange bar represents the number of jobs in September, with a value of 254,000. - The chart is overlaid with annotations and labels, providing context and information about the data represented.  Please note that this description is based on the visible elements in the image and does not include any speculative or imaginary content."
image_4_1.jpg,"Hector Xu, Kris Frey and Yiou He stand in front of a blue helicopter in an airplane hangar with an American flag on the back wall.","Pandemic Start-Ups Are Thriving, and Helping to Fuel the Economy",https://www.nytimes.com/2024/10/04/business/economy/pandemic-startups-small-business-economy.html,"The image depicts three individuals standing in a hangar with a helicopter. The person on the left is wearing a light blue polo shirt and blue jeans, the person in the middle is wearing a black t-shirt and dark pants, and the person on the right is wearing a dark t-shirt and light blue jeans. All three individuals appear to be posing for the photograph. The helicopter in the background has a blue and white color scheme, and there is an American flag visible in the background. The hangar has a concrete floor and a metal structure, and there are other vehicles and equipment visible in the background."
image_4_2.jpg,A person sits in a chair in front of multiple screens holding a joystick near an electronic panel many colorful buttons.,"Pandemic Start-Ups Are Thriving, and Helping to Fuel the Economy",https://www.nytimes.com/2024/10/04/business/economy/pandemic-startups-small-business-economy.html,"The image depicts a man seated in a control room, engrossed in the operation of a complex system. He is dressed in a casual blue shirt and jeans, and his focus is directed towards the multiple screens in front of him. The screens are arranged in a semi-circle, each displaying different data and maps, suggesting a multi-dimensional view of various systems and processes.  The man appears to be in the midst of controlling a drone, as indicated by the drone's position on the screen directly in front of him. His hands are on the controls, indicating active engagement with the system. The room is well-lit, with a mix of natural and artificial lighting, and the walls are adorned with various pieces of equipment and instruments, further emphasizing the high-tech nature of the environment.  The overall setting suggests a control center or command room, possibly in a military, aerospace, or industrial facility, where real-time monitoring and control of operations are crucial. The image captures a moment of intense concentration and the intricate interplay between human and technology."
image_4_3.jpg,A person pulls the tail of a small blue and white helicopter in an airplane hangar.,"Pandemic Start-Ups Are Thriving, and Helping to Fuel the Economy",https://www.nytimes.com/2024/10/04/business/economy/pandemic-startups-small-business-economy.html,"The image depicts an indoor setting, likely a hangar or a workshop, where a blue and white helicopter is parked. The helicopter is prominently displayed in the foreground, with its rotor blades and tail section visible. The rotor blades are painted blue with white stripes, and the tail section is white with blue and red accents. The helicopter is marked with the registration number ""N3120P"" on the side.  In the background, there are other helicopters and various pieces of equipment, suggesting that this is a facility where helicopters are maintained or stored. There are also two individuals present in the background. One person is wearing a black shirt and shorts, and the other is wearing a black shirt and a cap. They appear to be engaged in tasks related to the maintenance or operation of the helicopters.  The floor is a light color, and the walls are constructed of wooden panels, which gives the space a rustic appearance. The lighting is bright, with multiple ceiling lights illuminating the area. The overall atmosphere suggests a professional environment dedicated to the maintenance and operation of helicopters."
image_5_1.jpg,"A person with arms raised, wearing a neon yellow vest, holds a sign that says, Automation hurts families."" Shipping containers and cranes are in the background.""",Port Union Agrees to Suspend Strike,https://www.nytimes.com/2024/10/03/business/economy/port-strike-suspended.html,"The image depicts a scene at a construction site. In the foreground, a construction worker is prominently featured. He is wearing a high-visibility vest, which is a common safety measure in such environments. The vest is yellow and has reflective stripes, making him easily visible to others on the site.  The worker is holding a sign that reads ""Automation Hurts Families: LA Unions Stand for Job Protection."" This suggests that the worker is participating in a protest or demonstration, advocating for job protection in the face of automation. The sign is clear and legible, indicating the worker's stance on the issue.  In the background, there are several other construction workers, some of whom are also wearing high-visibility vests. They appear to be engaged in various tasks, contributing to the bustling atmosphere of the construction site.  The setting is an industrial area, with large cranes visible in the distance. These cranes are typical of construction sites, used for lifting heavy materials and equipment. The presence of these cranes, along with the workers and the sign, paints a picture of a busy construction site where automation is a topic of discussion and protest."
image_5_2.jpg,"A person in a dark blue suit speaks to a group of people holding cameras and microphones, with people by a large plane in the background.",Port Union Agrees to Suspend Strike,https://www.nytimes.com/2024/10/03/business/economy/port-strike-suspended.html,"The image depicts a scene on an airport tarmac where a man, who appears to be a politician, is standing in front of a large blue and white airplane. The airplane is a prominent feature in the image, with its distinctive color scheme and the visible logo of the United States presidential seal on the tail. The man is dressed in a dark suit and tie, suggesting a formal occasion or a professional setting.  There are several individuals around the man, some of whom are holding cameras and microphones, indicating that this might be a press event or a public appearance. The presence of the cameras and microphones suggests that the man is likely addressing the media or the public.  The background shows a clear sky, and there are other aircraft visible in the distance, indicating that this is an active airport. The lighting suggests it is either early morning or late afternoon, as the sky is not fully dark.  The image captures a moment of public interaction, likely involving a political figure, and the setting is an airport, which is a common location for such events due to the accessibility and visibility it provides."
image_5_3.jpg,"A crowd of people surround a smiling person in a blue sweatshirt and a black hat, outdoors near a temporary tent.",Port Union Agrees to Suspend Strike,https://www.nytimes.com/2024/10/03/business/economy/port-strike-suspended.html,"The image depicts a group of people gathered under a white tent. The tent is set up outdoors, and the lighting suggests it might be evening or night. The people are engaged in conversation, with some standing closer to the camera and others further back. The individuals are dressed in casual attire, with some wearing caps and others in jackets and hats. The atmosphere appears to be friendly and social, with some people smiling and looking towards the camera. There are no visible texts or distinctive logos that provide additional context about the event or location. The style of the image is candid and seems to capture a moment during a social gathering."
image_6_1.jpg,A person in a blue vest and a person in a black jacket talk to people in law enforcement wearing khaki green shirts and tan vests.,U.S. Faces Economic Turbulence Just as Recession Fears Eased,https://www.nytimes.com/2024/10/03/us/politics/us-economy-inflation-port-strike-helene-israel.html,"The image depicts a group of individuals engaged in what appears to be a formal or official meeting. In the foreground, there are three men wearing tactical vests with the word ""POLICE"" printed on them, indicating they are law enforcement officers. The vests also have the word ""SLED"" printed on them, which could be an abbreviation for a specific unit or task force within the police department. The officers are wearing uniforms that suggest they are part of a professional law enforcement agency.  In the center of the group, there is a man who appears to be older, with white hair and glasses. He is wearing a dark-colored jacket over a light-colored shirt. This individual seems to be the focus of the conversation, as the other individuals are looking at him and appear to be listening to what he is saying.  The setting appears to be outdoors, with natural light illuminating the scene. The background is not clearly visible, but there are hints of a vehicle and a body of water, suggesting that the meeting might be taking place near a waterfront or in a parking area adjacent to a body of water. The overall atmosphere of the image is serious and professional."
image_7_1.jpg,"A factory floor with three men standing alongside a large metal cabinet twice their height, its doors open.","To Revive Manufacturing, How Much Can a President Do?",https://www.nytimes.com/2024/10/03/business/economy/manufacturing-jobs-trump-harris.html,"The image depicts an industrial setting with several individuals engaged in various tasks. In the foreground, there are three men standing near a large, white piece of machinery with a control panel and multiple hoses attached to it. The machine appears to be a type of industrial equipment, possibly related to manufacturing or processing.  To the left, there is a worker standing at a workstation with a laptop and various tools, suggesting that he might be involved in some form of maintenance or repair work. The workstation is cluttered with various items, including a red toolbox and a blue crate.  In the background, there are more industrial machines and equipment, including what looks like a forklift and a pallet jack, indicating that this is a warehouse or factory environment. The floor is marked with yellow lines, which are often used to guide vehicles and equipment in such settings.  The lighting is bright, and the environment is clean and well-organized, suggesting that this is a professional setting with a focus on efficiency and safety. There are no visible texts or distinctive branding in the image. The style of the image is a standard, real-life photograph with no filters or artistic effects applied."
image_8_1.jpg,"Wreckage of homes in floodwaters, with homes on stilts in the distance still standing. Palm trees and blue sky are in the background. ","Hurricane Helene Deaths Will Continue for Years, Study Suggests",https://www.nytimes.com/2024/10/02/business/economy/hurricane-helene-deaths-climate.html," The image depicts a scene of a coastal area that has been affected by a natural disaster, possibly a storm or a flood. The foreground shows a body of water that appears to be a river or a canal, with a white object that could be a pipe or a buoy partially submerged. The water is murky, suggesting recent heavy rainfall or storm activity.  In the middle ground, there is a green building with a brown roof, which seems to be partially submerged in the water. The building's structure is visible, with what appears to be a door and a window. The roof is damaged, and there are visible signs of wear and tear, indicating that the building has been exposed to significant water levels.  In the background, there are several palm trees that are taller than the building, indicating that the location is likely in a tropical or subtropical region. The trees are lush and green, suggesting that the area is not currently experiencing drought.  Further back, there are two buildings with blue roofs, partially obscured by the trees. These buildings seem to be in better condition than the green building, with no visible signs of damage. The presence of these buildings suggests that this area is inhabited or used for some purpose.  The sky is overcast, with no visible clouds, which could indicate that the weather is currently calm. The overall scene suggests a location that has been affected by a natural disaster, with the green building being the most severely damaged structure visible in the image."
image_9_1.jpg,"A view of the kitchen, with food laid out in stainless steel trays and chefs in aprons at work. In one corner a woman is cutting lemons.","A Fancy New Restaurant in London, Staffed by the Recently Homeless",https://www.nytimes.com/2024/10/01/world/europe/restaurant-london-homeless.html,"The image depicts a bustling commercial kitchen with a group of chefs hard at work. The kitchen is well-equipped with stainless steel appliances, including a large refrigerator, an oven, and a sink. The countertops are filled with various ingredients and dishes, suggesting that a meal is being prepared. The chefs are dressed in professional attire, indicating that this is a professional kitchen. The lighting is bright, illuminating the workspace and highlighting the chefs' focus on their tasks. The overall atmosphere is one of productivity and teamwork."
image_9_2.jpg,"A view of the restaurant from outside after dark, showing a large, well-lit room filled with people through the windows.","A Fancy New Restaurant in London, Staffed by the Recently Homeless",https://www.nytimes.com/2024/10/01/world/europe/restaurant-london-homeless.html,"The image depicts the exterior of a restaurant named ""Home Kitchen."" The restaurant's signage is illuminated, with the words ""Home Kitchen"" in white lettering against a dark background. The entrance is sheltered by a green awning that extends over the seating area. Inside the restaurant, there are visible tables and chairs, suggesting an indoor dining space. The interior lighting is warm, contrasting with the cooler exterior lighting. There are people seated at the tables, indicating that the restaurant is open and serving customers. The style of the image is a photograph taken at night, capturing the ambiance of the restaurant's exterior."
image_10_1.jpg,"Former President Donald J. Trump, wearing a blue suit and a red tie, speaks at a lectern with a large stadium of people surrounding him and signs saying “Trump Vance 2024” and “Make America Great Again” projected behind him.","Trump’s Plans Could Spur Inflation While Slowing Growth, Study Finds",https://www.nytimes.com/2024/09/26/business/economy/trump-economy-inflation-growth.html,"The image depicts an indoor event where a man is standing on a stage, addressing an audience. The man appears to be middle-aged, wearing a dark suit with a red tie, and he is holding a microphone. He is looking towards the audience, suggesting he is speaking or presenting.  The stage is set against a backdrop of large screens displaying text. The text on the screens reads ""MAKE AMERICA GREAT AGAIN"" and ""TRUMP VANCE 2024,"" indicating that the event is likely a political campaign event for a candidate named Trump Vance. The audience is seated in rows, and the lighting is focused on the stage, highlighting the speaker and the screens.  The audience members are not clearly visible, but their presence suggests that this is a public event with a significant number of attendees. The overall atmosphere appears to be formal and serious, typical of political campaign events."
