image number,alt,article_heading,article_url,description
image_1_1.jpg,"A close-up, top-down view of a triangular tray with rulers printed on its edges for scale containing a mess of dark gray dust and small rocks from an asteroid.",The Food of Space Travel Could Be Based on Rocks,https://www.nytimes.com/2024/10/03/science/asteroids-food-space.html,"The image shows a close-up of a scale with a pile of black, granular material on one side. The scale has two sides, each marked with measurements in centimeters. The side with the material has a label that reads ""XKERO,"" which is likely a brand or product name. The material appears to be a dark, powdery substance, possibly coal or a similar mineral. The background is not visible, focusing the attention on the scale and the material it is measuring. The style of the image is a straightforward, high-resolution photograph with a focus on the subject, which is the scale and the material it is weighing."
image_2_1.jpg,A small bright white orb illuminates a rocky gray planet in the foreground. The light from the orb makes the outer space background appear red.,"The Sun Will Destroy the Earth One Day, Right? Maybe Not.",https://www.nytimes.com/2024/09/26/science/planet-white-dwarf.html,"The image depicts a cosmic scene with two celestial bodies against a vibrant red-orange backdrop that suggests a nebulous or starry environment. The larger body appears to be a planet or moon, with a textured surface that hints at geological activity or erosion. It has a dark, almost black color with lighter areas that could be craters or plains. The smaller body is a bright, glowing orb, reminiscent of a sun or a star, with a radiant light emanating from it, illuminating the surrounding space. The contrast between the dark, earthy tones of the larger body and the luminous, fiery appearance of the smaller body creates a striking visual effect. The image is likely a digital artwork or a digitally enhanced photograph designed to represent a scene from outer space."
image_3_1.jpg,A SpaceX Falcon 9 rocket lifts off amid plumes of smoke.,SpaceX Launches Mission to Bring Back Starliner Astronauts,https://www.nytimes.com/2024/09/28/science/spacex-launch-nasa.html,"The image depicts a space shuttle launch from a coastal launch site. The space shuttle, with its distinctive white and orange design, is the central focus of the image. It is mounted on a launch pad, which is a large, cylindrical structure with a pointed top. The launch pad is situated on a flat, open area with a clear sky in the background. The launch site is surrounded by a dense forest, providing a stark contrast to the industrial nature of the launch site. The image captures the moment just after the shuttle has lifted off, with the exhaust from the engines visible in the sky. The overall scene conveys a sense of awe and the marvels of modern space exploration."
image_3_2.jpg,The Starliner capsule is seen against the blackness of space with its thrusters emitting small white jets in several directions. A sliver of the space station can be seen at upper right.,SpaceX Launches Mission to Bring Back Starliner Astronauts,https://www.nytimes.com/2024/09/28/science/spacex-launch-nasa.html,"The image depicts a spacecraft in orbit around a celestial body, likely Earth, given the visible curvature of the planet. The spacecraft is a spherical design with a white exterior and a series of solar panels or thrusters along its sides, which are emitting a bright light, suggesting propulsion or solar energy collection. The spacecraft's surface features a grid-like pattern with various markings and symbols, which could be for navigation, communication, or identification purposes. The background is a stark black, indicating the vastness of space, and the Earth is visible in the distance, providing a sense of scale and location. The image is a photograph with a focus on the spacecraft, capturing the details of its design and the environment around it."
image_3_3.jpg,"Butch Wilmore fiddling with several components of space pizza in zero gravity, with many other ingredients laid out on a table, and Suni Williams smiling nearby.",SpaceX Launches Mission to Bring Back Starliner Astronauts,https://www.nytimes.com/2024/09/28/science/spacex-launch-nasa.html,"The image depicts two individuals inside a space station or a similar enclosed environment. The person on the left appears to be a woman with dark hair, wearing a dark top, and she is looking towards the camera with a slight smile. The person on the right appears to be a man with short hair, wearing glasses and a dark top, and he is looking down at a plate of food with a knife in his hand, seemingly about to cut into the food.  The setting is a compact, utilitarian space with various items and equipment visible. There is a control panel with buttons and switches, and a large window or viewing port that allows a view of the exterior. The interior walls are adorned with various signs and labels, and there are shelves with supplies and food items. The lighting is artificial, and the overall atmosphere suggests a functional, lived-in space designed for long-term habitation. The image conveys a sense of camaraderie and shared experience between the two individuals, possibly indicating a moment of relaxation or mealtime within their daily routine."
image_3_4.jpg,An astronaut and a cosmonaut in blue jumpsuits walk on the tarmac of an airport at Cape Canaveral on a bright day.,SpaceX Launches Mission to Bring Back Starliner Astronauts,https://www.nytimes.com/2024/09/28/science/spacex-launch-nasa.html,"The image depicts two individuals dressed in blue space suits with various logos and patches, suggesting they are astronauts. The person on the left is wearing sunglasses and has short hair, while the person on the right has short hair and is looking slightly to the side. Both are wearing watches and have badges on their suits, indicating their affiliation with a space agency. They appear to be standing on a tarmac or runway, with a large aircraft visible in the background. The setting suggests an outdoor environment, possibly at a space facility or an airfield. The image is a color photograph with natural lighting."
image_4_1.jpg,An illustration shows a long fiery jet of material in a swirling dusty cloud of space with galaxies and stars.,This Black Hole Has a Cosmic Wingspan,https://www.nytimes.com/2024/09/25/science/space/black-hole-m87-energy.html,"The image depicts a cosmic scene, likely a representation of a galaxy or a nebula. The central focus is a bright, fiery object that resembles a shooting star or a comet, with a long tail of light trailing behind it. This object is set against a backdrop of deep blue, which is characteristic of the vastness of space. The surrounding area is filled with numerous smaller points of light, which could be stars or other celestial bodies. The image is rich in detail, with the colors and lighting suggesting a dynamic and active cosmic environment."
image_5_1.jpg,An illustration of Earth surrounded by rocky fragments forming a ring against the blackness of space.,"Earth Had a Ring 466 Million Years Ago, Study Says",https://www.nytimes.com/2024/09/20/science/earth-rings-asteroids-ordovician.html,"The image depicts a stylized representation of a celestial scene, likely intended to illustrate a planet and its moons in space. The central figure is a large, spherical planet with a textured surface, suggesting it could be a terrestrial body like Earth. This central planet is surrounded by smaller, irregularly shaped celestial bodies that resemble moons, scattered around it. The background is a dark, starry space, with a few bright stars visible, indicating a night sky setting. The overall style of the image is digital art, with a focus on realism in the depiction of the celestial bodies and the space environment."
image_6_1.jpg,A view over the shoulders of two people wearing head-to-toe protective gear at the looming and complex Europa Clipper spacecraft in a large white-walled room of the Jet Propulsion Laboratory.,A $5 Billion NASA Mission Looked Doomed. Could Engineers Save It?,https://www.nytimes.com/2024/09/17/science/nasa-europa-clipper-radiation.html,"The image depicts an industrial setting, likely a cleanroom or a laboratory, where two individuals are engaged in a task related to the maintenance or inspection of a large piece of machinery. The machinery appears to be a complex assembly of mechanical components, possibly related to space exploration or satellite technology, given its size and the presence of what looks like solar panels or antennae.  The individuals are wearing protective white suits with hoods, gloves, and face masks, indicating a sterile environment and adherence to safety protocols. One of the individuals is holding a tool, suggesting they are in the process of working on or examining the machinery.  The room has a white color scheme with some blue and yellow accents, and there are various pieces of equipment and machinery visible in the background, which further emphasizes the industrial nature of the setting. The lighting is bright, and the ceiling has visible panels, which could be part of the room's ventilation or lighting system.  The image is a photograph with a focus on the interaction between the individuals and the machinery, capturing a moment of work or inspection in a specialized environment."
image_7_1.jpg,A computerized telescope image shows a swirling mass of blues and reds on a black background.,There Might Be More Than One Way to Make a Planet,https://www.nytimes.com/2024/09/16/science/planet-formation-top-down.html,"The image you've provided appears to be a digital representation of a galaxy or nebula. It features a central, bright, swirling pattern that could be interpreted as a star or a cluster of stars. The colors are predominantly shades of blue, pink, and red, which are typical of nebulae and galaxies due to the presence of hydrogen and helium. The background is a stark black, which accentuates the luminosity of the central figure and the fainter stars or celestial bodies that may be present. The image has a cosmic feel to it, suggesting it could be a digital artwork or a photograph of a galaxy captured through a telescope."
image_8_1.jpg,"The top half of Jared Isaacman in a spacesuit with Earth in the background, left, and Sarah Gillis in a spacesuit as she exited the Crew Dragon capsule.",First Private Spacewalk in SpaceX Capsule Achieves New Milestone,https://www.nytimes.com/2024/09/11/science/spacex-polaris-dawn-astronauts-spacewalk.html,"The image depicts an astronaut inside a spacecraft. The astronaut is wearing a white space suit with a helmet, which is typical for space travel to protect against the vacuum of space. The suit appears to be designed for a specific purpose, possibly for a spacewalk or extravehicular activity (EVA), as indicated by the tether lines and the suit's configuration.  The astronaut's helmet is reflective, suggesting it is designed to protect the head from the intense sunlight that can be experienced in space. The helmet's visor is down, obscuring the astronaut's face, which is a common safety measure to protect against the harsh environment outside the spacecraft.  The interior of the spacecraft is visible, showing a curved wall that is characteristic of the design of spacecraft to maximize the use of space and to provide a stable environment for the astronauts. The curvature of the wall suggests that the spacecraft is designed to be in a microgravity environment, which is typical for space missions.  The image is taken from a perspective that gives the impression of looking through a window or a transparent surface, which is a common way to capture images inside spacecraft. The image is slightly blurred, which could be due to the motion of the spacecraft or the camera's focus settings.  Overall, the image provides a glimpse into the life of an astronaut, showcasing the specialized equipment and environment necessary for space travel."
image_9_1.jpg,A robotic rover covered in dusty red smudges stands next to a small arrowhead-shaped rock with a white smudge on it.,NASA Did Not Say It Found Life on Mars. But It’s Very Excited About This Rock.,https://www.nytimes.com/2024/07/25/science/nasa-perseverance-rover-mars-rock.html,"The image depicts a robotic rover vehicle on a Martian surface. The rover is equipped with a large, dome-shaped camera mounted on a mast, which is likely used for panoramic imaging and navigation. The vehicle has multiple sets of wheels, suggesting it is designed for traversing uneven terrain. The Martian landscape is rugged, with a mix of rocky outcroppings and sandy areas, indicative of a celestial body with a thin atmosphere. The lighting suggests it is either dawn or dusk, with the sky appearing to be a gradient of orange and pink hues, which is typical of the Martian sunrise or sunset. The image is a photograph, likely taken by a robotic system designed for exploration and scientific research."
image_9_2.jpg,"An annotated close-up view of the surface of a rock with white bands and other interesting features. The two annotations are labeled Leopard Spot"" and ""Olivine.""""",NASA Did Not Say It Found Life on Mars. But It’s Very Excited About This Rock.,https://www.nytimes.com/2024/07/25/science/nasa-perseverance-rover-mars-rock.html,"The image you've provided appears to be a close-up photograph of a textured surface, possibly a geological or mineralogical sample. The surface is speckled with various small, rounded particles that could be minerals or rocks. The color palette is dominated by earthy tones, with a mix of browns, grays, and creams.  There are two distinct areas marked with red circles and labels. The first circle is labeled ""Olivine,"" which is a mineral commonly found in rocks and is a member of the pyroxene group. Olivine is known for its greenish-yellow to yellowish-green color, but in this image, it seems to blend in with the surrounding texture.  The second circle is labeled ""Leopard Spot,"" which is a term that might be specific to the context of the image or the person who labeled it. Without additional information, it's difficult to determine what the ""Leopard Spot"" refers to in this context.  The image itself is quite detailed, with the focus on the texture and composition of the material. The lighting is even, suggesting that the image was taken with a controlled light source, possibly in a laboratory setting. The image does not contain any people or animals, and the style is that of a scientific or educational photograph, likely used for educational or research purposes."
image_10_1.jpg,,Elon Musk’s Plan to Put a Million Earthlings on Mars in 20 Years,https://www.nytimes.com/2024/07/11/technology/elon-musk-spacex-mars.html,"The image depicts a surreal and fantastical scene. At the center of the composition is a large, circular structure that resembles a telescope or observatory, with a greenish hue and a black interior. The telescope is pointed towards the sky, where a large, blue planet is visible, surrounded by stars and celestial bodies. The sky is a gradient of colors, transitioning from a deep black at the top to a warm orange at the bottom.  In the foreground, there is a group of individuals who appear to be dressed in white robes with hoods, suggesting a monastic or religious order. They are standing in a line, facing the telescope, and seem to be observing the celestial scene. The individuals are drawn in a cartoonish style, with exaggerated features and simple outlines.  The overall style of the image is reminiscent of a digital illustration, with a vibrant color palette and a sense of depth created by the perspective of the telescope and the positioning of the figures. The image conveys a sense of awe and contemplation, as if the individuals are engaged in a spiritual or scientific exploration of the universe."
image_10_2.jpg,,Elon Musk’s Plan to Put a Million Earthlings on Mars in 20 Years,https://www.nytimes.com/2024/07/11/technology/elon-musk-spacex-mars.html,"The image depicts a presentation setting with a person standing in front of a large screen displaying a graphic of a rocket and a planet. The person appears to be a speaker or presenter, dressed in a dark suit with a white shirt and dark tie. They are standing on a stage with a spotlight illuminating them, creating a dramatic effect against the dark background.  The rocket graphic on the screen is labeled ""Enceladus,"" suggesting that the presentation is related to space exploration or scientific discovery. Enceladus is a moon of Saturn known for its unique features, including geysers and a possible subsurface ocean, which makes it a fascinating subject for space research.  The planet graphic on the screen is a representation of Mars, another celestial body that is a significant focus in space exploration and research. The presence of both Enceladus and Mars in the presentation indicates that the topic is likely related to the exploration of our solar system, specifically the moons and planets of Jupiter and Saturn.  The overall style of the image is professional and informative, typical of a corporate or academic presentation. The lighting and composition suggest that the event is taking place in a conference hall or similar venue."
