image number,alt,article_heading,description
image_1_1.jpg,Maggie Smith in Harry Potter and the Half-Blood Prince,"Maggie Smith, acting legend of 'Harry Potter' and 'Downton Abbey' fame, dies at 89","The image features a woman standing in what appears to be a grand hall with high arched ceilings and large windows. The woman is centrally positioned and is the main focus of the image. She is wearing a black witch's hat and a dark, possibly velvet, coat that reaches her midsection. Her attire is reminiscent of traditional witch costumes, suggesting a thematic or costume-related context. She holds a large, ornate book in her hands, which is open and seems to be the object of her attention. The book has a thick spine and is bound in a dark material, possibly leather, with visible gold or metallic accents. The woman's expression is serious and contemplative, and she is looking directly at the camera, engaging the viewer with her gaze. The background is filled with other individuals, but they are not the focus of the image and are blurred, indicating that they are not the main subjects. Their presence, however, adds a sense of depth and scale to the scene, suggesting that the woman is in a public or communal space. The lighting in the image is warm, with natural light coming through the windows, casting soft shadows and highlighting the textures of the woman's clothing and the book she holds. The overall atmosphere of the image is one of mystery and antiquity, enhanced by the woman's costume and the grandeur of the setting."
image_2_1.jpg,Coldplay set to shatter Taylor Swifts record in 2025,Coldplay set to shatter Taylor Swifts record in 2025,"The image depicts a group of four men standing on a stage, smiling and posing for the camera. They appear to be musicians or performers, given their attire and the setting. The man on the far left is wearing a dark cap and a patterned shirt with a tie-dye effect. The second man from the left is wearing a black jacket with a colorful patch on the left shoulder and a graphic design on his shirt. The third man from the left has short hair and is wearing a black jacket with a zipper detail. The man on the far right is wearing a white t-shirt with a graphic design on the front. They are all smiling and seem to be enjoying themselves. The background is blurred, but it suggests a concert setting with stage lighting and a crowd of people, indicating that they are performing in front of an audience. The image captures a moment of camaraderie and enjoyment among the group."
image_3_1.jpg,John Leguizamo actor glasses hat,John Leguizamo was ready to lead a dramatic TV series — so he helped create a platform to stream it,"In the image, there are two individuals standing in a field with tall, dry grass. The person on the left is a man wearing a dark-colored fedora hat and glasses. He is dressed in a patterned sweater vest over a collared shirt, and his expression is neutral as he looks slightly to his left. The person on the right is a woman with her eyes covered by a blindfold, which appears to be made of a light-colored fabric. She is wearing a floral-patterned dress with a high neckline and her hair is styled in a way that it falls over her shoulders. The background is out of focus, but it suggests an open, rural setting with a clear sky. The overall atmosphere of the image is calm and somewhat mysterious due to the blindfolded woman."
image_4_1.jpg,PA Dame Maggie Smith in a red jacket in 2015,Tributes paid to 'true legend' Dame Maggie Smith,"The image shows an elderly woman with short, gray hair. She is wearing a red garment with a pattern that suggests it might be a scarf or a shawl. The woman has a gentle expression on her face and is looking directly at the camera. She is wearing what appears to be a pair of earrings, although they are not clearly visible. The background is a solid, warm color that could be red or orange, providing a contrast that highlights the subject. The image is a still photograph and does not contain any text."
image_5_1.jpg,Getty Images Lana Del Rey in a white dress holding a microphone,Lana Del Rey reportedly marries alligator tour guide in Louisiana,"The image shows a woman standing on a stage, holding a microphone and singing. She is smiling and appears to be in the middle of a performance. The woman has long, wavy hair and is wearing a sleeveless, white, lace-trimmed top. The background is blurred, but it suggests a vibrant, colorful stage setting with purple and blue lighting. The focus is on the woman, capturing her in the spotlight, which highlights her as the main subject of the image."