article_number,image number,alt,article_heading
1,1,Antonio Tajani at Forza Italia's Economy Day in Milan,Tajani: “Tax on extra profits is Soviet culture but Giorgetti misinterpreted”. Irpef cuts mortgages for young people and no tax area on the Budget menu. The proposal of “Ius Italiae” arrives
2,1,Why the ECB Shouldn't Stop Cutting Rates,Why the ECB Shouldn't Stop Cutting Rates
3,1,Minister of Economy Giancarlo Giorgetti,Giorgetti: “The revision of Istat estimates does not change the government’s plans”
4,1,Budget minimum pensions at 621 euros. Helping hand to Forza Italia,Budget minimum pensions at 621 euros. Helping hand to Forza Italia
5,1,X-ray of Italian industry. Sectors that are struggling but with balance sheets inflated by profits there are those who can bet,X-ray of Italian industry. Sectors that are struggling but with balance sheets inflated by profits there are those who can bet
6,1,Digital Nomads a “Dream Life” That Worsens Overtourism,Digital Nomads a “Dream Life” That Worsens Overtourism
7,1,Schillaci to doctors: “Giorgetti asked for a 15% flat tax on specificity allowance”,Schillaci to doctors: “Giorgetti asked for a 15% flat tax on specificity allowance”
8,1,Transport strike Italy stops on October 5 here are the times and guaranteed bands,Transport strike Italy stops on October 5 here are the times and guaranteed bands
9,1,Istat cuts growth acquired for 2024. Tax pressure rises,Istat cuts growth acquired for 2024. Tax pressure rises
10,1,Giancarlo Giorgetti,Giorgetti and the fury of Meloni and Salvini on the Robin Hood minister. Increase of Ires for those who earn more
