image number,alt,article_heading,article_url,description
image_1_1.jpg,Moto blogger Anyutumini reported death threats,Shot: Moto blogger Anyutumini reported receiving death threats,https://news.rambler.ru/community/53531163-shot-motoblogersha-anyutumini-zayavila-o-postupayuschih-ey-ugrozah-ubiystvom/,"The image depicts a woman sitting on a motorcycle. She is wearing a black balaclava that covers her face and neck, leaving only her eyes visible. The balaclava has a distinctive design with a pattern that resembles a bandana. She is dressed in a black sports bra and black leggings, which accentuate her physique. The woman has a tattoo on her upper arm and is wearing black gloves. The motorcycle is black with a red stripe running along the side, and the brand ""KTM"" is visible on the side of the motorcycle. The background is blurred, but it appears to be an urban setting with buildings and possibly a street. The lighting in the image is dramatic, with a focus on the woman and the motorcycle, creating a moody and intense atmosphere."
image_2_1.jpg,Teacher of the Year chosen in Russia,Teacher of the Year Chosen in Russia,https://news.rambler.ru/community/53531005-v-rossii-vybrali-uchitelya-goda/,"The image shows a man standing in front of a backdrop with the Cyrillic text ""Абхазия"" prominently displayed. The man appears to be in a formal attire, wearing a dark suit with a tie and glasses. He is holding a trophy or award, which features a blue and silver design, possibly indicating a recognition or achievement in a competition or event. The man is smiling and looking directly at the camera, suggesting he is posing for the photograph. The setting seems to be indoors, possibly at an event or ceremony, given the formal attire and the award."
image_3_1.jpg,Dozens of Migrants Agree to Serve in Russian Armed Forces Following Raid in St. Petersburg,About 100 migrants agreed to sign a contract with the Russian Armed Forces,https://news.rambler.ru/community/53531020-okolo-100-migrantov-soglasilis-zaklyuchit-kontrakt-s-vs-rf/,"The image depicts a group of individuals gathered around a white bus. The bus appears to be parked on a paved surface, possibly a street or a parking lot. The people are dressed in a variety of casual clothing styles, with some wearing hats and others wearing jackets. There are individuals standing closer to the bus, while others are slightly distanced, creating a sense of depth in the scene.  The group seems to be engaged in a discussion or waiting for something, as they are facing the bus and not looking directly at the camera. Some of them are carrying personal items such as backpacks and handbags. The bus itself has a large window, and the interior is visible, suggesting it is a public transit vehicle.  The lighting in the image is natural, indicating that the photo was taken during the day. The overall atmosphere of the scene is casual and everyday, with no apparent urgency or distress. The image does not contain any text or distinctive branding that would provide additional context."
image_4_1.jpg,Bakalchuk showed a certificate with a new surname,Co-founder of Wildberries marketplace officially changed her last name to Kim,https://news.rambler.ru/community/53530653-soosnovatelnitsa-marketpleysa-wildberries-ofitsialno-smenila-familiyu-na-kim/,"The image shows a woman sitting at a table with a microphone in front of her. She appears to be in a formal setting, possibly a conference or a meeting, given the presence of the microphone and the professional attire. The woman has long, dark hair and is wearing a white shirt with a lanyard around her neck. Her expression is serious, and she is looking slightly to the side, away from the camera. The background is blurred, but it seems to be an indoor space with blue walls and chairs, suggesting that the setting is a conference room or a similar venue."
image_4_2.jpg,,Co-founder of Wildberries marketplace officially changed her last name to Kim,https://news.rambler.ru/community/53530653-soosnovatelnitsa-marketpleysa-wildberries-ofitsialno-smenila-familiyu-na-kim/,"The image you've provided appears to be a certificate or diploma, likely an academic or professional achievement. Here's a detailed description:  - The certificate is predominantly white with a decorative border that features intricate patterns and designs, suggesting a formal or official document. - At the top, there is a large text in a serif font that reads ""СБУДЕ АЛСТРО"" which translates to ""СБУДЕ АЛСТРО"" in English. This could be the name of an institution or organization. - Below the main title, there is a smaller text that says ""О ПЕРЕМЕДЕ ДНЯ"" which translates to ""About the date of the day"" in English. This might indicate a section or paragraph on the certificate. - The central part of the certificate contains a section titled ""БАКИ"" which translates to ""Bak"" in English. This could be a name or title, possibly indicating the recipient of the certificate. - The text ""ТАМПЕРИЯ"" translates to ""Tampere"" in English, which might be a location or a specific detail related to the certificate. - The date ""16 ОТТАПИЯ 1975 г."" translates to ""October 16, 1975,"" which is likely the date of the event or the date the certificate was issued. - The text ""ТАМПЕРИЯ"" appears again, followed by ""СЛУЖ"
image_5_1.jpg,Finnish professor suggests opening checkpoint on Russian border in test mode,Finnish professor suggests opening checkpoint on Russian border in test mode,https://news.rambler.ru/community/53530469-finskiy-professor-predlozhil-otkryt-kpp-na-granitse-s-rf-v-testovom-rezhime/,"The image shows a blue road sign with white text, mounted on a metal pole. The sign is situated on the side of a road, with a forested area visible in the background. The text on the sign is in Finnish, and it provides information about the road conditions and directions. The text reads ""RAJA - JOOSEPPI PA RÄ - NÄKYÖNÄKÄNÄNÄNÄNÄNÄNÄNÄNÄNÄNÄNÄNÄNÄNÄNÄNÄNÄNÄNÄNÄNÄNÄNÄNÄNÄNÄNÄNÄNÄNÄNÄNÄNÄNÄNÄNÄNÄNÄNÄNÄNÄNÄNÄNÄNÄNÄNÄNÄNÄNÄNÄNÄNÄNÄNÄNÄNÄNÄNÄNÄNÄNÄNÄNÄNÄNÄNÄNÄNÄNÄNÄNÄNÄNÄNÄNÄNÄNÄNÄNÄNÄNÄNÄNÄNÄNÄNÄNÄNÄNÄNÄNÄNÄNÄNÄNÄNÄNÄNÄNÄNÄNÄNÄNÄNÄNÄNÄNÄNÄ"
image_6_1.jpg,A pack of wolves terrorizes residents of a village in the Leningrad region,A pack of wolves terrorizes residents of a village in the Leningrad region,https://news.rambler.ru/community/53529971-staya-volkov-terroriziruet-zhiteley-poselka-v-lenoblasti/,"The image depicts a close-up of a wolf's head, captured in a natural setting. The wolf's fur is predominantly white, with some brown and black markings, particularly around the ears and muzzle. Its eyes are open and alert, and its mouth is slightly open, revealing its teeth. The background is blurred, but it appears to be a wooded area with tall, dry grasses, suggesting a savannah or grassland habitat. The lighting suggests it might be either dawn or dusk, with the light filtering through the trees. The image is a photograph with a focus on the wolf, capturing its features and the surrounding environment."
image_7_1.jpg,Pavel Durov published a photo with his child for the first time,Pavel Durov published a photo with his child for the first time,https://news.rambler.ru/community/53529168-pavel-durov-vpervye-opublikoval-foto-so-svoim-rebenkom/,"The image depicts a man standing on a beach, facing the camera with a contemplative expression. He appears to be middle-aged with short, dark hair and a beard. The man is wearing a dark-colored long-sleeved shirt and a necklace. The background features a vast expanse of the ocean with white-capped waves, suggesting a windy day. The sky is overcast with a soft, diffused light, which gives the scene a serene and somewhat dramatic atmosphere. There are no visible texts or distinctive brands in the image. The style of the image is a portrait with a focus on the subject, set against a natural landscape."
image_7_2.jpg,,Pavel Durov published a photo with his child for the first time,https://news.rambler.ru/community/53529168-pavel-durov-vpervye-opublikoval-foto-so-svoim-rebenkom/,"The image depicts a man and a young girl sitting closely together on a couch. The man appears to be in his late teens or early twenties, with short dark hair and is wearing a black t-shirt. He is holding a smartphone in his hands, which he seems to be using. The girl, who is younger, has blonde hair and is wearing a yellow and white patterned top. She is looking at the man with interest, possibly observing what he is doing on the phone. The setting appears to be a domestic environment, possibly a living room, with a blue couch and curtains in the background. The overall atmosphere suggests a casual, intimate moment between the two individuals."
image_8_1.jpg,Soyuzmultfilm editor-in-chief Tatyana Paporova has died,Soyuzmultfilm editor-in-chief Tatyana Paporova has died,https://news.rambler.ru/community/53529832-umerla-glavnyy-redaktor-soyuzmultfilma-tatyana-paporova/,"The image shows a woman wearing a black beret and a dark top. She has short, blonde hair and is looking directly at the camera with a slight smile. The woman appears to be middle-aged and is wearing a pearl necklace. The background features a wall with various pieces of artwork, including paintings and drawings. The artwork depicts a range of subjects, including landscapes and figures. The wall is a light color, and the artwork is hung at different heights, creating a layered effect. The lighting in the room is soft and even, highlighting the woman's face and the artwork on the wall."
image_9_1.jpg,Kandelaki explained why Lerchek has problems with the law,Kandelaki explained why Lerchek has problems with the law,https://news.rambler.ru/community/53529559-kandelaki-obyasnila-pochemu-u-lerchek-problemy-s-zakonom/,"The image depicts a woman sitting on a stage with a microphone stand in front of her. She is wearing a black outfit with a high neckline and a choker necklace. Her hair is dark and styled down, and she is wearing large hoop earrings. She is holding a tablet in her hands and appears to be speaking or about to speak. The background is a colorful graphic with red and orange hues, suggesting a vibrant and possibly festive atmosphere. The woman's expression is serious and focused, indicating that she is engaged in a professional or formal event."
image_10_1.jpg,Roskomnadzor has published a new version of the project on the register of bloggers,Roskomnadzor has published a new version of the project on the register of bloggers,https://news.rambler.ru/community/53529597-roskomnadzor-opublikoval-novuyu-versiyu-proekta-o-reestre-blogerov/,"The image shows a man walking past a wall with a plaque. The man appears to be middle-aged, wearing a dark jacket, and is looking to the side as he walks. The plaque is rectangular with a black background and features text in Cyrillic script, which suggests that the location might be in a country that uses this script, such as Russia or Ukraine. The text on the plaque is in Russian, and it seems to be an informational or commemorative sign, possibly related to a historical event or a notable figure. The wall itself is made of white tiles, and the overall setting appears to be an urban environment."
