image number,alt,article_heading,description,article_url
image_1_1.jpg,,Sepsis and malnutrition stalk the new mothers and babies of South Darfur,"The image depicts a scene from a rural or desert-like environment. There are several individuals present, but the focus is on two young children who are walking together. The child on the left is wearing a yellow dress and has a green scarf wrapped around their neck. The child on the right is wearing a pink shirt and a green headscarf. Both children are barefoot and appear to be carrying a green bucket between them. The setting includes traditional huts made of straw or similar natural materials, and the ground is covered in a light-colored sand. The sky is clear, suggesting it might be a sunny day. There are no visible texts or distinctive brands in the image. The style of the image is a candid, real-life photograph with natural lighting.",https://www.yahoo.com/news/sepsis-malnutrition-stalk-mothers-babies-220050913.html
image_2_1.jpg,,US FDA approves IntraBio's drug for rare genetic disease,"The image shows a sign for the U.S. Department of Health and Human Services' Food and Drug Administration (FDA). The sign is prominently displayed in front of a building, which appears to be part of the FDA's campus. The sign itself is white with blue and yellow lettering, and it features the FDA logo, which consists of a shield with a caduceus and the letters ""FDA"" inside it. The text on the sign clearly states ""U.S. Department of Health and Human Services Food and Drug Administration,"" indicating the organization's role in ensuring the safety and regulation of food and drugs in the United States. The background of the image shows a grassy area with trees, suggesting that the FDA campus is located in a suburban or semi-rural setting.",https://www.yahoo.com/news/us-fda-approves-intrabios-drug-215810938.html
image_3_1.jpg,"FILE - In this photo taken with a drone, portions of a Norfolk Southern freight train that derailed the previous night in East Palestine, Ohio, remain on fire at mid-day, Feb. 4, 2023. (AP Photo/Gene J. Puskar, File)",EPA data make it hard to know the extent of the contamination from last year's Ohio derailment,"The image depicts a scene of a train derailment. The train, which appears to be a freight train, has derailed and is in a state of wreckage. The locomotive is visible, and it's clear that the train has been severely damaged. There are multiple cars that have been knocked over, and the train's cargo is spilled out onto the ground. The surrounding area is heavily wooded, and the ground is covered in snow, indicating that the accident occurred in a cold, winter season.  There are visible plumes of black smoke rising from the wreckage, suggesting that there may have been a fire or explosion involved in the derailment. The smoke is dense and billowing, indicating a significant amount of energy has been released.  Emergency vehicles, including trucks and ambulances, are present at the scene, indicating that first responders are on-site to address the situation. The vehicles are parked in a haphazard manner, suggesting that they arrived quickly and are now attending to the wreckage.  The image is taken from an aerial perspective, providing a bird's-eye view of the scene. This perspective allows for a clear view of the extent of the damage and the surrounding environment. The image is a color photograph, and the lighting suggests it was taken during the day. The overall scene is one of disaster and emergency response.",https://www.yahoo.com/news/epa-data-hard-know-extent-214441026.html
image_3_2.jpg,"FILE - Cleanup continues, Feb. 24, 2023, at the site of a Norfolk Southern freight train derailment that happened on Feb. 3, in East Palestine, Ohio. (AP Photo/Matt Freed, File)",EPA data make it hard to know the extent of the contamination from last year's Ohio derailment,"The image depicts an industrial scene with a focus on construction and demolition activities. In the foreground, there are several large, rusted cylindrical objects that appear to be the remains of a train or industrial equipment. These objects are scattered across the ground, some lying on their sides, and others are partially buried in the soil. There are also a few smaller objects that resemble train cars, some of which are intact and others are partially dismantled.  In the background, there is a set of railroad tracks that run parallel to the scene. The tracks are partially covered with debris and soil, indicating ongoing construction or demolition work. There are also a few vehicles visible, including a yellow excavator and a white car, which are likely used for the heavy lifting and transportation of materials.  The ground is covered with a mix of soil, gravel, and debris, suggesting that this is an active construction site. The sky is overcast, and the lighting suggests it might be either early morning or late afternoon. There are no visible texts or distinctive branding in the image. The style of the image is a standard, non-stylized photograph with no filters or artistic effects applied.",https://www.yahoo.com/news/epa-data-hard-know-extent-214441026.html
image_3_3.jpg,"FILE - Environmental Protection Agency workers work in Leslie Run in East Palestine, Ohio, June 12, 2024. (AP Photo/Gene J. Puskar, File)",EPA data make it hard to know the extent of the contamination from last year's Ohio derailment,"The image depicts two individuals engaged in a task that appears to involve the removal of rocks or debris from a body of water. The person on the left is wearing a bright yellow safety vest, a hard hat, and dark overalls, suggesting they are a worker or construction professional. They are holding a tool that resembles a long-handled shovel or a similar tool used for moving heavy materials. The person on the right is wearing a similar yellow safety vest and hard hat, but their attire is less visible due to the angle of the photograph. They are bending over, possibly inspecting the water or the rocks they are removing.  The setting appears to be a natural environment, possibly a river or a stream, with a dense forest in the background. The water is shallow, and the rocks are scattered throughout the area. The lighting suggests it might be a sunny day, as the shadows are not very pronounced. The overall scene conveys a sense of manual labor, likely related to environmental maintenance or construction work.",https://www.yahoo.com/news/epa-data-hard-know-extent-214441026.html
image_4_1.jpg,,Amgen's muscular disorder drug meets main goal in late-stage study,"The image shows a large, white, three-dimensional letter ""A"" prominently displayed against a backdrop of a clear blue sky. The letter is positioned on a stone wall, which appears to be part of a larger structure, possibly a building or a fence. The wall is constructed with a variety of stone sizes and colors, giving it a rustic appearance. In the background, there are trees with green foliage, suggesting a natural or semi-natural setting. The overall style of the image is a straightforward, non-stylized photograph with a focus on the letter ""A"" and its immediate surroundings.",https://www.yahoo.com/news/amgens-experimental-skin-disease-drug-205830135.html
image_5_1.jpg,"A nurse fills vials with blood in Fullerton, Calif. (Paul Bersebach / MediaNews Group via Getty Images file )","Iron deficiency may affect nearly 1 in 3 adults in the U.S., new study finds","The image depicts a medical setting where a healthcare professional is conducting a blood test. The healthcare professional is wearing blue gloves, indicating a focus on hygiene and patient safety. They are holding a small tray with multiple test tubes, each containing a different colored liquid, which are likely different types of blood samples. The healthcare professional is using a needle to collect a sample from a patient's arm, which is connected to an intravenous (IV) line. The patient's arm is resting on a table, and there is a chair visible in the background, suggesting that this is taking place in a clinical environment. The healthcare professional appears to be focused on the task at hand, ensuring that the blood samples are collected accurately and safely.",https://www.yahoo.com/news/iron-deficiency-may-affect-nearly-204519716.html
image_6_1.jpg,<p>Kevin Twomey / Getty Images</p>,Drinking Soda Might Make Period Cramps Worse. Here’s Why,"The image presents a tall, clear glass filled with a vibrant blue liquid, which appears to be a refreshing beverage. The glass is positioned against a solid red background, creating a striking contrast that highlights the cool tones of the drink. The liquid inside the glass is not just a uniform blue but also contains small bubbles, suggesting it might be carbonated or effervescent. There's a single, whole strawberry floating on the surface of the liquid, adding a pop of red color and a hint of natural sweetness to the scene. The overall composition of the image suggests a focus on the drink, possibly for advertising or menu purposes, emphasizing its color and freshness.",https://www.yahoo.com/lifestyle/drinking-soda-might-period-cramps-203156899.html
image_7_1.jpg,<p>Kinga Krzeminska / Getty Images</p>,Role of Vasopressin and Hormonal Effects,"The image depicts a person sitting at a wooden table, wearing a yellow sweater. The person has a medical device strapped to their arm, which appears to be a blood pressure monitor. They are holding a small, white bowl in their hand, which could be used for collecting blood samples. The setting suggests a home environment, with a chair visible in the background. The person's posture and the presence of the medical device indicate that they might be monitoring their health or conducting a medical test.",https://www.yahoo.com/news/role-vasopressin-hormonal-effects-202336483.html
image_8_1.jpg,<p>OKrasyuk / Getty Images</p>,Diindolylmethane: A Registered Dietitian Nutritionist Explains the Evidence,"The image depicts a person washing a bunch of green leafy vegetables in a kitchen setting. The person is wearing a red long-sleeved shirt and is holding the vegetables with their right hand. The vegetables appear to be fresh and are being rinsed under running water from a faucet. The faucet is silver in color and is mounted on a wall. In the background, there is a bowl containing citrus fruits, suggesting that the person might be preparing a meal that includes both vegetables and fruits. The overall scene conveys a sense of cleanliness and healthy eating.",https://www.yahoo.com/lifestyle/diindolylmethane-registered-dietitian-nutritionist-explains-201734914.html
image_9_1.jpg,"Michael Moss, 37, a victim, speaks during a press conference regarding a lawsuit alleging that more than 200 men and women were sexually abused as children while in custody at juvenile detention centers in Illinois, Tuesday, Sept. 24, 2024, in Chicago. (AP Photo/Erin Hooley)",Survivors of sex abuse at Illinois juvenile detention facilities hope for justice,"The image shows two men in what appears to be a formal setting. The man in the foreground is wearing a white shirt with long, braided hair that is a mix of blonde and black colors. He has a serious expression on his face, with his eyes looking slightly to the side. The man in the background is wearing a dark suit with a tie that has a pattern of diagonal stripes. He has a stern expression, with his eyes looking directly ahead and his mouth slightly open as if he is speaking or about to speak. Both men are indoors, and the background is nondescript, focusing the attention on the two men.",https://www.yahoo.com/news/survivors-sex-abuse-illinois-juvenile-200859026.html
image_9_2.jpg,"Attorney Jerome Block speaks during a press conference regarding a lawsuit alleging that more than 200 men and women were sexually abused as children while in custody at juvenile detention centers in Illinois, Tuesday, Sept. 24, 2024, in Chicago. (AP Photo/Erin Hooley)",Survivors of sex abuse at Illinois juvenile detention facilities hope for justice,"The image shows a man from the chest up, facing slightly to his left. He appears to be middle-aged with a receding hairline and a few spots on his skin. His facial expression is serious, and he seems to be looking at something or someone off-camera. The man is wearing a dark suit with a white shirt and a tie that is not fully visible. The background is blurred, but it appears to be an indoor setting with other people, suggesting that this could be a formal event or gathering. The lighting is even, and the focus is on the man, making the background indistinct.",https://www.yahoo.com/news/survivors-sex-abuse-illinois-juvenile-200859026.html
image_9_3.jpg,"Attorney Todd Mathews speaks during a press conference regarding a lawsuit alleging that more than 200 men and women were sexually abused as children while in custody at juvenile detention centers in Illinois, Tuesday, Sept. 24, 2024, in Chicago. (AP Photo/Erin Hooley)",Survivors of sex abuse at Illinois juvenile detention facilities hope for justice,"The image shows a man from the chest up, appearing to be in the middle of a speech or presentation. He has a fair complexion and is balding with some hair on the sides and back of his head. His facial expression is one of concentration or seriousness, with his mouth slightly open as if he is in the middle of speaking. He is wearing a dark suit with a white shirt and a tie that is not fully visible. The background is dark and out of focus, which puts the emphasis on the man. There are no visible texts or distinctive logos in the image. The style of the image is a close-up portrait, commonly used for media coverage or professional profiles.",https://www.yahoo.com/news/survivors-sex-abuse-illinois-juvenile-200859026.html
image_10_1.jpg,<p>Halfpoint Images / Getty Images</p>,Insulin vs. Glucagon: What Are the Differences?,"The image depicts a close-up of a person's midsection, focusing on the lower abdomen. The person is wearing a dark-colored top, and their lower body is clad in a light-colored garment, possibly a sweater or a shirt. The individual's hand is holding a syringe with a needle, which is being used to inject a liquid into the skin. The needle is inserted into the skin, and the plunger is being pressed down, indicating the injection process is in progress. The background is softly focused, with natural light suggesting an indoor setting, possibly a room with windows. The image is taken from a perspective that allows the viewer to see the person's hand and the needle, but the rest of the person's body is not visible.",https://www.yahoo.com/news/insulin-vs-glucagon-differences-192503958.html
