image number,alt,article_heading,description
image_1_1.jpg,पीड़िता के पिता ने CBI को एक पत्र लिखा है,Junior Doctor Rape Murder Case: Victim's father appeals to CBI to preserve the call records of his deceased daughter,"The image appears to be a graphic design or illustration with a combination of photography and text elements. It features a woman lying on the floor, seemingly unconscious or asleep. She is wearing a red garment and has long hair. There are two smaller images within the larger image, one on each side. The left side shows a man with a mustache and a yellow shirt, and the right side shows a woman with dark hair and a red garment, partially obscured by a black rectangle that covers her face.  The text in the image is in a script that appears to be Devanagari, which is used for several languages including Hindi. The text reads ""कहता है"" which translates to ""It says"" in Hindi. The overall style of the image suggests it might be related to a news story or an investigation, possibly involving the woman shown in the image. The presence of the smaller images and the text could imply that these are individuals of interest or suspects in the context of the story being referred to."
image_2_1.jpg,पुलिस अब चारों लोगों की मौत का कारण तलाश रही है (फोटो- Meta AI),Incident like Burari of Delhi in Dhule Maharashtra dead bodies of 4 people of same family found in the house police is searching for the reason of death,"The image depicts a heartwarming scene of a family moment. In the center of the frame, a woman is lying down, her eyes closed in what appears to be a state of rest or sleep. She is wearing a traditional Indian saree, which is a long, flowing garment typically worn by women in the Indian subcontinent. The saree is predominantly yellow, with a red border that adds a vibrant contrast.  On either side of the woman, two young children are also lying down, their eyes closed in a similar state of rest. The children are wearing casual clothing, with one in a blue shirt and the other in a gray shirt. The positioning of the children on either side of the woman suggests a sense of symmetry and balance in the scene.  In the background, there is a man sitting on the floor, his attention focused on the woman and children. He is wearing a white shirt and jeans, and his posture suggests a sense of care and concern for the woman and children. The man's position and gaze direction indicate that he is watching over the family members.  The setting appears to be a domestic interior, possibly a living room or a bedroom, with a window visible in the background. The room is softly lit, with warm tones that contribute to the overall serene and peaceful atmosphere of the scene. The image captures a quiet moment of rest and family bonding."
image_3_1.jpg,कोलकाता के नए पुलिस कमिश्नर आईपीएस मनोज वर्मा.,A tough officer killer of criminals and troubleshooter of the government... Interesting story of Kolkata's new CP Manoj Verma,"The image shows a man sitting at a desk, appearing to be in an office setting. He is wearing a uniform with a badge, suggesting he may hold a position of authority or service. The man has a mustache and is looking directly at the camera with a serious expression. Behind him, there is a blurred background that includes what appears to be a computer monitor and some office equipment. The text overlay in the image is in a script that appears to be Devanagari, which is used for several languages in India, including Hindi. The text is in a bold, sans-serif font and reads ""अमेरिका,"" which translates to ""America"" in English. The overall style of the image suggests it may be a screenshot from a video or a digitally created graphic."
image_4_1.jpg,पाकिस्तानी घुसपैठिए को BSF के जवानों ने मार गिराया (फोटो- Meta AI),BSF took a big action on the international border in Punjab one Pakistani intruder was killed,"The image depicts a young man standing in front of a chain-link fence with barbed wire at the top. He is wearing a dark jacket and appears to be smiling. The fence is part of a security perimeter that includes a watchtower in the background. There are signs on the fence, one of which is a warning about the dangers of the barbed wire. The setting suggests a secure area, possibly a military or government facility. The sky is clear, indicating fair weather conditions."
image_5_1.jpg,अदालत ने दोनों भाईयों को उम्रकैद की सजा सुनाई है (फोटो-Meta AI),A person was murdered in a land dispute 20 years later two brothers got life imprisonment,"The image depicts two men sitting in a cell, facing each other through the bars of their prison cell. Both men appear to be middle-aged, with one on the left side of the frame and the other on the right. They are dressed in white shirts, suggesting a uniform or standard prison attire. The man on the left has a mustache and is looking directly at the other man, while the man on the right is looking down, possibly at his hands or the floor. The background is a simple, unadorned wall, and the lighting is dim, giving the scene a somber and serious atmosphere. There are no visible texts or distinguishing marks that provide additional context within the image. The style of the image is realistic, with a focus on the characters and their expressions."
image_6_1.jpg,मुख्य आरोपी की पत्नी को यूपी से गिरफ्तार किया गया (फोटो- Meta AI),Neighboring family was killed with the intention of robbery wife of main accused in triple murder case also arrested,"The image depicts a person seated on a chair, dressed in a traditional Indian attire known as a saree. The saree is predominantly yellow, with a pattern that suggests it might be a traditional or cultural design. The person is wearing multiple bracelets on their wrists, which could indicate a cultural or religious significance. The setting appears to be an indoor space with a dark background, which puts the focus on the person and their attire. The lighting is soft, casting gentle shadows and highlighting the texture of the saree. The person's posture is relaxed, with their hands resting gently on their knees. There are no visible texts or distinctive landmarks in the image. The style of the image is realistic with a cinematic quality, suggesting it could be from a film or a high-quality photograph."
image_7_1.jpg,STF ने कुकी संगठन के पदाधिकारी को पकड़ा है (सांकेतिक चित्र- Meta AI),Pistol ammunition and death equipment recovered... Security forces arrested UKNA official,"The image depicts a tense scene with two men in the foreground and a group of individuals in the background. The man in the foreground on the left appears to be a law enforcement officer, identifiable by his uniform with a badge and a belt. He is holding a gun with a firm grip, suggesting he is in a situation where he might need to use it. His expression is serious and focused.  The man in the foreground on the right appears to be a civilian, possibly a protester or someone involved in a conflict. He is holding a cell phone in one hand and a bunch of green fruits, possibly apples, in the other. His expression is one of concern or fear, and he seems to be looking towards the officer with a sense of apprehension.  In the background, there are several other individuals, some of whom are also wearing uniforms, indicating they might be part of the same law enforcement unit. The setting appears to be an urban environment, possibly during a protest or a tense situation. The image captures a moment of high tension and potential conflict."
image_8_1.jpg,तीनों पुलिसवालों को गिरफ्तार कर लिया गया (सांकेतिक फोटो- Meta AI),Bihar Crime: Police raid on police station three policemen arrested... the whole story will shock you,"The image depicts two individuals dressed in beige military uniforms, standing side by side with their hands clasped together in front of them. Both individuals are wearing dark belts with buckles, and there are visible badges on their uniforms. The person on the left is wearing a watch on their left wrist, while the person on the right is wearing a watch on their right wrist. The background is not clearly visible, but the focus is on the two individuals and their attire, suggesting a formal or ceremonial context. The image is a photograph with a realistic color palette and a shallow depth of field, which blurs the background and draws attention to the subjects."
image_9_1.jpg,पुलिस आरोपी की तलाश में जुट गई है (सांकेतिक फोटो- Meta AI),First he distracted the woman with his words then kidnapped a seven month old child this is how the police identified the accused,"The image depicts a man and a child standing on a train platform. The man is holding the child securely in his arms. He appears to be of Indian descent, with dark hair and a beard. The child is wearing a white shirt and has a calm expression on their face.  The man is dressed in a light blue shirt and dark pants. He is looking directly at the camera with a serious expression.  Behind them, there are other passengers waiting on the platform. There are also several pieces of luggage visible, including suitcases and backpacks, suggesting that the man and child might be traveling.  The train itself is not visible in the image, but the platform and the presence of luggage suggest that they are at a train station. The lighting is natural, indicating that the photo was taken during the day."
image_10_1.jpg,यात्रियों की सुरक्षा सुनिश्चित करने के लिए पुलिस ने एक नई रणनीति बनाई है. ,'Undercover' police will keep an eye on criminals in Delhi Metro this is how quick action will be taken,"The image depicts a bustling scene inside a train station. Dominating the left side of the frame is a train, painted in a sleek gray color with a striking red and white logo on its front. The logo reads ""Bombardier,"" indicating the manufacturer of the train. The train is stationary, suggesting it is either picking up or dropping off passengers.  On the right side of the image, a group of people are waiting on the platform. They are dressed in a variety of casual attire, with some carrying backpacks and handbags, indicating they might be commuters or travelers. The platform itself is marked with yellow and red safety lines, guiding passengers to stand behind them while waiting for the train.  Above the platform, there are electronic signs displaying train schedules and destinations. The signs are clear and easy to read, providing essential information to commuters. The ceiling of the station is high, with metal beams and ductwork visible, suggesting a well-maintained and modern infrastructure.  The overall atmosphere of the image is one of everyday life, capturing a moment in the routine of public transportation. The image does not contain any people or objects that are out of place or unusual, suggesting it is a typical scene one might encounter in a busy urban train station."
