image number,alt,article_heading,description
image_1_1.jpg,Putin visits drone production plant (Reuters),Putin said that drones have radically changed the mechanisms of war,"The image depicts an indoor setting where a group of men, dressed in formal attire, are gathered around a table. The central figure appears to be a man in a dark suit with a blue tie, who is looking down at the table with a thoughtful expression. He seems to be engaged in a discussion or examination of the items on the table.  The table is covered with various mechanical models, including what appears to be a model of a helicopter or drone, with intricate details visible. The models are predominantly gray and black, with some parts in green and red, suggesting a focus on precision and craftsmanship.  The men are standing in a semi-circle around the table, with some facing the table and others slightly turned away, indicating an ongoing conversation or inspection. The background is softly lit, with a hint of a tent-like structure, suggesting that this might be an event or exhibition related to the models on display.  The overall atmosphere is one of seriousness and interest, with the men's attire and the nature of the models hinting at a professional or academic context. The image captures a moment of engagement and discussion, with the central figure appearing to be the focal point of the gathering."
image_1_2.jpg,The Russian president noted that the new equipment can reach greater distances and speeds of between 300 and 700 kilometers per hour (Sputnik/Valery Sharifulin/Pool via REUTERS),Putin said that drones have radically changed the mechanisms of war,"The image depicts a formal event where a group of men, some in military uniforms and others in suits, are gathered around a table. The men in military uniforms are wearing badges and have a more casual posture, while the men in suits are standing upright and appear more formal. One man in a suit is holding a small, intricate model of a drone or unmanned aerial vehicle (UAV). The model is detailed, with visible propellers and a sleek design. The men are engaged in conversation, with some looking at the model and others observing the interaction. The setting suggests a professional or governmental context, possibly a discussion about military technology or drone technology. The background is blurred, but it appears to be an indoor space with a large window or glass wall, allowing natural light to illuminate the scene."
image_1_3.jpg,A firefighter works at the site of a Russian drone attack (REUTERS),Putin said that drones have radically changed the mechanisms of war,"The image depicts a nighttime scene of a fire emergency. A firefighter, wearing a helmet and protective gear, is actively engaged in extinguishing a fire. The firefighter is holding a hose, which is connected to a fire truck that is not visible in the frame. The fire is intense, with visible flames and smoke, and the firefighter appears to be using a tool to direct the water from the hose onto the fire.  The setting appears to be a residential area, with a building that is engulfed in flames. The building's structure is visible, with what seems to be a staircase and possibly a balcony. The fire is consuming the building, with the flames reaching high into the night sky.  The image captures the urgency and danger of the situation, with the firefighter's focused expression and the chaotic scene of the burning building. The lighting is dramatic, with the fire's glow illuminating the scene and creating a stark contrast with the darkness of the night."
image_1_4.jpg,Russian President Vladimir Putin has chaired a meeting to discuss the conditions for using Russia's nuclear arsenal in the face of external threats (Reuters),Putin said that drones have radically changed the mechanisms of war,"The image depicts a formal meeting taking place in a room with a classic design. At the head of the table is a man who appears to be the leader or the subject of the discussion, seated in a chair with a flag behind him. He is surrounded by other men, all dressed in suits and ties, seated on the opposite side of the table. The men on the opposite side are attentively listening to the man at the head of the table, who seems to be speaking or presenting. The room has a formal and professional atmosphere, with a large flag on the wall behind the seated men, suggesting a governmental or official setting. The men are all focused on the speaker, indicating a serious discussion or negotiation."
image_2_1.jpg,Mark Rutte takes over as the new NATO secretary general (REUTERS/Yves Herman),Mark Rutte has been appointed as the new NATO secretary general with a commitment to keep Ukraine among the alliance's priorities,"The image depicts two men shaking hands in front of a backdrop of numerous flags. The man on the left is wearing a dark suit with a tie, and the man on the right is also dressed in a dark suit with a tie. Both men appear to be middle-aged or older, and they are both smiling and looking towards each other as they shake hands. The flags behind them are from various countries, suggesting that this could be a diplomatic or international event. The setting appears to be indoors, possibly a conference room or a similar formal environment. There are no visible texts or distinctive logos in the image."
image_2_2.jpg,Mark Rutte hopes to keep Ukraine among the alliance's priorities (REUTERS/FILE),Mark Rutte has been appointed as the new NATO secretary general with a commitment to keep Ukraine among the alliance's priorities,"The image depicts two men in what appears to be a formal or semi-formal setting. The man on the left is wearing a dark suit with a blue tie and a lapel pin, suggesting a professional or ceremonial role. He is looking down at the other man with a slight smile, indicating a friendly or positive interaction. The man on the right is wearing a green shirt with a collar and a blue tie, and he is looking up at the man on the left with a smile, suggesting a moment of shared happiness or agreement. Both men are wearing glasses, which adds to their professional appearance. The background is blurred, but it seems to be an indoor setting with other people, possibly at an event or gathering. The overall atmosphere is one of camaraderie and mutual respect."
image_2_3.jpg,The Dutch leader expressed his willingness to work with Kamala Harris or Donald Trump (REUTERS/Yves Herman),Mark Rutte has been appointed as the new NATO secretary general with a commitment to keep Ukraine among the alliance's priorities,"The image shows a man from the side, facing away from the camera. He appears to be middle-aged, with short, dark hair that is graying at the sides. The man is wearing glasses with a thin frame, and he has a serious expression on his face. He is dressed in a dark suit with a white shirt and a dark tie. The background is blurred, but it seems to be an outdoor setting with what could be a building or a fence in the distance. The lighting suggests it might be daytime."
image_3_1.jpg,File photo of a Ukrainian soldier (EFE/Orlando Barría),An American captured as a combatant in Ukraine pleaded guilty in a Moscow court,"The image depicts a silhouette of a person standing at the edge of a cliff, gazing out towards a sunset. The individual appears to be holding a small object, possibly a bird, in their hands. The sky is painted with hues of orange and pink, suggesting the sun is setting or has recently set. The silhouette of the person and the bird is dark against the vibrant sky, creating a striking contrast. The cliff edge is visible, and there is a structure or building to the left of the person, which is also in silhouette. The overall scene conveys a sense of tranquility and contemplation, as the person seems to be enjoying the beauty of the natural landscape."
image_3_2.jpg,Ukrainian soldiers in Pokrovsk Donetsk region (EFE/ Mikola Koval),An American captured as a combatant in Ukraine pleaded guilty in a Moscow court,"The image depicts three individuals seated inside a military tank. The tank is equipped with a large caliber gun barrel on the left side, and the interior is visible with the crew members wearing helmets and military uniforms. The tank is parked in a natural setting with trees and foliage in the background, suggesting a location that could be a training ground or a military exercise area. The crew members appear focused and alert, possibly during a training exercise or a real operation. The tank's design and markings indicate it is likely part of a specific military unit or branch."
image_4_1.jpg,One of the big questions about the U.S. presidential election is about foreign policy and whether it will change under the new administration whoever it may be. (REUTERS/Eduardo Muñoz and Nathan Howard),Will any foreign policy proposals for the United States emerge from the current election campaign?,"The image you've provided appears to be a split-screen comparison of two individuals. On the left side, there is a man with fair skin and light-colored hair. He has a stern expression on his face, with furrowed brows and a slight frown. His eyes are looking directly at the camera, and his skin texture is visible, showing signs of aging.  On the right side, there is a woman with a smooth complexion and dark hair. She has a gentle smile on her face, with her eyes looking slightly to the side, not directly at the camera. Her skin texture is also visible, showing a smooth and well-maintained appearance.  The style of the image is a straightforward, side-by-side comparison, likely intended to show the differences in appearance between the two individuals. The lighting and focus are consistent across both sides, highlighting the facial features of each person."
image_4_2.jpg,One of the main points of focus in the US political debate is the Biden administration's unbridled support for Ukraine. (REUTERS/Leah Millis/File photo),Will any foreign policy proposals for the United States emerge from the current election campaign?,"The image depicts two men shaking hands on what appears to be a television set. The man on the left is wearing a dark-colored shirt and has a beard, while the man on the right is dressed in a dark suit with a blue tie. Both men are looking towards each other, and their expressions suggest a formal or professional interaction. The background is a gradient of pink and beige colors, and there is a floral arrangement with blue flowers in the foreground. The overall style of the image suggests it might be a screenshot from a news broadcast or a political event."
image_4_3.jpg,The strategic alliance between China and Russia is causing concern among political elites in Washington. (Sputnik/Sergei Guneev/Pool via REUTERS),Will any foreign policy proposals for the United States emerge from the current election campaign?,"The image depicts two men shaking hands in front of a backdrop of national flags. The man on the left is wearing a dark suit with a red tie, and the man on the right is wearing a dark suit with a blue tie. Both men are smiling and appear to be in a formal setting, possibly a diplomatic or political meeting. The flags in the background are the national flags of China and Russia, indicating that the meeting might be between Chinese and Russian officials. The overall atmosphere of the image suggests a positive and cooperative relationship between the two countries."
image_4_4.jpg,FILE PHOTO: World leaders attend a meeting of the NATO-Ukraine Council during the NATO 75th anniversary summit in Washington U.S. July 11 2024. (REUTERS/Yves Herman),Will any foreign policy proposals for the United States emerge from the current election campaign?,"The image depicts an indoor setting that appears to be a conference room or a large meeting hall. The room is filled with people seated at tables, facing towards the front where a speaker is visible. The audience members are dressed in business attire, suggesting a formal or professional event. The tables are equipped with microphones, indicating that this is a setting for speeches or presentations.  The room has a modern design with a large, circular, blue light fixture hanging from the ceiling, which provides a focal point and adds a dramatic effect to the space. The walls are adorned with logos and banners, including the NATO logo, indicating that this event may be related to international diplomacy or military affairs. The text ""NATO 75"" suggests that this is a 75th anniversary event for NATO, the North Atlantic Treaty Organization.  The audience members are engaged in the event, with some looking towards the speaker and others interacting with each other. The overall atmosphere is serious and focused, typical of such formal gatherings. The lighting is bright, with a mix of natural and artificial light sources, creating a well-lit environment conducive to visibility and attention."
image_5_1.jpg,Ukrainian soldiers operate a drone in a file photo (EFE/ Markiian Lyseiko),Ukraine uses drones to attack an Iranian missile depot in Russia,"The image depicts a group of five individuals standing outdoors during what appears to be either sunrise or sunset, given the soft, warm lighting. The sky is a gradient of blue and orange hues, suggesting either early morning or late evening. The people are dressed in casual attire, with some wearing jackets and others in lighter clothing, and they seem to be engaged in a discussion or observing something.  In the foreground, there is a drone flying in the sky. The drone is equipped with multiple propellers and has a red light on its underside, which is illuminated, indicating that it is powered on and possibly in flight. The drone is positioned slightly to the left of the group of people, and its flight path suggests it is moving away from the group.  The setting appears to be a rural or open field, with no visible structures or landmarks that provide context about the location. The focus of the image is on the interaction between the group of people and the drone, capturing a moment of shared interest or activity."
image_5_2.jpg,Ukrainian soldiers. REUTERS/Toby Melville/File Photo/File Photo,Ukraine uses drones to attack an Iranian missile depot in Russia,"The image depicts a group of four individuals standing atop a structure that resembles a military tank. The tank is large and cylindrical, with a prominent barrel and a flat top where the people are standing. The individuals appear to be holding a flag, which is predominantly blue with a yellow border and a hammer and sickle symbol in the center, suggesting a connection to a country with a similar emblem, possibly Ukraine. The sky in the background is partly cloudy, with the sun shining brightly, casting a warm glow on the scene. The overall atmosphere of the image is one of unity and patriotism, with the flag being a symbol of national pride."
image_5_3.jpg,In this image provided by the Ukrainian Emergency Service a damaged apartment block is seen following a Russian glider bomb attack in Zaporizhia Ukraine Saturday Sept. 29 2024. (Ukrainian Emergency Service via AP),Ukraine uses drones to attack an Iranian missile depot in Russia,"The image depicts a building that has sustained significant damage, with large sections of its structure visibly destroyed. The building appears to be made of concrete or brick, and there are visible signs of wear and tear, such as cracks and discoloration. The damage is concentrated in the middle of the building, where large chunks of concrete have been dislodged, exposing the interior. There are also visible remnants of wooden beams and debris scattered throughout the scene.  The building's windows are broken, and some are missing, revealing the interior. The roof is partially intact but has been damaged, with some sections missing or severely damaged. There are no visible signs of people or moving vehicles, suggesting that the image was taken after the damage occurred.  The sky is clear, indicating that the photo was taken during the day. The overall scene conveys a sense of destruction and abandonment, with the building's state suggesting it has been severely impacted by an event, possibly a natural disaster or an explosion. The image does not contain any text or additional context that would provide further information about the location or the circumstances leading to the damage."
image_6_1.jpg,"Secretary of State Antony Blinken expressed Washington's ""deep concern"" about the support that companies from the Asian giant provide to the Kremlin's defense industry (REUTERS)",The United States has demanded that the Chinese regime stop supporting the Russian war machine in Ukraine,"The image depicts two men shaking hands in what appears to be a formal setting. The man on the left is slightly taller and is wearing a dark suit with a blue tie. The man on the right is slightly shorter and is also dressed in a dark suit with a brown tie. Both men are looking directly at the camera with serious expressions.  They are standing in front of a large, colorful painting that features a tree with red flowers. The painting is framed and spans a significant portion of the wall behind them. The background is otherwise plain and does not provide any additional context about the location.  The style of the image is a standard photograph with no filters or artistic effects applied. The focus is on the two men and their interaction, with the painting serving as a backdrop that adds color and context to the scene."
image_6_2.jpg,The United States has demanded that the Chinese regime stop supporting the Russian war machine in Ukraine (EFE/OLGA FEDOROVA),The United States has demanded that the Chinese regime stop supporting the Russian war machine in Ukraine,"The image depicts a man standing at a podium, appearing to be addressing an audience. He is dressed in a dark suit with a tie, suggesting a formal or professional setting. The man has short, graying hair and is looking slightly to his left with a focused expression. Behind him is a backdrop of a textured wall, which could be a wall of a room or a stage, indicating that this might be a conference or a formal event. The lighting is even, and there are no visible texts or logos in the image. The style of the image is a standard photograph with no filters or artistic effects applied."
image_6_3.jpg,The Ukrainian leader presented his detailed “Victory Plan” to Democratic Representative and current Vice President Kamala Harris as well as Republican candidate and former President Donald Trump thanking the US Congress for its “full support” in their meetings (REUTERS/Shannon Stapleton),The United States has demanded that the Chinese regime stop supporting the Russian war machine in Ukraine,"The image depicts a formal indoor setting where two men are engaged in a conversation. The man on the left is wearing a dark-colored shirt with a small emblem on the left side, and he appears to be listening attentively to the other man. The man on the right is dressed in a blue suit with a red tie, and he seems to be speaking. Both men are looking at each other, indicating an exchange of ideas or discussion.  In the background, there are other individuals present, suggesting that this might be a professional or formal event. The room has a clean, modern aesthetic with a glass wall that allows natural light to enter. The overall atmosphere is serious and professional."
image_7_1.jpg,Volodymyr Zelensky (REUTERS/Kevin Lamarque),China and Brazil press ahead with Ukraine peace plan despite Zelensky's anger,"The image shows a man standing in front of a flag. The man appears to be middle-aged, with a beard and mustache, and is wearing a dark-colored shirt. He is looking slightly to the side with a thoughtful or contemplative expression. The flag behind him is the American flag, recognizable by its stars and stripes pattern. The background is not clearly visible, but it seems to be an indoor setting with a hint of a yellowish wall. The man's attire and the flag suggest that this could be a political or formal event."
image_7_2.jpg,Wang Yi (REUTERS/Eduardo Munoz),China and Brazil press ahead with Ukraine peace plan despite Zelensky's anger,"The image depicts a formal meeting or conference setting. At the center of the image is a man seated at a table, appearing to be speaking or listening to a speaker. He is wearing a dark suit with a tie and has short, graying hair. His posture suggests he is engaged in the proceedings.  Behind him, there are other individuals, some of whom are also dressed in suits, indicating a professional or formal event. The room has a structured appearance with a focus on the central figure, suggesting he may be the main speaker or the subject of the discussion.  The table in front of the man has a nameplate with the word ""CHINA"" on it, which could imply that the discussion is related to China or that the man is representing China in some capacity. There are also other nameplates on the table, including ""ECUADOR,"" which suggests that this is an international meeting or conference involving multiple countries.  The setting appears to be indoors, with a focus on the human subjects and the immediate surroundings. The lighting is even, and the background is blurred, drawing attention to the central figure and the ongoing discussion."
image_8_1.jpg,A new Russian attack on Zelensky's hometown left at least three dead and six injured (Europa Press),New Russian attack on Zelensky's hometown leaves at least three dead and six injured,"The image depicts a scene of destruction and abandonment. In the foreground, there is a playground with a swing set that appears to be in good condition, with a yellow swing and purple poles. The playground is situated in a grassy area that is littered with debris and rubble. The background shows a multi-story building that has been severely damaged, with visible signs of fire and explosion. The building's facade is a mix of colors, including white, gray, and brown, with some areas appearing to be intact while others are heavily damaged. The overall atmosphere of the image is somber and poignant, suggesting a location that has been through a significant disaster or conflict."
image_8_2.jpg,In Izmail the latest Russian attack left three dead and 11 wounded (REUTERS),New Russian attack on Zelensky's hometown leaves at least three dead and six injured,"The image depicts a nighttime scene of a fire emergency. A firefighter, wearing a helmet and protective gear, is actively engaged in extinguishing a fire. The firefighter is holding a hose, which is connected to a fire truck that is not visible in the frame. The fire is intense, with visible flames and smoke, and the firefighter appears to be using a tool to direct the water from the hose onto the fire.  The setting appears to be a residential area, with a building that is engulfed in flames. The building's structure is visible, with what seems to be a staircase and possibly a balcony. The fire is consuming the building, with the flames reaching high into the night sky.  The image captures the urgency and danger of the situation, with the firefighter's focused expression and the chaotic scene of the burning building. The lighting is dramatic, with the fire's glow illuminating the scene and creating a stark contrast with the darkness of the night."
image_8_3.jpg,Zelensky met with Biden Harris and Trump during his trip to the United States (REUETRS),New Russian attack on Zelensky's hometown leaves at least three dead and six injured,"The image depicts two men seated in a formal setting, which appears to be an office or a room with a presidential backdrop. The man on the left is dressed in a dark suit and tie, holding what looks like a document or a folder. He is seated in a chair with a high back and is looking towards the man on the right. The man on the right is wearing a blue suit and tie, and he is holding a piece of paper or a folder, also looking towards the man on the left. Both men seem to be engaged in a discussion or an interview.  The room has a classic design with a fireplace and a mantel adorned with a green plant. There are portraits on the wall, suggesting an official or historical context. A blue and gold carpet covers the floor, adding to the formal ambiance. In the foreground, there is a wooden table with a vase of yellow and blue flowers, which adds a touch of color to the scene. The overall impression is of a professional environment, possibly a political or governmental setting, given the attire of the men and the decor."
image_9_1.jpg,Patriot missile launch (EFE/YONHAP),Biden approved a new military aid package for Ukraine with precision bombs and Patriot missiles,"The image depicts a military scene where a missile is being launched from a mobile launch platform. The platform is mounted on a truck chassis, which is visible at the bottom of the image. The missile is in the process of being fired, with a bright flame emanating from its rear, indicating the ignition of the propellant. The missile itself is a long, cylindrical structure with a pointed nose, typical of many military missiles. The background shows a clear sky, suggesting that the launch is taking place during the day. There are no visible texts or distinctive markings that provide additional context about the location or the specific type of missile being launched. The style of the image is a real-life photograph with a focus on the action of the missile launch."
