image number,alt,article_heading,description
image_1_1.jpg,FILE - Supporters look at a graphic on the screen as Republican presidential nominee former President Donald Trump speaks at a campaign event at the Indiana University of Pennsylvania Ed Fry Arena Sept. 23 2024 in Indiana Pa. (AP Photo/Alex Brandon File),How Trump credits an immigration chart for saving his life and what the graphic is missing,"The image depicts an indoor event where a group of people are gathered, likely attending a political rally or similar gathering. The attendees are seated and standing, with some wearing hats and others in casual attire. The setting appears to be a large venue with a stage, where a large screen is displaying a graph related to ""Illegal Immigration into the U.S."" The text on the screen indicates a percentage increase over time, with a focus on the most recent data point, which is highlighted in red. The audience seems engaged, with some looking at the screen and others interacting with each other. The overall atmosphere suggests a political or social event focused on the topic of immigration policy."
image_1_2.jpg,FILE - Republican presidential candidate former President Donald Trump speaks at a campaign rally July 13 2024 in Butler Pa. (AP Photo/Evan Vucci File),How Trump credits an immigration chart for saving his life and what the graphic is missing,"The image depicts an outdoor event where a man is standing at a podium, addressing an audience. The man appears to be middle-aged, wearing a dark suit with a red tie and a red baseball cap. He is gesturing with his right hand, pointing towards the right side of the image.  Behind the man is a large, vertical banner with a graph and text. The text on the banner reads ""Illegal Immigration into the U.S."" The graph is a line chart with various data points, indicating statistics related to illegal immigration. The banner is predominantly white with red and blue accents.  In the background, there are several individuals who appear to be attendees of the event. They are standing and sitting, with some wearing baseball caps and others in casual attire. The setting suggests a public event, possibly a political or social gathering, focused on the topic of illegal immigration. The sky is clear, indicating fair weather conditions."
image_1_3.jpg,FILE - Republican presidential nominee former President Donald Trump speaks at a campaign event Sept. 29 2024 in Erie Pa. (AP Photo/Matt Rourke File),How Trump credits an immigration chart for saving his life and what the graphic is missing,"The image depicts a political event where a man is speaking to a crowd. The man is standing at a podium with a microphone, wearing a suit and tie, and appears to be addressing the audience. The crowd is composed of people holding up signs, with many of them displaying messages related to political issues, particularly immigration. The signs are predominantly blue and white, with text that includes phrases such as ""Make America Great Again,"" ""Make America Safe Again,"" and ""Make America Great Again.""  In the background, there is a large screen displaying a graph titled ""Illegal Immigration into the U.S."" The graph shows a line chart with various data points, indicating fluctuations in illegal immigration rates over time. The chart includes annotations such as ""300k,"" ""270k,"" ""240k,"" and ""190k,"" which likely represent the number of illegal immigrants entering the U.S. in different years. The chart also includes a timeline from 2012 to 2022, with corresponding data points.  The setting appears to be an indoor venue, possibly a convention center or a similar event space, given the presence of the podium and the audience. The overall atmosphere suggests a political rally or a similar event focused on immigration policy."
image_1_4.jpg,FILE - Republican presidential nominee former President Donald Trump speaks at the Johnny Mercer Theatre Civic Center Sept. 24 2024 in Savannah Ga. (AP Photo/Evan Vucci File),How Trump credits an immigration chart for saving his life and what the graphic is missing,"The image depicts a man standing in front of a large screen displaying a graph. The man appears to be middle-aged, with gray hair, and is wearing a dark suit with a red tie. He is holding his hands together in front of him, with his fingers interlaced, and his mouth is slightly open as if he is speaking or about to speak. The man's expression suggests he is engaged in a serious discussion or presentation.  The graph on the screen is titled ""Illegal Immigration Into the U.S."" and includes various lines and annotations that likely represent different data points or trends related to illegal immigration. The graph is detailed, with multiple colors and labels, indicating a complex dataset. The background is not clearly visible due to the focus on the man and the screen, but it appears to be a professional setting, possibly a conference or a press event, given the presence of microphones on either side of the man. The overall style of the image is a candid photograph capturing a moment during a public speaking event."
image_2_1.jpg,Albanian Parliament's security move away Ramadan Lika center lawmaker of conservative opposition Democratic Party as he tried to disrupt the parliament's session during a protest for the imprisonment of a fellow lawmaker in Tirana Albania Thursday Oct. 3 2024. (AP Photo/Hameraldi Agolli),Albanian opposition MPs try to disrupt Parliament to protest a colleague's imprisonment,"The image depicts a group of men in a tense situation. The central figure appears to be a man in a pink suit, who is being restrained by several other men. The man in the pink suit is bent over, with his arms behind his back, and his head is down, suggesting he may be in distress or being held back. The men restraining him are dressed in dark suits and ties, indicating a formal or professional setting. The expressions on their faces are serious, and they seem to be exerting effort to hold the central figure in place. The background is blurred, but it appears to be an outdoor setting with a building that could be a government or institutional building. The overall atmosphere of the image suggests a political or legal confrontation."
image_2_2.jpg,Albanian opposition lawmakers put fire on mannequins depicting members of the Socialist Party government during a protest for the imprisonment of a fellow lawmaker in Tirana Albania Thursday Oct. 3 2024. (AP Photo/Hameraldi Agolli),Albanian opposition MPs try to disrupt Parliament to protest a colleague's imprisonment,"The image depicts a group of individuals standing in front of a building with a flag that features a double-headed eagle. The individuals are dressed in black and white striped shirts and pants, and their faces are obscured by white masks. Each person has flames emanating from their heads, creating a dramatic and intense visual effect. The flames are bright orange and yellow, contrasting with the dark attire of the individuals. The building behind them has a classical architectural style with columns and a large entrance. There are spectators in the background, some of whom are taking photographs. The setting appears to be an outdoor event or demonstration."
image_2_3.jpg,Albanian opposition lawmakers put fire on mannequins depicting members of the Socialist Party government with a photo of Prime Minister Edu Rama in the center during a protest for the imprisonment of a fellow lawmaker in Tirana Albania Thursday Oct. 3 2024. (AP Photo/Hameraldi Agolli),Albanian opposition MPs try to disrupt Parliament to protest a colleague's imprisonment,"The image depicts a group of individuals wearing black and white striped shirts, which are reminiscent of the traditional Albanian attire known as ""fustanelli."" The shirts are adorned with the emblem of the Albanian flag, which consists of a black double-headed eagle on a red background. The individuals are standing in front of a building with a similar emblem on its facade, suggesting a connection to Albanian culture or a specific event related to Albania.  The most striking feature of the image is the visual effect of fire emanating from the heads of the individuals. The flames are bright and appear to be consuming the heads, creating a dramatic and intense atmosphere. The fire is not real but rather a digital or artistic representation, as it does not interact with the environment in a realistic way.  The image is likely intended to convey a message or represent a symbolic event, possibly related to Albanian culture or history. The use of fire imagery could symbolize passion, resistance, or a call to action. The specific context or the message behind the image is not clear from the image alone, and additional information would be needed to provide a more detailed interpretation."
image_2_4.jpg,Albania's Prime Minister Edi Rama addresses the 79th session of the United Nations General Assembly Friday Sept. 27 2024. (AP Photo/Pamela Smith),Albanian opposition MPs try to disrupt Parliament to protest a colleague's imprisonment,"The image depicts a man standing at a podium, addressing an audience. He appears to be an older gentleman with a beard and mustache, wearing a dark suit with a red tie. The podium has a microphone on it, suggesting that he is speaking to an audience. The background features a wall with a pattern that resembles marble, and there is a logo on the podium that includes the United Nations emblem, indicating that the setting is likely the United Nations General Assembly. The man's attire and the setting suggest that he is a diplomat or representative of a country, participating in an official event or meeting."
image_2_5.jpg,Albanian Parliament's security move away Ramadan Lika center lawmaker of conservative opposition Democratic Party as he tried to disrupt the parliament's session during a protest for the imprisonment of a fellow lawmaker in Tirana Albania Thursday Oct. 3 2024. (AP Photo/Hameraldi Agolli),Albanian opposition MPs try to disrupt Parliament to protest a colleague's imprisonment,"The image depicts a group of men in a tense situation. There are at least six individuals visible, with one man in the center who appears to be the focus of the confrontation. He is balding and is wearing a red jacket. The other men are dressed in suits, suggesting a formal or professional setting. The expressions on their faces are serious and some are looking down, possibly indicating concern or contemplation. The overall atmosphere of the image suggests a moment of conflict or a difficult decision being made."
image_3_1.jpg,State Sen. Dave Min D-Irvine listens as lawmakers discuss a bill before the Senate at the Capitol in Sacramento Calif. Monday July 10 2023. Scott Baugh 59 of Huntington Beach running for California's 47th Congressional District greets supporters at Baugh's campaign headquarters kick-off on Saturday April 2 2022 in Newport Beach CA. Republican candidate Scott Baugh is challenging Democratic Rep. Katie Porter. (AP Photo/Rich Pedroncelli Gary Coronado / Los Angeles Times),Your guide to California's 47th Congressional District race: Baugh vs. Min,"The image you've provided appears to be a split-screen comparison of two individuals. On the left side, there is a man with dark hair, wearing a suit and tie, looking serious or contemplative. He has a neutral expression and is looking directly at the camera. On the right side, there is another man with a white cap, a red and white checkered shirt, and a smiling expression. He also looks directly at the camera. Both men seem to be middle-aged or older. The background is not clearly visible, but it appears to be an indoor setting with a neutral background. The image is a side-by-side comparison, likely intended to show a contrast between the two individuals, possibly in terms of attire, demeanor, or context."
image_4_1.jpg,Rep. Mike Garcia R-Calif. a member of the House Appropriations Subcommittee on Defense and a former Navy pilot speaks to reporters about the urgency of passing a Defense funding bill at the Capitol in Washington Friday Sept. 15 2023. FILE - Then-Virgin Galactic CEO George Whitesides speaks at a hangar at Mojave Air and Space Port in Mojave Calif. Sept. 25 2013. Republican U.S. Rep. Mike Garcia whose 2022 victory in a Democratic-leaning district north of Los Angeles gave the GOP control of the U.S. House is facing early competition if he seeks another term. Former Virgin Galactic CEO Whitesides announced Wednesday Feb. 22 2023 he was entering the race in Garcia's 27th District. (AP Photo/Reed Saxon AP Photo/J. Scott Applewhite),Your guide to California's 27th Congressional District race: Garcia vs. Whitesides,"The image you've provided appears to be a split-screen of two men, likely politicians, given their attire and the context of the image. The man on the left is wearing a dark suit with a red tie, suggesting a formal or professional setting. He has short, graying hair and is looking slightly to his left with a serious expression. The man on the right is dressed in a light-colored shirt and has short, dark hair. He is looking directly at the camera with a more neutral expression.  Both men seem to be in a room with a blue background, which could indicate that they are at a press conference or a similar event. The man on the left is wearing a lapel pin, which might signify his political affiliation or a specific event or organization. The image is a photograph, and the style suggests it could be from a news broadcast or a similar media event."
image_5_1.jpg,Republican presidential nominee former President Donald Trump departs after speaking at a campaign rally Sunday Sept. 29 2024 in Erie Pa. (AP Photo/Matt Rourke),Calmes: Donald Trump turns on a firehose of lies as the election nears. It matters,"The image depicts a formal event, likely a political or ceremonial occasion, given the presence of the American flag and the attire of the individuals. At the center of the image, a person is walking away from the camera, appearing to be a politician or dignitary, dressed in a dark suit with a tie. The individual is moving towards a blue curtain, which is drawn back to reveal a red carpet, suggesting a formal entrance or exit.  On either side of the central figure, there are two American flags, each with a white border and a gold fringe, which are typically displayed at official government events. The flags are positioned vertically and are slightly taller than the central figure, adding to the sense of formality and importance.  The background is a solid blue color, which provides a stark contrast to the red carpet and the white and gold of the flags, drawing attention to the central figure and the flags. The lighting is even, with no harsh shadows, indicating a professional setup for the event.  Overall, the image conveys a sense of solemnity and ceremony, with the central figure's attire and the presence of the American flags suggesting a significant political or governmental event."
image_6_1.jpg,CaliforniaOs 30th Congressional District race candidates Alex Balekian left and Laura Friedman. (Myung J. Chun / Los Angeles Times Michael Blackshire / Los Angeles Times),Your guide to California's 30th Congressional District race: Balekian vs. Friedman,"The image is a split-screen of two individuals, each captured in a moment of speaking into microphones. On the left side, there is a man with dark hair, wearing glasses, a blue shirt, and a tie. He appears to be outdoors, as suggested by the natural light and greenery in the background. On the right side, there is a woman with dark hair, wearing glasses, a pink blazer, and a black top. She also seems to be outdoors, as indicated by the similar natural light and greenery in the background. Both individuals are focused on their microphones, suggesting they are engaged in a public speaking event or a similar activity."
image_7_1.jpg,California Senate Distract 37 race candidates Josh Newman left and Steven Choi.,Your guide to California's state Senate District 37 race: Choi vs. Newman,"The image is a split-screen of two men, each captured in a moment of speech. On the left, a man with glasses and a suit is seen from the chest up. He appears to be in the middle of a conversation or presentation, with his mouth slightly open as if he is speaking. His attire is formal, with a dark suit and a light-colored shirt, and he is wearing a tie with a pattern that includes shades of blue and green.  On the right side of the image, another man is shown from the chest up. He is wearing a white hat with a black band, which is a distinctive feature of his appearance. He is also wearing glasses and a dark suit with a light-colored shirt and a blue tie. His expression is one of focus and engagement, suggesting he is actively participating in the conversation or event.  Both men are indoors, and the background is not clearly visible, but the setting appears to be a formal or professional environment, possibly a political or governmental event given the presence of the American flag in the background. The image is a photograph, and the style is straightforward, capturing the subjects without any artistic filters or effects."
image_8_1.jpg,US Senate race candidates Steve Garvey left and Adam Schiff during a televised debate for candidates in the senate race to succeed the late California Sen. Dianne Feinstein Monday Jan. 22 2024 in Los Angeles. (AP Photo/Damian Dovarganes),Your guide to California's U.S. Senate race: Garvey vs. Schiff,"The image you've provided appears to be a split-screen of two men, likely politicians, given their attire and the context of the background. The left side of the image shows a man with graying hair, wearing a dark suit with a white pocket square and a purple tie. He has a serious expression on his face and is looking directly at the camera.  On the right side of the image, there is another man with a similar serious expression, also dressed in a dark suit with a white pocket square and a blue tie. He is also looking directly at the camera.  Both men are standing in front of a dark background that suggests they might be at a formal event or a political gathering. The lighting is even, and there are no visible texts or logos in the image. The style of the image is a straightforward, side-by-side comparison, commonly used to show two individuals in a similar context."
image_9_1.jpg,no alt text,Former Colorado county clerk Tina Peters to be sentenced for voting data scheme,"The image shows a woman standing against a plain background. She appears to be middle-aged with white hair and is wearing a white blazer over a dark top. The blazer has a textured pattern and a double-breasted design. She is also wearing a dark turtleneck and a gold necklace with a small pendant. On her left lapel, there is a round button with the name ""TINA PETERS"" printed on it. The woman is looking slightly to her right with a neutral expression. The lighting in the room is even, and there are no visible texts or logos other than the button. The style of the image is a straightforward portrait with a focus on the subject."
image_10_1.jpg,Pennsylvania Senate candidate Dave McCormick waves after speaking with Republican presidential nominee former President Donald Trump at a campaign rally Sunday Sept. 29 2024 in Erie Pa. (AP Photo/Matt Rourke),Casey McCormick to meet for first debate in Pennsylvania's battleground Senate race,"The image depicts a political event where a man is addressing a large crowd. The man is standing on a stage, dressed in a dark suit with a red tie, and appears to be gesturing towards the audience. He is the central figure in the image, with the crowd filling the background.  The crowd is diverse, with individuals of various ages and genders, and they are holding up signs with political messages. Some signs are visible, including one that reads ""Make America Great Again"" and another that says ""Trump Pence."" The text on the signs suggests that the event is related to a political campaign or rally, possibly in support of the Trump-Pence ticket.  The setting appears to be an indoor venue, as indicated by the artificial lighting and the presence of a stage. The audience is seated, with some individuals standing, and they seem to be engaged in the event, with some looking towards the stage and others holding up their signs.  The image captures a moment of political activity, with the focus on the man on the stage and the crowd's response to his speech. The overall atmosphere suggests a campaign event or rally, with the attendees showing their support for the candidates mentioned on the signs."
image_10_2.jpg,Sen. Bob Casey D-Pa. speaks before Democratic presidential nominee Vice President Kamala Harris arrives for a campaign event Friday Sept. 13 2024 Wilkes-Barre Pa. (AP Photo/Matt Rourke),Casey McCormick to meet for first debate in Pennsylvania's battleground Senate race,"The image depicts a man standing at a podium with microphones, addressing an audience. He appears to be middle-aged, with graying hair and is wearing a light-colored, checkered shirt. The man is looking slightly to his left with a focused expression, suggesting he is in the middle of speaking. The background is blurred, but it seems to be an indoor setting with a crowd of people, indicating that this might be a political event or a public speaking engagement. The lighting is bright, highlighting the man and the podium, while the audience is less distinct due to the focus on the speaker."
image_10_3.jpg,"Republican presidential nominee former President Donald Trump left listens as Dave McCormick Republican candidate for U.S. Senate in Pennsylvania shouts ""fight fight fight"" during a campaign rally at Ed Fry Arena in Indiana Pa. Monday Sept. 23 2024. (AP Photo/Rebecca Droke)",Casey McCormick to meet for first debate in Pennsylvania's battleground Senate race,"The image depicts a political event where two men are addressing an audience. The man on the left is wearing a blue suit with a red tie, and he appears to be listening attentively to the man on the right. The man on the right is wearing a dark suit with a purple tie and is holding a microphone, suggesting he is the speaker at this moment. He is raising his right hand, possibly to emphasize a point or to signal to the audience.  The background is filled with a crowd of people, some of whom are holding signs, indicating that this is a political event with a passionate audience. The text on the signs is not fully legible, but it seems to be related to political messages or slogans.  The setting appears to be indoors, possibly a convention hall or a similar venue, given the stage setup and the audience. The lighting is bright, and the atmosphere seems to be one of excitement and engagement, typical of political rallies or speeches."
image_10_4.jpg,This combination of photos taken in Pennsylvania shows Sen. Bob Casey D-Pa. left at a campaign event Sept. 13 2024 in Wilkes-Barre and David McCormick the Republican nominee for Senate in Pennsylvania at a campaign event April 25 2024 in Harrisburg. (AP Photo),Casey McCormick to meet for first debate in Pennsylvania's battleground Senate race,"The image you've provided appears to be a split-screen comparison of two men. On the left side, there is a man with a fair complexion, gray hair, and a mustache. He is wearing a light blue, checkered shirt. On the right side, there is another man with a similar complexion and gray hair, but he has a beard. He is wearing a dark blue jacket over a light blue shirt. Both men are looking directly at the camera with serious expressions. The background is not clearly visible, but it seems to be a stage with a red and white striped pattern. The style of the image suggests it might be used for a comparison or side-by-side analysis of the two individuals."
image_10_5.jpg,A car passes signs supporting Democratic presidential nominee Vice President Kamala Harris and Sen. Bob Casey D-Pa. in Butler Friday Sept. 27 2024. (AP Photo/Matt Rourke),Casey McCormick to meet for first debate in Pennsylvania's battleground Senate race,"The image depicts a roadside scene with a focus on political campaign signs. The signs are affixed to a wooden post, which is situated on the side of a road. The background shows a rural setting with trees and a clear sky. The road appears to be a two-lane highway, and there is a vehicle visible in the distance.  The signs are predominantly blue and white, with text in white and red. The top sign reads ""HARRIS FOR PRESIDENT"" in white capital letters on a blue background. Below it, there is another sign that says ""BOB CASEY U.S. SENATE"" in white and red text on a blue background. The bottom sign is partially visible and includes the text ""TEXT JOIN TO 51041,"" suggesting a call to action for supporters to join a campaign or receive updates.  The wooden post holding the signs is weathered and appears to be part of a fence or barrier. There is a metal bracket attached to the post, which is used to secure the signs. The ground around the post is covered with grass and small plants, indicating that the location is likely in a rural or semi-rural area. The overall style of the image is a candid, real-life photograph with natural lighting."
