article_number,image number,alt,article_heading
1,1,US President Joe Biden tried allay fears of further escalation between Israel and Iran on October 3. (Image: ANI/File),Biden Says He Doesn't Know Whether Israel Is Holding Up Peace Deal to 'Influence' US Election
2,1,Kamala Harris and second gentleman Doug Emhoff board Air Force Two at O'Hare International Airport to return to Washington in Chicago Illinois U.S. August 23 2024. (Reuters),'Untrue': Kamala Harris' Husband Doug Rejects Reports Of Slapping Ex-Girlfriend During 2012 Cannes Film Festival
3,1,In the joint statement President Biden has been copious in his praise for India’s leadership on the world stage particularly Prime Minister Modi’s leadership in the G-20 and in the Global South. (PTI),Opinion | Modi-Biden Summit Reaffirms India-US Ties Have Bipartisan Support
4,1,Ryan Wesley Routh takes part in a rally in central Kyiv Ukraine. (Image: AP FILE),Ryan Wesley Routh Accused Of Attempting To Assassinate Trump Pleads Not Guilty
5,1,This combination of images shows Republican vice presidential nominee Sen. JD Vance and Democratic vice presidential candidate Minnesota Gov. Tim Walz speaking. (AP Photo),JD Vance vs. Tim Walz: When And Where To Watch US Vice Presidential Debate Ahead Of 2024 Election
6,1,US authorities had earlier said Iranian cyberattackers offered stolen material from Trump's campaign to staff for his then-rival Biden. (Photo: AP),US Charges Three Iranians Over Donald Trump Campaign Hack
7,1,Donald Trump implicated Iran for the assassination attempts on his life despite no public suggestion by law enforcement agencies of involvement by Iran or any other foreign power in either incidents. (Image: REUTERS),‘Your Country Gets Blown To Smithereens’: Trump Threatens Iran Accuses It Of Trying To Assassinate Him
8,1,Kamala Harris (L)/Donald Trump (R) (AP photos),Kamala Harris Gaining Ground On Donald Trump In US Presidential Race Survey Shows
9,1,Republican presidential nominee and former US President Donald Trump gestures at a campaign rally in Wilmington North Carolina US. (Image: REUTERS),‘That Will Be It’: Trump Says 2024 Presidential Run Will Be His Last
10,1,Democratic presidential nominee Vice President Kamala Harris speaks at Congressional Hispanic Caucus Institute (CHCI) Leadership Conference at the Ronald Reagan Building in Washington. (Image: AP PHOTO),Man Who Made Kamala Harris AI Parody Video Sues California After State Passes New Deepfake Laws
