image number,alt,article_heading,article_url,description
image_1_1.jpg,Smoke billows over Khiam amid ongoing cross-border hostilities between Hezbollah and Israeli forces as seen from Marjayoun near the border with Israel September 25 2024. REUTERS/Karamallah Daher,U.S. EU and nine other nations call for 21-day cease-fire on Israel-Lebanon border,https://www.usatoday.com/story/news/world/2024/09/25/united-states-temporary-cease-fire-israel-lebanon/75384779007/,"The image depicts a dramatic scene of a large explosion occurring in a residential area. The explosion is characterized by a massive cloud of dark, billowing smoke that dominates the upper portion of the image. The smoke is dense and appears to be rising rapidly into the sky, suggesting a significant and powerful explosion.  Below the smoke, there is a densely populated area with numerous buildings. The architecture of the buildings varies, with some having flat roofs and others featuring pitched roofs. The buildings are closely packed together, indicating a high-density urban environment.  The landscape surrounding the explosion is hilly, with a mix of greenery and built-up areas. The hills provide a natural backdrop to the scene, contrasting with the man-made structures. The sky is clear, which makes the smoke and the explosion stand out even more.  The image captures the immediate aftermath of the explosion, with no visible signs of rescue or recovery efforts. The scene is one of destruction and chaos, with the explosion's impact on the surrounding area left to the viewer's imagination."
image_2_1.jpg,Iran's Supreme Leader Ayatollah Ali Khamenei speaks during a meeting in Tehran Iran October 2 2024. Office of the Iranian Supreme Leader/WANA (West Asia News Agency)/Handout via REUTERS ATTENTION EDITORS - THIS PICTURE WAS PROVIDED BY A THIRD PARTY. WATERMARK FROM SOURCE.,Iran's Khamenei warned Nasrallah of Israeli plot to kill him sources say,https://www.usatoday.com/story/news/world/2024/10/02/iran-hezbollah-israel-nasrallah/75481452007/,"The image depicts a man sitting in a chair, speaking into a microphone. He appears to be an older individual with a beard and glasses. He is wearing a black turban and a black robe with white trim. The man is seated in front of a portrait of another man, who is also wearing a turban and glasses. The portrait is framed and stands on an easel. The background is blurred, but it suggests an indoor setting with a wall and a window. The man speaking is holding his hands together in front of him. There is no visible text in the image. The style of the image is a candid photograph, capturing a moment during a speech or presentation."
image_2_2.jpg,A student holds a poster with the faces of Hassan Nasrallah the assassinated chief of Lebanon's Hezbollah and Houthi leader Abdul-Malik al-Houthi during a rally in Sanaa Yemen October 2 2024. REUTERS/Khaled Abdullah  TPX IMAGES OF THE DAY,Iran's Khamenei warned Nasrallah of Israeli plot to kill him sources say,https://www.usatoday.com/story/news/world/2024/10/02/iran-hezbollah-israel-nasrallah/75481452007/,"The image shows a group of individuals, likely protesters, holding up posters with images of two men. The individuals are wearing black headscarves, which are commonly associated with Islamic attire, and they appear to be dressed in a manner that suggests a cultural or religious context. The posters feature images of men with beards, and the text on the posters is in Arabic, indicating that the content is likely related to a Middle Eastern context or a specific cultural or political issue. The style of the image is a candid photograph, capturing a moment during a protest or demonstration. The focus is on the individuals and their actions, rather than on the background or setting."
image_2_3.jpg,Supporters of Lebanon's Hezbollah leader Sayyed Hassan Nasrallah carry his pictures as they gather in Sidon following his killing in an Israeli airstrike in Beirut's southern suburbs on Friday Lebanon September 28 2024.,Iran's Khamenei warned Nasrallah of Israeli plot to kill him sources say,https://www.usatoday.com/story/news/world/2024/10/02/iran-hezbollah-israel-nasrallah/75481452007/,"The image depicts a group of individuals holding up posters of a man's face. The man appears to be a religious figure, possibly a cleric, given the context of the image. The posters are held up in a way that suggests a demonstration or protest, with the individuals standing close together, creating a sense of unity and shared purpose. The man on the posters has a beard and glasses, and his expression is neutral. The background is dark, which puts the focus on the posters and the people holding them. The image conveys a serious and solemn atmosphere, likely due to the nature of the event being depicted."
image_3_1.jpg,An Iranian missile system is displayed next to a banner with a picture of Iran's Supreme Leader Ayatollah Ali Khamenei and the late Hezbollah leader Hassan Nasrallah in a street in Tehran on Oct. 2 2024.,Israel plans 'significant' and swift response to Iran missile attack,https://www.usatoday.com/story/news/world/2024/10/02/israel-iran-missile-attack/75480214007/,"The image depicts a cityscape with a prominent feature that appears to be a large billboard or advertisement. The billboard is mounted on a metal scaffolding structure, which is elevated above the surrounding buildings. The billboard itself is divided into two sections. The upper section features a flag with horizontal stripes in red, white, and green, suggesting a representation of a national flag. The lower section of the billboard displays an image of a man dressed in traditional attire, which includes a turban and a robe, indicating a cultural or historical significance.  In the background, there are buildings of various sizes, and the sky is clear with a few clouds, indicating fair weather. The style of the image is a standard, real-world photograph with no apparent filters or artistic effects applied. The focus is on the billboard and its contents, with the cityscape serving as context for the location."
image_4_1.jpg,Iran launched missiles towards central Israel and Tel Aviv on Tuesday.,'Iran made a big mistake': Israel promises revenge after missile attack,https://www.usatoday.com/story/news/world/2024/10/02/israel-iran-missile-attack-what-happens-next/75478676007/,"The image depicts a nighttime scene with a focus on a bright light source in the sky. The light appears to be a flare or a burst of light, possibly from a rocket launch or a meteor. The sky is dark, suggesting it is late at night or early in the morning. The light is surrounded by a cloud of smoke or vapor, which is illuminated by the light, creating a dramatic effect. The light itself is bright and intense, with a visible glow that suggests a significant energy release. The image is taken from a low angle, which emphasizes the height of the light source and the vastness of the sky. There are no visible texts or distinctive landmarks in the image. The style of the image is a photograph with a focus on capturing the dynamic and powerful moment of the light source in the sky."
image_5_1.jpg,FILE PHOTO: The Wall Street entrance to the New York Stock Exchange (NYSE) is seen in New York City U.S. November 15 2022. REUTERS/Brendan McDermid/File Photo,US stocks drop oil climbs over Iran strike amid escalating Mideast tensions,https://www.usatoday.com/story/money/2024/10/01/sp-500-stock-market-reaction-iran-strike-israel/75469563007/,"The image shows a close-up view of a building facade with a focus on two street signs. The upper sign reads ""STOCK EXCHANGE"" in large, capitalized letters, suggesting the location is near a stock exchange. The lower sign is partially visible and appears to be a street sign with the text ""WALL ST"" which is an abbreviation for Wall Street, a famous financial district in New York City. The building itself has a textured, marble-like appearance, and the signs are mounted on a horizontal surface that could be a ledge or a part of the building's architecture. The style of the image is a real-life photograph with a focus on the text, likely taken to convey the location or context of the area."
image_6_1.jpg,Supporters of Lebanon's Hezbollah leader Sayyed Hassan Nasrallah carry his pictures as they gather in Sidon following his killing in an Israeli airstrike in Beirut's southern suburbs on Friday Lebanon September 28 2024.,President Biden says Hassan Nasrallah's death 'measure of justice' for the victims,https://www.usatoday.com/story/news/politics/elections/2024/09/28/hezbollah-israel-biden-hamas/75429710007/,"The image depicts a group of individuals holding up posters of a man's face. The man appears to be a religious figure, possibly a cleric, given the context of the image. The posters are held up in a way that suggests a demonstration or protest, with the individuals standing close together, creating a sense of unity and shared purpose. The man on the posters has a beard and glasses, and his expression is neutral. The background is dark, which puts the focus on the posters and the people holding them. The image conveys a serious and solemn atmosphere, likely due to the nature of the event being depicted."
image_7_1.jpg,Hezbollah leader Sayyed Hassan Nasrallah gives a televised address Lebanon September 19 2024 in this screenshot taken from a video.,Hezbollah leader Nasrallah dies in Israeli strike upending region,https://www.usatoday.com/story/news/world/2024/09/28/nasrallah-hezbollah-killed-israel/75418814007/,"The image shows a man with a beard and glasses, wearing a black turban and robe, which suggests he may be a religious figure, possibly a scholar or a cleric. He is seated and appears to be speaking or gesturing with his right hand raised. The background is a solid red color, which is often associated with religious or spiritual contexts. There is Arabic text on the image, which indicates that the content is likely related to Islamic culture or religion. The style of the image is a portrait with a focus on the individual, and it seems to be a still from a video or a photograph intended for educational or informative purposes."
image_7_2.jpg,An image of Hezbollah leader Hassan Nasrallah is seen during the funeral of a Hezbollah member in Kfar Melki Lebanon on Sept. 19 2024 after handheld pagers and walkie-talkies detonated.,Hezbollah leader Nasrallah dies in Israeli strike upending region,https://www.usatoday.com/story/news/world/2024/09/28/nasrallah-hezbollah-killed-israel/75418814007/,"The image depicts a group of individuals, predominantly women, dressed in black burkas, gathered outdoors. They appear to be part of a protest or demonstration, as suggested by the presence of a large portrait of a man with a beard and glasses, which is a common feature in political protests. The portrait is held up by some of the protesters, and the man in the portrait is likely a figure of significance, possibly a political leader or religious figure.  The protesters are standing behind a row of columns, which could be part of a building or a fence, and there are flags visible in the background, one of which has a yellow color and a design that is not immediately recognizable. The setting appears to be an urban environment, with buildings and trees in the background. The sky is overcast, suggesting an overcast day.  The attire of the protesters, including the burkas, suggests a cultural or religious context, possibly related to Islamic practices. The presence of the portrait and the flags indicate a political or religious gathering, but without more context, it's difficult to determine the specific nature of the event or the identity of the man in the portrait. The image captures a moment of collective expression and solidarity among the group."
image_8_1.jpg,The Dome of the Rock on the Al-Aqsa compound also known to Jews as the Temple Mount is seen as projectiles fly through the sky after Iran fired a salvo of ballistic missiles at Israel as seen from Jerusalem on Oct. 1 2024.,Iran launches missile attack on Israel,https://www.usatoday.com/picture-gallery/news/world/israel-hamas/2024/10/01/iran-launches-missile-attack-on-israel/75469778007/,"The image depicts a nighttime cityscape with a prominent dome structure illuminated in the center. The dome is likely a significant landmark, possibly a mosque or a church, given its distinct shape and the way it stands out against the night sky. The city is densely populated with buildings, some of which are also lit up, creating a pattern of lights against the dark backdrop. The sky is dark, suggesting it is late at night, and there are no visible clouds. The overall atmosphere is serene and quiet, typical of a city that has settled down for the night. The image is taken from a high vantage point, providing a bird's-eye view of the city and its illuminated features."
image_8_2.jpg,Delegates watch television news coverage of Iranian missiles being launched into Israel as they attend the Conservative Party Conference at Birmingham ICC on Oct. 1 2024 in Birmingham England.,Iran launches missile attack on Israel,https://www.usatoday.com/picture-gallery/news/world/israel-hamas/2024/10/01/iran-launches-missile-attack-on-israel/75469778007/,"The image depicts a group of people in what appears to be a conference or exhibition setting. There are three individuals visible in the frame, two men and one woman, all facing towards a large screen displaying a news broadcast. The screen is showing a map with a cityscape, overlaid with a red banner that reads ""IRAN LAUNCHES MISSILES INTO ISRAEL."" Below the map, there is additional text that says ""IRAN LAUNCHES MISSILES INTO ISRAEL"" and ""IRAN LAUNCHES MISSILES INTO ISRAEL.""  The people are dressed in business attire, with one man wearing a dark suit and tie, another in a light-colored suit, and the woman in a patterned blouse. They seem to be engaged in watching the news broadcast, possibly discussing or reacting to the content displayed.  The background features a colorful graphic design with red, white, and blue stripes, which could be part of a booth or display within the event. The lighting is bright, and the overall atmosphere suggests a professional or corporate environment."
image_8_3.jpg,Projectile flies in the sky over Jordan after Iran fired a salvo of ballistic missiles at Israel as seen from Amman Jordan on Oct. 1 2024.,Iran launches missile attack on Israel,https://www.usatoday.com/picture-gallery/news/world/israel-hamas/2024/10/01/iran-launches-missile-attack-on-israel/75469778007/,"The image depicts a nighttime scene of a cityscape under a dark sky. The city is illuminated by streetlights and building lights, creating a contrast against the night sky. In the foreground, there is a building with a flat roof, partially visible on the left side of the frame. The architecture suggests a modern or contemporary style.  In the background, there are multiple buildings of varying heights, with some appearing to be residential and others possibly commercial. The buildings are lit up with a mix of warm and cool lighting, contributing to the urban atmosphere.  In the sky, there is a bright object that resembles a shooting star or a small meteor, streaking across the sky from the left to the right. This adds a dynamic element to the scene, suggesting that the photo was taken during a meteor shower or a similar astronomical event.  The overall composition of the image suggests a quiet, late-night moment in an urban environment, with the city's lights and the celestial event creating a sense of wonder and tranquility."
image_8_4.jpg,A person shows the Tzofar incoming rocket alert app on their phone on Oct. 1 2024 in Tel Aviv Israel. The United States has stated that it has intelligence that Iran is preparing to launch an imminent ballistic missile attack on Israel following the IDF incursion into Lebanon and the recent killings of senior political figures. On Oct. 7 2023 members of Hamas mounted a series of attacks and raids on Israeli citizens in the Gaza Envelope border area of Israel.,Iran launches missile attack on Israel,https://www.usatoday.com/picture-gallery/news/world/israel-hamas/2024/10/01/iran-launches-missile-attack-on-israel/75469778007/,"The image shows a person's hand holding a smartphone with a map application displayed on the screen. The map is centered on a region with a dense concentration of red dots, which likely represent locations or points of interest. The map includes labels such as ""Central Nogey South,"" ""Bik'a,"" ""Judea,"" ""Menashe,"" ""Wadi Ara,"" and ""Samaria,"" suggesting that the map is focused on a specific geographic area, possibly in the Middle East. The smartphone is pink, and the screen is illuminated, indicating that it is turned on and in use. The background is blurred, drawing attention to the smartphone and the map."
image_8_5.jpg,Projectiles fly in the sky after Iran fired a salvo of ballistic missiles at Israel amid ongoing hostilities between Hezbollah and Israeli forces as seen from Tyre southern Lebanon on Oct. 1 2024.,Iran launches missile attack on Israel,https://www.usatoday.com/picture-gallery/news/world/israel-hamas/2024/10/01/iran-launches-missile-attack-on-israel/75469778007/,"The image depicts a nighttime scene with a dark sky filled with clouds. The clouds are illuminated by the glow of the moon and the light of distant stars, creating a dramatic and somewhat ethereal atmosphere. The sky is dotted with a few shooting stars, their paths marked by trails of light against the dark backdrop. Below the sky, a landscape unfolds with a series of lights that represent a city or town. The lights are scattered across the lower portion of the image, suggesting a dense urban area. The overall tone of the image is dark and moody, with the contrast between the illuminated sky and the lit-up landscape creating a sense of depth and perspective."
image_8_6.jpg,Tracers from firearms fired into the air in celebration for Iran's missiles barrage on Israel are seen over Beirut Lebanon on Oct. 1 2024.,Iran launches missile attack on Israel,https://www.usatoday.com/picture-gallery/news/world/israel-hamas/2024/10/01/iran-launches-missile-attack-on-israel/75469778007/,"The image depicts a nighttime cityscape with a dense cluster of buildings illuminated by various lights. The architecture suggests a mix of residential and commercial structures, with some buildings showing balconies and others featuring windows. The city appears to be in a region with a tropical or subtropical climate, as indicated by the dark, cloudy sky that suggests a humid environment. The photo is taken from a high vantage point, providing a panoramic view of the city's layout and the distribution of light sources. The lighting creates a contrast between the illuminated buildings and the darker sky, emphasizing the urban landscape."
image_8_7.jpg,A flare burns in the sky after Iran fired a salvo of ballistic missiles at Israel amid ongoing hostilities between Hezbollah and Israeli forces as seen from Tyre southern Lebanon on Oct. 1 2024.,Iran launches missile attack on Israel,https://www.usatoday.com/picture-gallery/news/world/israel-hamas/2024/10/01/iran-launches-missile-attack-on-israel/75469778007/,"The image depicts a night scene with a bright light source in the sky, which appears to be a rocket or a shooting star. The light is intense and stands out against the dark sky. Below the light, there is a landscape that includes a collection of buildings, possibly a town or a small city, with their lights on. The buildings are silhouetted against the sky, and the lights create a pattern of illumination against the dark backdrop. The overall atmosphere of the image is one of tranquility and the beauty of the night sky."
image_8_8.jpg,Rockets fly in the sky amid cross-border hostilities between Hezbollah and Israel as seen from Tel Aviv Israel on Oct. 1 2024.,Iran launches missile attack on Israel,https://www.usatoday.com/picture-gallery/news/world/israel-hamas/2024/10/01/iran-launches-missile-attack-on-israel/75469778007/," The image depicts a nighttime scene with a dark sky, illuminated by the bright lights of multiple rockets. The rockets are arranged in a line, with the first one appearing larger and closer to the viewer, and the others receding into the distance. Each rocket emits a trail of light, suggesting a long exposure or a time-lapse effect. The trails of light from the rockets create a sense of motion and direction, as if they are moving towards the horizon. The image is devoid of any text or additional context, focusing solely on the visual spectacle of the rocket launch. The style of the image is reminiscent of a space-themed photograph, capturing the drama and excitement of a rocket launch."
image_8_9.jpg,A man holds children as people take cover during an air raid siren amid cross-border hostilities between Hezbollah and Israel in central Israel on Oct. 1 2024.,Iran launches missile attack on Israel,https://www.usatoday.com/picture-gallery/news/world/israel-hamas/2024/10/01/iran-launches-missile-attack-on-israel/75469778007/,"The image depicts a nighttime scene with a group of people standing on a sidewalk. The individuals appear to be engaged in a casual gathering, with some holding hands or standing close to each other. The lighting is dim, with streetlights illuminating the area and casting shadows on the ground. The background features a concrete wall with a rough texture, and there are multiple cars parked along the street. The overall atmosphere suggests a relaxed, informal gathering in an urban setting."
image_8_10.jpg,People take shelter during an air raid siren amid cross-border hostilities between Hezbollah and Israel in central Israel on Oct. 1 2024.,Iran launches missile attack on Israel,https://www.usatoday.com/picture-gallery/news/world/israel-hamas/2024/10/01/iran-launches-missile-attack-on-israel/75469778007/,"The image depicts a group of people in what appears to be a tunnel or underground space. The setting is dimly lit, with artificial lighting visible on the ceiling. The walls are concrete, and there are visible signs of wear and age, such as discoloration and some peeling paint.  In the foreground, there is a man standing with his back to the camera, wearing a green military-style uniform with a helmet. He has a beard and appears to be older. He is looking off to the side, away from the camera.  Behind him, there is a group of individuals who seem to be in various states of motion and rest. Some are sitting on the ground, while others are standing. The group is diverse, with individuals of different ages and genders. They are dressed in a variety of clothing styles, including casual and semi-formal attire.  The overall atmosphere of the image is somber and serious, with the individuals appearing to be in a state of contemplation or waiting. There are no visible texts or distinctive landmarks that provide context about the location or the identities of the individuals. The image has a candid, unposed quality to it, capturing a moment that seems unguarded and authentic."
image_8_11.jpg,People take shelter during an air raid siren amid cross-border hostilities between Hezbollah and Israel in central Israel on Oct. 1 2024.,Iran launches missile attack on Israel,https://www.usatoday.com/picture-gallery/news/world/israel-hamas/2024/10/01/iran-launches-missile-attack-on-israel/75469778007/,"The image depicts three individuals standing in front of a concrete wall with a textured surface. The person on the left appears to be an adult male with white hair, wearing a light-colored shirt. He is holding the shoulder of the person in the middle, who is a young girl with dark hair, wearing a dark top. The girl is looking directly at the camera with a neutral expression. The person on the right is a young male with dark hair, wearing a light-colored shirt, and he is looking slightly to the side with a neutral expression. The lighting in the scene is dim, and there are shadows cast on the wall, suggesting an indoor setting with artificial lighting. There are no visible texts or distinctive brands in the image. The style of the image is a candid photograph with a focus on the subjects rather than the background."
image_8_12.jpg,Israel's Iron Dome anti-missile system intercepts rockets as seen from Ashkelon Israel on Oct. 1 2024.,Iran launches missile attack on Israel,https://www.usatoday.com/picture-gallery/news/world/israel-hamas/2024/10/01/iran-launches-missile-attack-on-israel/75469778007/,"The image depicts a nighttime cityscape with a dense cluster of buildings illuminated by streetlights and building lights. The buildings vary in height and design, suggesting a mix of residential and commercial structures. The sky is dark, indicating it is night, and is filled with clouds that are illuminated by the city lights, creating a dramatic effect. There are streaks of light in the sky, which could be interpreted as trails from shooting stars or possibly the movement of vehicles or aircraft. The overall atmosphere is one of urban nightlife, with the city's lights standing out against the dark sky."
