image number,alt,article_heading,description
image_1_1.jpg,,Brazil Central Bank Lifts 2024 Economic Growth Forecast for Third Time,"The image depicts a narrow city street, likely in an urban area, with tall buildings on both sides. The architecture suggests a European city, possibly in a region with historical significance, such as Italy or Spain. The buildings are constructed with a mix of materials, including what appears to be stone and brick, and feature ornate details, such as arches and balconies, which are common in European architecture.  The street is lined with buildings that rise high above the street level, creating a canyon-like effect. The buildings are closely packed, with little open space visible between them. The sky is overcast, suggesting an overcast or cloudy day. There are no visible people or moving vehicles in the image, which gives it a quiet, almost deserted atmosphere.  The lighting in the image is soft and diffused, with no harsh shadows, which could indicate that the photo was taken during the day with overcast skies. The colors are muted, with a predominance of earth tones and grays, which adds to the timeless and classic feel of the scene. The image does not contain any text or distinctive branding that would provide additional context or location information. The style of the image is realistic and appears to be a photograph rather than a painting or illustration."
image_1_2.jpg,,Brazil Central Bank Lifts 2024 Economic Growth Forecast for Third Time,"The image is a line graph with a black background and white text, illustrating the growth of the Brazilian economy over a period from January 2020 to September 2021. The graph shows a sharp increase in the year-on-year GDP estimate, which is the percentage change in the Gross Domestic Product from one year to the next. The line graph is labeled ""Brazil Analysts See Stronger Growth Ahead,"" indicating that the Brazilian economy is expected to grow significantly in the near future. The source of the data is cited as the Brazilian central bank. The graph is sourced from Bloomberg, a financial news and media company."
image_2_1.jpg,Cover image,Fed Exploring Tying Liquidity to Uninsured Deposits Barr Says,"The image depicts a man sitting at a table, appearing to be in a formal setting, possibly a legislative assembly or a courtroom. He is wearing a dark suit with a tie, suggesting a professional attire. The man is gesturing with his right hand, pointing upwards and slightly to the left, which could indicate he is explaining a point or making a reference to something above him. His facial expression is serious, and he seems to be engaged in a discussion or presentation. The background is blurred, but it appears to be an indoor setting with a wooden panel, which might be part of a legislative chamber or a courtroom. There are no visible texts or logos in the image."
image_3_1.jpg,,Yellen says economy on 'soft landing' path Fed's policy rate will fall to neutral level,"The image depicts a political event where two individuals are standing at a podium with microphones. The person on the left appears to be an older male with white hair, wearing a dark suit and a light blue tie. He is looking down and seems to be engaged in a conversation or listening to the other person. The person on the right appears to be a younger female with dark hair, wearing a light-colored blazer and a dark top. She is smiling and looking at the older male, suggesting a friendly or positive interaction between them.  In the background, there are other individuals who appear to be spectators or supporters, some of whom are holding signs. The signs include political messages, such as ""Lowering Drug Costs"" and ""Lowering Prescription Drug Costs,"" indicating that the event may be related to healthcare policy or a political campaign. The podium has the presidential seal on it, which is a symbol of the President of the United States, further suggesting that this is a political event involving the President or a presidential candidate.  The setting appears to be indoors, possibly at a political rally or press conference, given the presence of the podium, microphones, and the audience. The overall atmosphere seems to be one of a formal political event with a focus on healthcare policy."
image_4_1.jpg,Cover image,Fed's discount window can be normal funding source for banks Barr says,"The image depicts a man sitting at a desk, appearing to be in a formal setting, possibly a legislative or governmental chamber. He is wearing a dark suit with a striped tie and has a name tag that reads ""The Honorable Michael S. Barr."" The man is gesturing with his hands, which are open and slightly raised, suggesting he is in the middle of speaking or explaining something. His expression is serious, and he seems to be engaged in a discussion or presentation. The background is blurred, but it appears to be an indoor setting with other individuals, indicating that this could be a public or professional environment."
image_5_1.jpg,Cover image,Wells Fargo Sends Fed a Crucial Review for Lifting Asset Cap,"The image depicts a city street scene with two individuals walking in front of a Wells Fargo building. The building has a prominent sign with the Wells Fargo logo and the address ""535"" visible. The facade of the building is made of red brick, and there is a large window with a red awning that displays the Wells Fargo logo and the slogan ""Where goals meet progress."" To the right of the window, there is an advertisement for a mobile app called ""Try Lifesync."" The individuals are casually dressed, with one wearing a dark suit and the other in a white shirt and dark shorts. The person in the suit is looking down at their phone, while the other person is looking ahead. The street appears to be a typical urban environment with a sidewalk and a clear sky."
image_6_1.jpg,Cover image,Wells Fargo sends Fed crucial review for lifting asset cap Bloomberg News reports,"The image depicts a street scene with a focus on a Wells Fargo bank branch. The building is a modern structure with a combination of dark and light-colored facades. The Wells Fargo logo is prominently displayed in large, illuminated letters above the entrance, which is framed by a red and white striped awning. The bank's signage is also visible on the exterior walls, with the Wells Fargo logo repeated in a smaller size. The street in front of the bank is lined with a red curb, indicating a no-parking zone. There are no visible people or moving vehicles in the immediate vicinity of the bank. The image is taken during the day, and the lighting suggests it might be early evening or dusk."
image_7_1.jpg,Cover image,NY Fed’s Williams Announces New Body to Monitor Reference Rates," The image shows a man in a professional setting, likely a conference or a formal event. He is wearing glasses with a dark frame and a suit with a tie. The man appears to be middle-aged, with graying hair and a serious expression. He is looking slightly to the side, not directly at the camera, which gives him a thoughtful or contemplative demeanor. The background is a solid blue color, which suggests that the setting might be indoors with a blue curtain or backdrop, common in conference rooms or stages. There are no visible texts or logos in the image. The style of the image is a standard portrait photograph, likely taken at an event or conference."
image_8_1.jpg,,Oil Extends Sharp Drop on Prospect of More Saudi Libyan Supply,"The image shows three men standing close to each other, likely at a social event. The man in the center is older and appears to be the focus of the photo. He is wearing a dark suit with a tie that has a pattern of small red dots. The man on the left is wearing a dark jacket and has short, dark hair. The man on the right is wearing a light-colored shirt with a pattern that resembles a grid or checkered design. All three men are looking directly at the camera with neutral expressions. The background is dimly lit, suggesting an indoor setting with warm lighting, possibly a restaurant or a similar venue. There are no visible texts or distinctive brands in the image."
image_9_1.jpg,Cover image,Fed's Bowman says discount window use is for emergencies,"The image depicts a woman seated on a white chair, engaged in what appears to be a public speaking event or panel discussion. She is dressed in a professional attire, consisting of a dark blazer, a light-colored blouse, and high-heeled shoes. Her hair is styled in a bob cut, and she is wearing a watch on her left wrist. The woman is gesturing with her hands, suggesting she is in the middle of a conversation or presentation.  The background features a blue backdrop with the American Bankers Association logo prominently displayed, indicating the event is likely related to the banking industry. The logo consists of the letters ""ABA"" in white, with a stylized design that includes a swoosh and a checkmark. The woman's position and the logo suggest that she is a speaker or panelist at this event. The lighting is even, and the setting appears to be indoors, possibly in a conference room or similar venue."
image_10_1.jpg,Cover image,Fed's Williams announces new effort to study reference rates,"The image shows a man from the chest up, appearing to be in a professional setting. He is wearing a dark suit with a light blue shirt and a tie that is not fully visible. The man has glasses with a blue frame and a patterned design on the temples. His expression is serious, and he seems to be engaged in a conversation or presentation. The background is neutral and does not provide any specific details about the location. The style of the image is a standard, candid photograph without any artistic filters or effects."
