image number,alt,article_heading,description
image_7_7.jpg,Front page of the Sunday Times ,PM's call for calm and 'private school VAT delay',"The image you've provided appears to be a screenshot of a newspaper's front page. The newspaper is titled ""The Sunday Times,"" and the date on the top left corner is ""Sunday, October 6, 2013."" The headline at the top reads ""Why are vet bills so expensive?"" with a subheading ""Magazine"" below it.  The main feature on the front page is a large photograph of a woman with white hair, wearing a brown coat. She is looking directly at the camera with a serious expression. Below the photograph, there is a headline that reads ""PM: Year of war has spread 'vile hatred' in UK,"" with a subheading ""My years for Maggie"" below it. This headline suggests a political commentary related to the Prime Minister's statement about the current state of the nation.  There is also a smaller headline that reads ""Honeytrap politician was agent for Kremlin,"" which seems to be a political or investigative report. Below this headline, there is a section titled ""Strengthening stripped breast cancer surgeon of his £1m pension,"" which is likely a feature article about a surgeon and his pension.  The bottom of the page features advertisements, including one for Guinness and another for a performance app. The overall style of the image is typical of a newspaper layout, with a mix of text and images designed to attract readers' attention to various stories and advertisements."
image_7_8.jpg,Front page of the Sunday Express,PM's call for calm and 'private school VAT delay',"The image you've provided appears to be a screenshot of a newspaper front page. The headline at the top reads ""FALKLANDS: TROOPS ON RED ALERT!"" in bold, black letters. Below the headline, there is a large photograph of a woman with blonde hair, wearing a dark blue outfit with a white collar. She is looking directly at the camera with a serious expression.  To the right of the photograph, there is a smaller image of a man with dark hair, wearing a dark shirt. He is looking off to the side with a serious expression.  The newspaper also features several advertisements and teasers for articles. One ad on the left side of the page promotes a free magazine inside, while another ad on the right side advertises an interview with Rick Astley. There are also teasers for articles about Queen Elizabeth II and an Express campaign.  The layout of the page includes columns with text, images, and advertisements, typical of a newspaper design. The overall style of the image suggests it is a digital representation of a printed newspaper, possibly from the UK, given the style of the headlines and the content of the articles."
image_7_9.jpg,News Daily banner,PM's call for calm and 'private school VAT delay',"The image appears to be a graphic design or digital illustration with a white background and a red horizontal stripe at the bottom. On the left side of the image, there is text that reads ""News Daily"" in a bold, sans-serif font. Below this, there is a smaller text that says ""The latest news straight to your inbox,"" suggesting that the image is likely an advertisement or promotional graphic for a news service that delivers updates via email.  On the right side of the image, there is an abstract representation of a microphone. The microphone is depicted in a stylized manner with a smooth, curved design that transitions from a solid red color at the bottom to a gradient of orange and yellow at the top, giving it a warm and vibrant appearance. The microphone's shape is somewhat distorted, with a bulbous base and a narrow, elongated top that tapers to a point. The design is simple and modern, with no intricate details or textures, which is common in contemporary graphic design. The overall style of the image is clean and minimalistic, with a clear focus on the text and the abstract representation of the microphone."
image_8_1.jpg,A view of St Mary's House a town house building slightly obstructed by a tall green hedge on a sunny day.,Human remains found under sheltered housing patio,"The image depicts a two-story residential building with a traditional architectural style. The building has a symmetrical facade with a central entrance flanked by two windows on the first floor. Above the entrance, there is a small balcony with a white railing. The second floor features three windows, each with a white frame and a small, arched window above the central entrance. The building's exterior walls are made of a light-colored material, possibly brick or stucco, and the roof appears to be tiled.  In front of the building, there is a well-maintained hedge that runs along the length of the property, providing a sense of privacy and a manicured appearance. To the right of the building, there is a smaller structure with a similar design, featuring a single window and a door. This structure is also made of the same light-colored material as the main building.  In the foreground, there is a car parked on the street, partially visible in the frame. The sky is partly cloudy, suggesting a fair weather condition. There is no visible text or distinctive branding in the image. The style of the image is a standard, color photograph with no filters or artistic effects applied."
image_9_1.jpg,A line of police officers stands between pro-Palestinian protesters and counter-protesters ,Thousands take part in pro-Palestinian march,"The image depicts a large gathering of people in what appears to be a city street, possibly during a protest or demonstration. The crowd is dense, with individuals of various ages and attire, some of whom are holding up flags and banners. The flags include those of Israel, the United Kingdom, and the United States, among others, suggesting a diverse group of participants. The architecture in the background is a large, ornate building with a classic design, which could be a government or institutional building. The sky is overcast, and the lighting suggests it might be daytime. The overall atmosphere is one of a public event with a significant turnout."
image_9_2.jpg,Protesters in central London chant during a pro-Palestinian demonstration - one woman has her fist raised in the air ,Thousands take part in pro-Palestinian march,"The image depicts a group of people gathered in what appears to be a protest or demonstration. The individuals are of various ages and genders, and they are dressed in a mix of casual and more formal attire. Some are holding up flags or banners, which are not clearly visible in the image. The expressions on their faces are intense, with some looking angry or determined, and others appearing more calm or resigned. The setting suggests an urban environment, possibly in a city center or a public square. The image is a photograph with a focus on capturing the emotion and atmosphere of the event."
image_9_3.jpg,Pro-Palestinian march stretches from Trafalgar Square to Whitehall,Thousands take part in pro-Palestinian march,"The image depicts a large gathering of people in a city street, which appears to be a protest or demonstration. The crowd is dense, with individuals of various ages and attire, suggesting a diverse group of participants. Many of the protesters are holding flags, with the Palestinian flag being particularly prominent, indicating a focus on Palestinian rights or issues. There are also signs with slogans and messages, some of which are not fully legible due to the density of the crowd and the angle of the photograph.  The setting is an urban environment with buildings on either side of the street, and the architecture suggests a European city, possibly London, given the presence of Big Ben in the background. The sky is overcast, and the lighting suggests it is either dawn or dusk, which adds to the atmosphere of the scene.  The street is lined with traffic lights, and the protesters are standing behind a line of traffic lights, which is a common practice in many cities to control traffic during large gatherings. The overall mood of the image is one of peaceful assembly and political expression."
image_10_1.jpg,Jacques Billant speaks into a microphone as a man looks on from behind him,Four migrants including boy die in Channel,"The image shows two men in a professional setting, likely an office or conference room. The man in the foreground is wearing glasses and a dark suit with a tie. He appears to be speaking or gesturing, as suggested by the slight opening of his mouth and the positioning of his hands. The man in the background is wearing a dark suit with a blue tie and glasses, and he seems to be listening or observing the other man. Both men are indoors, and there are no visible texts or distinctive logos in the image. The style of the image is a candid photograph, capturing a moment in a professional environment."
image_10_2.jpg,A line graph showing the total number of people crossing the English Channel in boats from 2020 to 2024. It shows 2022 between 40000 and 50000 people then 2023 nearly reaching 30000 people and 2021 just below that then 2020 just below 10000 people. A line showing 2024 has a figure of 25639 people written next to it.,Four migrants including boy die in Channel,"The image is a line graph titled ""People crossing the English Channel in boats."" It illustrates the cumulative total of people detected by year, with a focus on the period from January to November. The graph shows a significant increase in the number of people detected, starting from zero in January and reaching a peak of over 40,000 by the end of November. The data is sourced from the Home Office/Ministry of Defence, with the latest data available as of 4 October. The graph is color-coded to distinguish between different years, with each year represented by a different color. The graph also includes a note at the bottom explaining that the data to 30 June 2024 is monthly totals, with more recent figures being daily totals."
