image number,alt,article_heading,description
image_1_1.jpg,Lord O'Donnell,Ex-cabinet secretary says Â£200000 job is underpaid,"The image shows a man sitting in front of a television screen. He appears to be middle-aged, with short, graying hair and a fair complexion. The man is wearing a light blue suit jacket over a patterned shirt. He is looking slightly to his right with a thoughtful or contemplative expression on his face. The background of the television screen features a cityscape at night, with buildings illuminated in shades of purple and blue, suggesting a city skyline. The lighting on the man's face is soft, with a focus on his upper body and face, which gives the image a professional or news broadcast feel. There are no visible texts or logos in the image."
image_2_1.jpg,Christian O'Reilly smiling at the camera ,Jail offered way out of crime says ex-drug dealer,"The image shows a man posing for a portrait. He has a beard and mustache, and his hair is styled upwards. He is wearing a beige blazer over a white turtleneck. The background is dark with blue and red lighting, creating a dramatic effect. The man is smiling and looking directly at the camera."
image_2_2.jpg,A couple standing in a field before a castle,Jail offered way out of crime says ex-drug dealer,"The image depicts a romantic scene with two individuals standing close to each other, seemingly in a moment of affection. The person on the left appears to be a woman, dressed in a traditional Scottish outfit with a red and white pattern, and the person on the right appears to be a man, wearing a green jacket and a kilt. They are positioned in front of a tree with bare branches, suggesting it might be autumn or winter. The reflection of the couple and the tree is visible in a body of water, which could be a lake or a calm river, adding a serene quality to the scene.  In the background, there is a castle with a prominent tower and battlements, which could be a historical or tourist attraction. The sky is painted with soft hues of orange and pink, indicating either sunrise or sunset, which adds a warm and tranquil atmosphere to the image. The lighting and composition of the photograph suggest it might be a staged scene, possibly for a photoshoot or a film, designed to evoke a sense of timelessness and romance."
image_2_3.jpg,Christian O'Reilly holding a camera,Jail offered way out of crime says ex-drug dealer,"The image depicts a man standing in a field with tall grass. He is wearing a blue blazer over a blue shirt, paired with dark pants. The man has a beard and is wearing sunglasses. In his hands, he holds a camera, suggesting he might be a photographer or interested in photography. The background is blurred, but it appears to be a natural setting with trees and foliage, possibly indicating a park or a rural area. The lighting suggests it might be late afternoon or early evening, given the soft shadows and the warm tones of the scene."
image_3_1.jpg,An aerial image of police searching at the farm. There are a number of outbuildings and a large lawn with a path through the middle.,Family want to buy farm to dig for body,"The image depicts an aerial view of a rural area with a focus on a large, dilapidated black barn with a rusted roof. The barn is situated in the center of the image, surrounded by a grassy area. There are several people in the vicinity of the barn, some of whom appear to be engaged in maintenance or repair work. The surrounding landscape includes other buildings, trees, and a fence. The image is taken during the day under clear skies."
image_3_2.jpg,Nizamodeen Hosein who is wearing a black shirt with abstract patterns on it.,Family want to buy farm to dig for body,"The image shows a man with a beard and mustache, wearing a colorful, patterned shirt. He appears to be middle-aged or older, with visible signs of aging such as wrinkles and age spots. The man is looking directly at the camera with a slight smile, giving the impression of friendliness or approachability. The background is a simple, plain wall with a door to the left side, and there is a sign or document hanging on the wall above the door. The lighting in the room is soft and even, suggesting an indoor setting. The overall style of the image is candid and informal, possibly taken in a casual or home environment."
image_3_3.jpg,Muriel McKay wearing a hat smiling and holding a dog.,Family want to buy farm to dig for body,"The image is a black and white photograph of a woman wearing a wide-brimmed hat. She has a round face with prominent cheekbones and a wide smile. Her hair is styled in a bob cut, and she appears to be middle-aged. She is looking directly at the camera with a confident expression. The woman is wearing lipstick and has a visible earring. In the foreground, there is a dog, which appears to be a medium-sized breed, possibly a Labrador Retriever, based on its size and coat texture. The dog is looking up at the woman, and both are positioned in front of a blurred background that suggests an indoor setting. The style of the photograph suggests it could be from the mid-20th century."
image_4_1.jpg,A girl with blonde curly hair winks at the camera holding her graduation certificate and wearing black robes and a hat,Spiking victims 'let down' by emergency services,"The image depicts a young woman standing outdoors, smiling broadly. She is wearing a graduation cap and gown, which are traditional academic regalia. The cap is black with a tassel, and the gown appears to be a dark color, possibly black or dark blue. She is holding a diploma in her right hand, which is a document typically awarded to graduates. The diploma has text on it, but the specific details are not legible in the image. The woman has curly blonde hair and is wearing a necklace. She is standing in front of a body of water, which could be a sea or ocean, given the horizon line. In the background, there is a structure that resembles a pier or a bridge, and the sky is partly cloudy. The setting suggests a coastal location, possibly near a university campus. The overall atmosphere of the image is celebratory and joyful, capturing a moment of achievement for the graduate."
image_4_2.jpg,A girl with black curly hairs looks sad under stage lights,Spiking victims 'let down' by emergency services,"The image shows a woman with curly hair, looking to the side with a thoughtful or contemplative expression. She appears to be indoors, possibly in a venue with stage lighting, as suggested by the bright lights in the background. The lighting casts a warm glow on her face, highlighting her features. The woman is wearing a sleeveless top, and her hair is styled in loose curls. The background is dark, which makes the woman and the stage lights stand out prominently."
image_4_3.jpg,A woman wearing an orange hat and with colourful eye make-up smiles with the sun shining on her face,Spiking victims 'let down' by emergency services,"The image depicts a person wearing a vibrant orange baseball cap with a black visor, which is positioned to shield their eyes from the sun. The individual has long, blonde hair that cascades down their shoulders. They are wearing a pair of sunglasses with a reflective coating, which adds a touch of style to their look. The person has a nose piercing and is adorned with green eye makeup that accentuates their eyes. Their lips are painted with a glossy, pink lipstick that adds a pop of color to their face.  The person is outdoors, as indicated by the natural light illuminating their face and the clear blue sky visible in the background. There is a hint of a camping or outdoor event setting, suggested by the presence of a blue tent with a white stripe running along its side. The tent appears to be set up in a grassy area, which is typical for outdoor festivals or camping trips. The overall atmosphere of the image is cheerful and carefree, capturing a moment of enjoyment and relaxation."
image_5_1.jpg,Daniel Mason poses with his arm around his new wife Danielle Mason and his step-daughter inside the Old Marylebone Town Hall,We married for Â£100 with 99 other couples and wouldn't change a thing,"The image depicts a warm and intimate moment between a man and two women, likely a family. The man is positioned in the center, with one woman on his left and the other on his right. He is wearing a dark vest over a light-colored shirt, paired with a tie, suggesting a formal or semi-formal occasion. Both women are dressed in elegant attire; the woman on the left is wearing a white dress with lace details, and the woman on the right is in a dark dress with a patterned top and a bow at the waist.  All three individuals are smiling and appear to be in a celebratory mood, possibly at a wedding or a similar event, given the attire and the presence of what looks like a bouquet of flowers in the foreground. The background is softly lit, with a curtain that adds a touch of sophistication to the setting. The overall atmosphere is one of joy and familial connection."
image_5_2.jpg,Thomas and Paige Mackintosh stand on a Jubilee line platform at Baker street as a tube carriage whizzes by them on their wedding day.,We married for Â£100 with 99 other couples and wouldn't change a thing,"The image depicts a man and a woman standing on a subway platform. The man is wearing a dark suit with a tie, and the woman is dressed in a white wedding gown with a veil. They are both holding bouquets of flowers. The man is bald and is wearing a tie. The woman has blonde hair and is wearing a white dress. They are standing close to each other, and the man is looking at the woman. There is a train in the background, and the platform has a yellow line on it. The train is moving, and the platform appears to be underground."
image_5_3.jpg,iplayer logo,We married for Â£100 with 99 other couples and wouldn't change a thing,"The image you've provided appears to be a simple, flat design with a horizontal orientation. It features a horizontal band that is colored in a gradient of pink to white. The pink color is more concentrated at the top and gradually fades into white towards the bottom. The band is centered horizontally within the image and has a clean, straight edge. There are no texts, additional elements, or any other objects in the image. The style of the image is minimalistic and could be used for various purposes such as a background, a decorative element, or a simple design element in a larger composition."
image_5_4.jpg,People crowd and cheer on the steps of the old marlyebone town hall as thomas and paige mackintosh celebrate tying the knot on 1 October. Confetti can be seen on the floor while the group have their hands in the air cheering,We married for Â£100 with 99 other couples and wouldn't change a thing,"The image depicts a group of people gathered on a set of stairs in front of a building with classical architecture. The group appears to be a mix of men and women, and they are dressed in a variety of formal and semi-formal attire, suggesting a special occasion or event. Some individuals are holding umbrellas, which could indicate that the weather is rainy or that they are prepared for potential rain. The people are smiling and seem to be in a celebratory mood, with some raising their arms in the air in a gesture of joy or excitement. The building behind them has a grand facade with columns and a large entrance, which adds to the formal and celebratory atmosphere of the scene."
image_5_5.jpg,Iplayer logo,We married for Â£100 with 99 other couples and wouldn't change a thing,"The image appears to be a digital graphic or banner with a black background and a white horizontal line at the bottom. On the left side of the banner, there is text that reads ""Watch on"" in white capital letters. To the right of this text, there is a pink logo with the letters ""iPLAYER"" in white, stylized font. The logo consists of two overlapping squares, one pink and one white, with the letters ""iPLAYER"" in the center. Below the logo, there is a smaller text that reads ""BBC"" in white capital letters. The overall style of the image suggests it is related to a media streaming service, possibly associated with the BBC, and is designed to be viewed on a screen or as a digital advertisement."
image_5_6.jpg,Chris and Sam Jamieson-Green walk along the street. Sam is wearing a white wedding dress and has her arm around the back of her new husband Chris who is wearing a green and white chequered suit with a cardboard sign saying 'just married' on his back.,We married for Â£100 with 99 other couples and wouldn't change a thing,"The image depicts a street scene with a couple dressed in wedding attire. The man is wearing a suit with a green and white patterned shirt and a brown jacket, while the woman is dressed in a white dress with a lace overlay and blue heels. They are holding hands and walking together, with the man carrying a sign that reads ""JUST MARRIED."" The couple appears to be in a jovial mood, with the woman smiling and the man looking at her with a slight grin.  In the background, there are other individuals walking on the sidewalk, and the street is lined with parked cars. The architecture suggests an urban setting, possibly in a city center. The weather appears to be overcast, as the lighting is soft and there are no harsh shadows on the subjects. The overall atmosphere of the image is cheerful and celebratory, capturing a moment of joy for the newlyweds."
image_5_7.jpg,Filippa Evans-Grindrod and Harry Grindrod after getting married at Old Marylebone Town Hall,We married for Â£100 with 99 other couples and wouldn't change a thing,"The image depicts a group of four individuals, presumably at a formal event, possibly a wedding, given the attire and the setting. The group consists of two men and two women. The men are dressed in suits, with one wearing a dark suit and the other in a lighter-colored suit. Both men are smiling and appear to be in a jovial mood. The women are dressed in formal dresses; one is wearing a white dress with a floral pattern, and the other is in a blue dress with a similar floral pattern. Both women are also smiling and seem to be enjoying the occasion.  They are standing in front of a building with classical architecture, featuring a large arched doorway and a balcony with a railing. There are floral arrangements with pink and orange flowers to the left of the group, adding to the festive atmosphere. The ground appears to be wet, suggesting recent rain, and the lighting suggests it might be late afternoon or early evening. The overall mood of the image is cheerful and celebratory."
image_5_8.jpg,Daisy McKinley strokes dog Marvin who is clutched in the arms of Dan McKinley after the pair had just been married,We married for Â£100 with 99 other couples and wouldn't change a thing,"The image depicts a joyful moment between a man and a woman. The man is dressed in a black suit with a white shirt and a black bow tie, suggesting a formal occasion. He is smiling broadly and looking down at the woman, who is holding a small, brown dog. The dog appears to be wearing a plaid vest, adding a touch of whimsy to the scene.  The woman is dressed in a light-colored blouse with a pearl necklace, and she is also smiling at the man. She is holding the dog securely with one hand, while her other hand is gently touching the man's face, creating a sense of connection between them.  The background is softly lit, with a hint of greenery and what appears to be a floral arrangement, contributing to the warm and celebratory atmosphere of the moment. The overall impression is one of happiness and affection between the two individuals and their shared love for the dog."
image_6_1.jpg,Katie Smith stands in her home wearing a black shirt over a striped t-shirt. She has shoulder length dark blonde hair and a nose ring. ,'Rightmove is my porn' - the addiction to online property search,"The image shows a woman with long, wavy blonde hair. She has a gentle smile and is looking directly at the camera. Her eyes are a light blue color. She is wearing a black top with horizontal stripes and a white undershirt. The background is a simple, light-colored room with a mirror reflecting part of the room. There is a light fixture visible in the upper right corner of the image. The style of the image is a portrait, likely intended for personal or professional use."
image_6_2.jpg,Someone holding a phone showing a property portal site advertising a Â£360000 three bedroom semi-detached house for sale,'Rightmove is my porn' - the addiction to online property search,"The image shows a person's hand holding a smartphone displaying a real estate listing. The smartphone screen is visible and shows a photograph of a three-bedroom semi-detached house for sale. The house is located in Morris Lane, Leeds, West Yorkshire, and is priced at £360,000. The listing includes a brief description of the property and a button labeled ""Recommended,"" suggesting that the user can interact with the listing through the smartphone app. The background of the image is blurred, but it appears to be an outdoor setting with greenery, indicating that the photo may have been taken in a garden or park. The overall style of the image is a casual, real-life photograph capturing a moment of someone browsing real estate listings on their phone."
image_6_3.jpg,Sam Kennedy Christian wearing a white textured sleeveless top and linen trousers standing in front of a view of the sea in Herne Bay,'Rightmove is my porn' - the addiction to online property search,"The image depicts a woman standing in a field of tall, golden flowers. She is wearing a white blouse with horizontal stripes and a light-colored skirt. The woman has dark hair and is wearing glasses. She is smiling and looking directly at the camera. The background shows a clear sky and a body of water in the distance. There is a boat visible on the water. The overall setting appears to be a sunny day with good weather."
image_7_1.jpg,Front page of the Mail on Sunday,PM's call for calm and 'private school VAT delay',"The image you've provided appears to be a screenshot of a newspaper article from ""The Mail on Sunday."" The headline of the article reads ""Why it's all kicking off between Lineker and BBC,"" suggesting a controversy or conflict between Lineker and the BBC. The article seems to be discussing a specific issue or event involving Lineker and the BBC, possibly related to a news broadcast or a public statement.  The layout of the newspaper includes various elements typical of a print media publication. There are advertisements, such as one for cosmetics and another for a beauty advent calendar, indicating the commercial nature of the publication. The date of the issue is not visible in the image, but the presence of a QR code suggests that the newspaper is digitally interactive.  The text is too small to read in detail, but the overall design and layout suggest that it is a professional publication with a focus on current events and news. The style of the image is a digital representation of a physical newspaper, capturing the layout and design elements that are common in print media."
image_7_2.jpg,Front page of The Observer,PM's call for calm and 'private school VAT delay',"The image you've provided appears to be a cover page of a magazine or newspaper. The title of the publication is ""The Observer,"" which is a well-known British newspaper. The cover features a variety of articles and headlines, each with its own accompanying image or graphic.  At the top of the cover, there's a headline that reads ""Being a sex symbol? I'm thrilled,"" accompanied by an image of a man with a bald head and glasses, who seems to be the subject of the article. Below this, there's another headline that says ""Britain's healthiest walk,"" with an image of a person walking outdoors, suggesting an article about a healthy lifestyle or outdoor activity.  The central part of the cover features a headline that reads ""Doubts grow over Labour's VAT plan for private schools,"" with an image of a group of people, possibly students or parents, walking together, which might be related to the article about the Labour party's policy on Value Added Tax for private schools.  There's also a headline that reads ""Premier League gave MPs £100,000 in tickets,"" with an image of a football field, indicating an article about the financial relationship between the Premier League and Members of Parliament.  The bottom of the cover includes additional headlines and images, each likely corresponding to an article within the publication. The overall style of the cover is typical of a newspaper or magazine, with a mix of text and images designed to attract readers' attention and provide a glimpse into the content"
image_7_3.jpg,Front page of the Daily Star,PM's call for calm and 'private school VAT delay',"The image is a cover of the Daily Star Sunday newspaper, dated October 6, 2014. The cover is dominated by a large headline that reads ""Psychic beaten up by haunted doll."" Below the headline, there's a smaller text that says ""FREE INSIDE WORLD EXCLUSIVE,"" indicating that the content is exclusive to the Daily Star Sunday.  The central visual element is a photograph of a doll that appears to be haunted. The doll is depicted with a distressed expression, and its hair is disheveled, suggesting it has been through a traumatic event. The doll is wearing a red dress with a lace collar, and there are cobwebs around it, further emphasizing the haunted theme.  In the bottom left corner, there's a smaller image of a man with a smile, presumably the psychic mentioned in the headline. The man is wearing a pink shirt and has short hair. His image is smaller and less detailed compared to the doll, which is the main focus of the cover.  The Daily Star Sunday logo is visible at the top of the cover, along with the date ""Sunday, October 6, 2014."" The overall style of the image is typical of tabloid newspapers, with bold headlines and dramatic imagery designed to attract readers' attention."
image_7_4.jpg,News Daily banner,PM's call for calm and 'private school VAT delay',"The image you've provided appears to be a simple graphic with a horizontal color bar. The bar is divided into two distinct colors: the top portion is a vibrant orange, and the bottom portion is a deep black. The colors are flat and there is no gradient or shading, which gives the image a clean and minimalist aesthetic. The bar itself is straight and horizontal, with no curvature or irregularities. The image does not contain any text or additional elements, and the style is reminiscent of a digital color picker tool or a simple color swatch."
image_7_5.jpg,Front page of the Sunday Telegraph,PM's call for calm and 'private school VAT delay',"The image you've provided appears to be a screenshot of a newspaper article from ""The Sunday Telegraph."" The article is titled ""Reeves's plans spell mortgage misery"" and discusses a housing market situation. The headline is prominent and suggests a negative impact on mortgages.  The article includes a photograph of two individuals, a man and a woman, who seem to be posing for the picture. The man is on the left and the woman is on the right. They are both smiling and appear to be in a social setting, possibly at an event or gathering. The woman is wearing a black dress, and the man is dressed in a patterned shirt.  The newspaper layout includes various elements typical of a print media design. There are columns of text, with the main article occupying the central space. The text is too small to read in detail, but it's clear that it's part of the article discussing the housing market. There are also smaller sections with headlines and images, suggesting additional content within the newspaper.  The overall style of the image is that of a digital representation of a printed newspaper, with a focus on the article and the accompanying photograph. The image is designed to mimic the look of a physical newspaper, with text and images arranged in a way that would be familiar to readers of print media."
image_7_6.jpg,Front page of the Sunday Mirror,PM's call for calm and 'private school VAT delay',"The image is a cover of a magazine titled ""Mirror."" The cover features a man and a woman in a close embrace, both smiling and looking directly at the camera. The man is wearing a dark shirt and the woman is dressed in a green dress. They appear to be in a warm, indoor setting with soft lighting.  The magazine cover includes various headlines and advertisements. One headline reads ""SCREENING GIVES NEW HOPE,"" suggesting a feature on medical screenings and their benefits. Another headline states ""GAME-CHANGER CANCER TEST,"" indicating an article about a new cancer detection method. There's also an advertisement for a ""HALF PRICE MIRROR"" offer, and another for ""FREE Premier League Official Trading Cards from Pannini.""  The cover also includes a section titled ""EXCLUSIVE,"" which likely contains a feature story or interview. The overall style of the image is typical of a tabloid or celebrity magazine, with a focus on human interest stories and advertisements."
