article_number,image number,alt,article_heading
1,1,no alt,The Crown (Full Episode) | Savage Kingdom
2,1,no alt,Americans Try BRITISH Treats for the First Time
3,1,no alt,A Royal Walk Through The Great British Wilds | American Viscountess
4,1,no alt,Kate’s hugs for teenage photographer with cancer after day at Windsor ceremony
5,1,no alt,The Medieval Castle That Saw The Murder Of The King Of England | American Viscountess | Real Royalty
6,1,no alt,How to get a glimpse of the Royal family’s life behind closed doors
7,1,no alt,29 of the most iconic royal wedding pictures ever
8,1,no alt,How the sun will set on the British Empire for the first time in 200 years
9,1,no alt,Boris Johnson makes Harry and Meghan joke in first-look at memoir interview
10,1,no alt,Labour has settled one of the last remaining wrongs of British colonial rule
